text,sector_code,Housing DK,Homelessness DK,Transitional DK,Incremental DK,Social DK,Market DK,Urban DK,Rural DK,thoughts AI,Housing AI,Homelessness AI,Transitional AI,Incremental AI,Social AI,Market AI,Urban AI,Rural AI
Strengthening civic participation of inhabitants and their grass roots organisations in slum areas of Recife,15150,False,False,False,False,False,False,True,False,"The title mentions 'strengthening civic participation of inhabitants and their grassroots organizations in slum areas of Recife.' This suggests an engagement with communities living in informal settlements, which are often characterized by inadequate housing conditions. The focus on civic participation implies efforts to empower residents, possibly through initiatives that improve or upgrade their living environments. Given the context of 'slum areas,' this aligns closely with activities related to slum upgrading and neighborhood integration, both of which fall under the 'Incremental' class as they involve improving existing housing conditions incrementally. Additionally, since Recife is an urban area, the activity also fits within the 'Urban' classification due to its specific location in a city.",False,False,False,True,False,False,True,False
"APPUI AUX FAMILLES MILITAIRES DES CAMPS DE KINDU (2IÈME PHASE) ET LOKANDU - FAMIKI II/FAMILO België heeft militaire partnerschappen (Programme de Partenariat Militaire - PPM), met verschillende landen in Afrika, teneinde er ter plaatse de hervorming van de veiligheidssector te ondersteunen en mee te werken aan de oprichting van een professioneel nationaal leger, dat ten diensten staat van haar bevolking en de mensenrechten eerbiedigt. Het militaire partnerschap met de Democratische Republiek Congo omvat vooral de vorming van, toezicht op en evaluatie van een 'URR' brigade (Unité de Réaction Rapide  - een soort paracommando's) bestaande uit drie elite bataljons (321e, 322e en 323e Bataillons de Réaction Rapide) te Kindu, naast de vorming, de begeleiding en evaluatie van de onderrichters van de Militaire Academie van Kananga en van de Genieschool in Likasi. Het 321e bataljon werd eind 2008-begin 2009 gevormd te Kananga, het 322e bataljon eind 2011-begin 2012 te Kindu en tenslotte het 323e bataljon in de loop van 2013 te Kindu. Blijft nog de vorming van de staf van de brigade die de drie gevormde elite bataljons zal omkaderen. Wanneer een militair in de Democratische Republiek Congo een standplaats krijgt toegewezen om er tijdelijk te verblijven, trekt zijn gezin bijna altijd mee. Deze verplaatsingen resulteren vaak in moeilijke levensomstandigheden voor de families. Die families dienen op zoek te gaan naar een onderkomen, naar gezondheidszorgen, naar een school voor hun kinderen en naar landbouwgrond om voedsel te kunnen produceren. Dit gebeurt vaak ten koste van de lokale populatie met conflicten als gevolg. Om aan deze tendens een halt toe te roepen, willen de Congolese regering en de Stafdienst van het leger (FARDC – Forces Armées de la République Démocratique du Congo) de militairen en hun gezin een vaste woonplaats bezorgen. Het is de bedoeling de militairen te huisvesten in garnizoensteden verspreid over het hele land. Zo zullen de militairen die op missie vertrekken, gerust gesteld zijn dat hun familie veilig en degelijk gehuisvest is.Kindu gelegen in de provincie Maniema is één van die garnizoensteden. De drie door België opgeleide bataljons worden gehuisvest te Kindu en omgeving, meer bepaald het 321e bataljon in het militaire kamp Lwama, het 322e bataljon in het militaire kamp Lokandu en het 323e bataljon in het militaire kamp Jericho.Nu bevonden deze militaire kampen zich in een lamentabele toestand wegens verwaarlozing ingevolge de oorlogen die de DRC de laatste jaren had gekend. De Belgische defensie in zijn partnerschapsakkoord met de DRC voorziet in de rehabilitatie van de infrastructuur van die kampen maar er waren onvoldoende fondsen voorzien voor de huisvesting van de militairen. Bijgevolg werd aan onze FOD Buitenlandse Zaken, Buitenlandse Handel en Ontwikkelingssamenwerking in het kader van een 3D benadering (défence, diplomatie et développement) gevraagd financieel bij te dragen voor de rehabilitatie van de huisvesting in deze kampen. In een eerste fase werd besloten het kamp Lwama te Kindu te rehabiliteren. GENERAL PURPOSE:  Contribuer à la consolidation de la sécurité avec le rétablissement de l'Autorité de l'Etat dans la partie EST de la RDC et dans la province du Maniema en particulier.SPECIFIC RESULTS:  Volet A: FAMIKI IIR1. Des logements décents pour 223 militaires et leur familles sont construits ,R2. L'accès à l'eau potable pour les familles du camp est assuré ,R3. Des activités sociales, y compris des activités génératrices de revenus, sont fournies et pérennisées.Volet B : FAMILOR4. Des logements décents sont construits pour 200 familles de militaires ,R5. L'accès à l'eau potable pour les familles du camp est assuré.SPECIFIC PURPOSE:  Les conditions de vie des familles des militaires des camps de Kindu et Lokandu ainsi que des populations avoisinantes sont améliorées.",16040,True,False,False,False,False,False,True,False,"The text describes a project aimed at improving the living conditions for military families in specific locations within the Democratic Republic of Congo, particularly focusing on housing and infrastructure rehabilitation. The initiative involves constructing decent housing for military personnel and their families, ensuring access to potable water, and providing social activities including income-generating opportunities. This aligns with several classes from the expanded definition of the housing sector:

1. **Housing**: The text explicitly mentions the construction of decent housing for military families, which falls under the provision of housing.
2. **Transitional**: While not directly mentioned as emergency or temporary shelters, the context implies that these are transitional solutions to improve living conditions until more permanent arrangements can be made.
3. **Urban**: The activities are described in specific urban locations such as Kindu and Lokandu, which are garnison towns (garrison towns) within the country.

The text does not explicitly mention homelessness, incremental housing improvements, social housing models like community land trusts or cooperative housing, market-rate housing initiatives, or rural settings. Therefore, these classes do not apply based on the given definitions.",True,False,True,False,False,False,True,False
E+ KA1 EA JOINT MASTERS PROGRAMMES (EPMC) A3 MUNDUS URBANO Master of Science in International Cooperation and Urban Development,11420,False,False,False,False,False,False,True,False,"The title provided is for a joint master's program focused on 'International Cooperation and Urban Development.' The key terms here are 'Urban Development,' which directly relates to the 'Urban' class as it involves activities or studies related to urban areas. Additionally, 'International Cooperation' suggests a broader scope that might include various aspects of development, but there is no explicit mention of housing provision, homelessness, transitional shelters, incremental improvements, social housing models, market-rate housing, or rural activities in the title itself. Therefore, based on the given definitions and the text provided, the most relevant classification would be 'Urban' due to its direct connection with urban development.",False,False,False,False,False,False,True,False
"CHONGQING INTEGRATED LOGISTICS DEMONSTRATION The project will develop a modern and efficient multimodal logistics system in Chongqing. The outputs of the project will be (i) the Chongqing transportation logistics park, (ii) the Nanpeng logistics park, (iii) the Yangtze River inland waterway roll-on roll-off (Ro-Ro) operations, (iv) a logistics information system, and (v) institutional capacity building. The proposed project is the third urban development project in Chongqing. Lessons from past and ongoing projects were incorporated in the project design, such as devolving more responsibilities to the implementing agency while strengthening its project management and financial management capacity. The proposed project will have demonstration features, namely integrated logistics parks, logistics information system, and inland waterway Ro-Ro operations. These features are all relatively new for logistics projects in the PRC, and their successful introduction through this project will offer opportunities for replication and scaling up. Integrated logistics functions and services in the new logistics parks will reduce wasteful freight movements. Logistics information services will enable logistics service providers, such as freight forwarding companies, to increase efficiency and reduce costs through better tracking and control over the supply chain. Ro-Ro operations will reduce the time and costs of transshipments, incentivizing freight movement on inland waterways.",21040,False,False,False,False,False,False,True,False,"The text describes a project focused on developing an integrated logistics system in Chongqing, which includes transportation logistics parks, logistics information systems, and Ro-Ro operations along the Yangtze River. The mention of 'urban development' is explicit, indicating that this project falls under activities related to urban areas. There are no direct references to housing, homelessness, transitional shelters, incremental housing improvements, social housing models like community land trusts or cooperative housing, market-rate housing, or rural activities. Therefore, the most relevant classification based on the provided definitions and text content is 'Urban'.",False,False,False,False,False,False,True,False
USAID/OFDA GRANT FOR FIJI/CYCLONE-2016 Shelter and Settlements Intervention with IFRC in Fiji,72010,False,False,True,False,False,False,False,False,"The title mentions a USAID/OFDA grant for shelter and settlements intervention following Cyclone-2016 in Fiji, in collaboration with the International Federation of Red Cross (IFRC). The key terms here are 'shelter' and 'settlements,' which suggest activities related to providing housing or temporary living arrangements post-disaster. Given that this is a response to a cyclone, it likely involves emergency measures. This context aligns well with the 'Transitional' class due to the mention of shelters in an emergency setting. The involvement of IFRC and the focus on settlements also suggest activities related to upgrading inadequate housing or providing temporary supportive housing, which fits within the 'Housing' category as well. There is no explicit mention of homelessness, incremental improvements, social housing, market-rate housing, specific urban locations, or rural areas in the title, so these classes do not seem applicable.",True,False,True,False,False,False,False,False
ACCORD CADRE CR 2017-2019 Construire des habitations durables à 350 ménages à Ronkh pour mieux les protéger contre les intempéries,16040,True,False,False,False,False,False,False,False,"The title 'Construire des habitations durables à 350 ménages à Ronkh pour mieux les protéger contre les intempéries' translates to 'Building durable homes for 350 households in Ronkh to better protect them against the weather.' This description explicitly mentions the construction of housing, which aligns with the definition provided for the 'Housing' class. The focus on building durable homes suggests an emphasis on upgrading inadequate housing or constructing new housing to improve living conditions and resilience against environmental factors. There is no mention of homelessness, transitional shelters, incremental improvements, social housing models like community land trusts or cooperative housing, market-rate housing, specific urban locations (beyond the general reference to Ronkh), or rural activities in a way that would fit other classes. Therefore, the most fitting classification for this activity is 'Housing.'",True,False,False,False,False,False,False,False
"ICRC - PROVISION OF SHELTER, FOOD, WATER AND SANITATION To deliver an effective response to the basic needs of vulnerable people impacted by the crisis in the North East of Nigeria. The programme will deliver humanitarian assistance in nutrition and food security, protection and Education in Emergencies, multi",99810,True,False,True,False,False,False,False,False,"The text describes a program by ICRC focusing on delivering shelter among other essentials like food, water, and sanitation to vulnerable people affected by a crisis in North East Nigeria. The mention of 'provision of shelter' aligns with the definition for the 'Housing' class as it involves providing housing or shelter during emergencies. There is no explicit mention of homelessness, transitional shelters, incremental improvements, social housing models, market-based solutions, specific urban locations, or rural areas in this context. Therefore, based on the given definitions and text, only the 'Housing' classification seems to match.",True,False,False,False,False,False,False,False
"BUILDING HOST CENTRES FOR CHILDREN MONTE CARMELO Se quiere construir una casa de acogida para 60 niños dalits y de comunidades tribales. La intención no es solo dotarles de una vivienda digna, sino facilitarles el acceso a la educación. La mayoría de ellos no son huérfanos, pero sus padres viven en zonas rurales tan apartadas que no pueden desplazarse diariamente al colegio. El nuevo edificio se distribuiría en dos plantas y contaría con comedor, sala de estudio, dormitorio y taquillas. El proyecto consiste en: Construcción de dos salas, cada una de 10x20 m, división de la planta baja en dos espacios (comedor y sala de estudio), vestuario y dormitorio en la sala del primer piso.",11120,True,False,False,False,False,False,False,True,"The text describes the construction of a host center for children from dalit and tribal communities in rural areas, with the aim to provide them dignified housing and facilitate access to education. The project involves building two floors with specific facilities such as a dining area, study room, dormitory, and lockers. This description aligns with several classes:

1. **Housing**: The text explicitly mentions constructing a host center which includes providing living spaces (dormitories) for children, fitting the definition of housing provision.
2. **Rural**: The project is aimed at children whose parents live in rural areas that are too remote to allow daily travel to school, indicating activities focused on rural locations.

The text does not mention homelessness, transitional shelters, incremental improvements, social housing models like community land trusts or cooperative housing, market-rate housing solutions, or specific urban activities. Therefore, these classes do not apply.",True,False,False,False,False,False,False,True
"ACCESS TO DRINKING WATER IN 210 HOUSES IN THE TOWN OF PAXOT 2, QUICHE El proyecto pretende resolver la insalubridad de las viviendas de 210 familias de Paxot II, mediante la dotación de agua potable para reducir el impacto de las enfermedades derivadas del consumo de agua contaminada. El sistema de abastecimiento será por perforación de un pozo artesanal y el mantenimiento de la red mediante una cuota familiar mensual.",14030,True,False,False,False,False,False,False,False,"The text describes a project aimed at improving the living conditions of 210 families in Paxot II by providing access to drinking water. The focus is on addressing health issues caused by contaminated water through the installation of an artisanal well and maintaining a water distribution network with a monthly family fee. While this initiative directly impacts housing quality, it does not explicitly mention any construction or upgrading of housing structures themselves. Instead, it focuses on improving basic services within existing homes. The project is located in Paxot II, which could be considered either urban or rural depending on the specific characteristics of the area, but the text does not provide enough detail to definitively classify it as such. Therefore, based on the definitions provided, this activity aligns most closely with 'Housing' due to its focus on improving living conditions through basic services.",True,False,False,False,False,False,False,False
Fighting structural hindrances regarding the access to dignified living space in rural areas of Argentina,15150,True,False,False,False,False,False,False,True,"The text mentions 'structural hindrances regarding the access to dignified living space,' which suggests a focus on improving housing conditions or addressing inadequacies. The mention of 'rural areas' directly points towards activities occurring in non-urban settings. There is no explicit reference to homelessness, transitional shelters, incremental improvements, social housing models like community land trusts or cooperative housing, or market-based approaches such as mortgages or rent-to-own schemes. Therefore, the most relevant classifications based on the definitions provided are 'Housing' due to the focus on improving living conditions and 'Rural' because of the specific mention of rural areas in Argentina.",True,False,False,False,False,False,False,True
Support centre for street children in Bangladesh.,11120,False,False,False,False,False,False,True,False,"The description mentions a support center for street children, which does not explicitly relate to any housing provision or shelter directly associated with the defined classes such as Housing, Homelessness, Transitional, Incremental, Social, Market, Urban, or Rural. However, considering that street children often lack stable housing and may be at risk of homelessness, there could be an indirect connection to 'Homelessness' if the support center provides some form of temporary shelter or emergency accommodation. The context does not specify any urban or rural setting explicitly, nor does it mention transitional shelters, incremental housing services, social housing models, market-based solutions, or specific construction activities related to housing.",False,True,False,False,False,False,False,False
"THE WAY FORWARD FOR REFORMS IN THE HOUSING SECTOR: EMPOWERING GRASSROOT  HOMEOWNERS ASSOCIATIONS IN AZERBAIJAN, BELARUS, GEORGIA, MOLDOVA  AND UKRAINE The overall objective is to strengthen and promote the role of CSOs in grass-root decision-making processes in the housing sector in AZ, BY, GE, MD and UA.",16030,True,False,False,False,False,False,False,False,"The text describes an initiative aimed at reforming the housing sector by empowering grassroots homeowners associations across several countries: Azerbaijan, Belarus, Georgia, Moldova, and Ukraine. The focus is on strengthening civil society organizations (CSOs) in decision-making processes related to housing. This suggests a broad engagement with housing issues, including policy and community involvement. There are no explicit mentions of homelessness, transitional shelters, incremental improvements like slum upgrading or structural repairs, social housing models such as cooperative housing, market-rate housing activities, or specific urban or rural locations. The emphasis on CSOs in decision-making processes aligns closely with the 'Housing' category due to its focus on policy and community empowerment within the sector.",True,False,False,False,False,False,False,False
Provision of integrated health services for the newly arrived South Sudanese refuges in White Nile and South Kordofan,72010,False,False,False,False,False,False,False,False,"The text describes the provision of integrated health services specifically for newly arrived South Sudanese refugees located in White Nile and South Kordofan. The focus is on health services rather than housing or shelter directly, but it mentions a specific group (refugees) which can imply some form of transitional living situation. However, there's no explicit mention of emergency shelters, refugee camps, or temporary supportive housing that would classify it as 'Transitional'. Additionally, the text specifies locations in White Nile and South Kordofan, which are known to be rural areas, suggesting a potential match with the 'Rural' classification. There is no direct reference to any other classes such as Housing, Homelessness, Incremental, Social, Market, or Urban.",False,False,False,False,False,False,False,True
URBAN DEVELOPMENT AND POOR NEIGHBORHOOD UPGRADING PROJECT,14020,False,False,False,True,False,False,True,False,"The title 'URBAN DEVELOPMENT AND POOR NEIGHBORHOOD UPGRADING PROJECT' suggests a focus on improving living conditions in urban areas, particularly targeting neighborhoods that are underdeveloped or inadequate. The term 'urban development' aligns with activities related to housing and infrastructure improvements within cities. 'Poor neighborhood upgrading' indicates efforts to enhance existing structures and services, which can be linked to slum upgrading and potentially incremental improvements. This suggests a focus on improving the quality of life in urban settings through targeted interventions. Given these considerations, the relevant classes are likely to include 'Housing', due to the general theme of development and improvement; 'Incremental', because neighborhood upgrading often involves gradual enhancements; and 'Urban', as the activities are explicitly situated within an urban context.",True,False,False,True,False,False,True,False
"UNRWA AGREEMENT 2017-2019 - UNRWA AGREEMENT 2017-2019 (NEW STRATEGY) The proposed interventions will provide humanitarian assistance to Palestine refugees in Jordan, Lebanon, Syria and Palestine affected by the armed conflict in Syria and armed conflict and occupation in Palestine.In response to the humanitarian needs created by the armed conflict in Syria, UNRWA will implement a humanitarian response meeting shelter, education, food security, non-food items, health, livelihoods and protection needs. UNRWA will provide humanitarian assistance to 450,000 refugees remaining in Syria and to the refugees that have fled to Lebanon (31,000 people) and Jordan (16,000 people).In response to the humanitarian needs created by armed conflict and occupation in the oPt, UNRWA will respond to shelter (emergency shelter repair and transitional shelter), education, food security, health, environmental health, livelihoods, psychosocial and protection needs.The total budget for UNRWA's Syria crisis appeal for 2017 was USD 411,005,236 to which Sida contributed SEK 40 million. The total budget for the UNRWA's oPt crisis appeal was USD 402,391,857 for 2017, to which Sida contributed SEK 30 million. The total budget for UNRWAs Emergency appeal for the Syria crisis 2018 is USD 408,958,394 to which Sida is proposed to contribute SEK 25 million. For the Emergency appeal for oPt the budget for 2018 is USD 398,806,944 to which Sida is proposed to contribute SEK 34 million.It is also agreed that Sida will contribute SEK 5 million in 2019 for UNRWA humanitarian interventions in the Syria and oPt crises.",72010,True,False,True,False,False,False,False,False,"The text describes various humanitarian activities carried out by UNRWA, focusing on providing assistance to Palestine refugees affected by conflicts in Syria and the occupied Palestinian territories (oPt). The description includes several aspects of shelter provision: emergency shelter repair, transitional shelter, and general humanitarian needs such as education, food security, health, livelihoods, and protection. These activities align with specific classes within the housing sector continuum.

1. **Housing**: The text mentions 'emergency shelter repair' and 'transitional shelter,' which fall under the provision of housing in emergency contexts. This directly relates to the class definition for Housing as it involves upgrading inadequate housing and providing shelter during emergencies.

2. **Transitional**: The mention of 'transitional shelter' explicitly fits within this category, as transitional shelters are temporary accommodations provided to people displaced by conflict or disaster until more permanent solutions can be found.

3. **Urban/Rural**: While the text does not specify particular urban or rural locations, it mentions regions like Jordan, Lebanon, Syria, and Palestine (oPt). These areas have both urban and rural settings where UNRWA operates, but without explicit mention of specific activities in either setting, this classification is less certain.

The other classes such as Homelessness, Incremental, Social, Market, do not explicitly match any descriptions within the text. The focus remains on emergency and transitional shelter solutions rather than permanent housing or market-based interventions.",True,False,True,False,False,False,False,False
