text,sector_code,Housing DK,Homelessness DK,Transitional DK,Incremental DK,Social DK,Market DK,Urban DK,Rural DK,thoughts AI,Housing AI,Homelessness AI,Transitional AI,Incremental AI,Social AI,Market AI,Urban AI,Rural AI
"CONSTRUCTION AND EQUIPPING OF SCHOOLS IN TAMANSOURT - TAMESNA Building and equipping 75 primary, elementary, and secondary schools and integrated educational centers , as well as providing the necessary equipment for classrooms, teaching aids, school and office furniture, computers, indoor housing furniture and sports facilities, as well as engineering design and supervision of implementation",11120,False,False,False,True,True,False,True,False,"The text describes a project focused on the construction and equipping of schools in Tamansourt-Tamesna. It details the building and equipping of 75 educational institutions including primary, elementary, and secondary schools along with integrated educational centers. The provision includes classroom equipment, teaching aids, furniture for classrooms and offices, computers, indoor housing furnishings, sports facilities, as well as engineering design and supervision.

Analyzing this description against the defined classes:
- **Housing**: While there is mention of providing 'indoor housing furniture,' the primary focus is on educational infrastructure rather than residential housing or shelter provision. Thus, it doesn't explicitly fall under activities like upgrading inadequate housing, construction of housing, or urban development in a housing context.
- **Homelessness**, **Transitional**, **Incremental**: These classes are related to shelters and transitional accommodations for displaced individuals or slum upgrades, none of which is relevant here as the focus is strictly on educational infrastructure.
- **Social**, **Market**: These involve community land trusts, cooperative housing, public housing, or market-related activities like home rentals and mortgages. The text does not address these aspects within a housing framework.
- **Urban/Rural**: While the location (Tamansourt-Tamesna) could be classified as either urban or rural, the context provided does not explicitly describe any specific location characteristics necessary to categorize it definitively under 'urban' or 'rural'.

Therefore, none of the descriptions match the expanded definition of housing sector classes given in the prompt.",False,False,False,False,False,False,False,False
"The primary purpose of the Community Connections program (CCP) is to improve the health and wellbeing of people with complex needs who are homeless or at housing risk by proactively identifying, engaging and linking them to appropriate mainstream and/or specialise services. The CCP will target people who require an assertive outreach response in order to gain access to specialist and mainstream services.  On a strategic level the CCP will also work with local services to assist them to become more accessible and responsive to the needs of this vulnerable population group.",15150,False,True,False,False,False,False,False,False,"The description provided focuses on improving health and wellbeing for people who are homeless or at risk of homelessness by linking them to appropriate services. This suggests a direct connection with the 'Homelessness' class, as it deals explicitly with those experiencing homelessness or housing instability. The mention of assertive outreach also hints at providing support mechanisms which can align with 'Transitional' efforts such as connecting individuals to emergency shelters or temporary supportive housing. However, there is no explicit mention of these transitional facilities in the text. The strategic work to make local services more accessible and responsive does not explicitly match any other classes like 'Social,' 'Market,' 'Urban,' or 'Rural.' It's also not directly related to providing or upgrading physical housing structures (like 'Housing'), nor is it about incremental improvements or specific community models ('Incremental' or 'Social'). Overall, the primary focus of the text aligns most closely with addressing homelessness and potentially transitional support.",False,True,False,False,False,False,False,False
construction of residential complex in um qasar ' albaheath',16040,True,False,False,False,False,False,True,False,"The given text mentions the 'construction of a residential complex,' which aligns with one of the definitions provided under the 'Housing' category, as it describes the construction of housing. The mention of 'um qasar 'al-baheeth'' suggests an urban location since such identifiers typically refer to specific places within cities or towns. Therefore, this text also matches the definition for 'Urban.' There are no explicit mentions related to homelessness, transitional shelters, incremental improvements, social housing models like community land trusts or cooperative housing, market-based activities like mortgages or rent-to-own schemes, or rural settings.",True,False,False,False,False,False,True,False
"ESRCDFID DEV FRONTIERS 16/17 Development frontiers in crime, livelihoods and urban poverty in Nigeria (FCLP)",43082,False,False,False,False,False,False,True,False,"The title describes a project focused on development frontiers concerning crime, livelihoods, and urban poverty in Nigeria. There is no explicit mention of housing or shelter-related terms such as 'provision of housing,' 'homeless shelters,' or similar keywords that would directly align with the classes described under 'Housing,' 'Homelessness,' 'Transitional,' etc.

The inclusion of 'urban poverty' suggests a potential connection to urban settings, which could hint at 'Urban.' However, this is only an indirect implication without explicit mention of activities specifically within urban areas. The focus on crime and livelihoods might involve broader socio-economic factors rather than direct housing interventions or solutions.

Other classes such as 'Homelessness,' 'Transitional,' 'Incremental,' 'Social,' 'Market,' and 'Rural' do not appear to be applicable based on the explicit keywords described in their definitions. Without more specific information about activities, projects, or initiatives within this study, it is challenging to definitively classify it under any of these categories.",False,False,False,False,False,False,True,False
2019 ECUADOR SCHOOL WORKSHOP OF MANABI AND IMPROVEMENT OF ENVIRONMENTAL SUSTAINABILITY Apoyo a la construcción sostenible a través de la Escuela Taller de Manabí y el fortalecimiento de la cadena productiva de la constr ucción con bambú,16040,False,False,False,False,False,False,False,False,"The title describes a workshop in Ecuador focused on sustainable construction using bamboo and involves the School Workshop of Manabi. The text mentions 'construcción sostenible' (sustainable construction) which is related to housing provision, especially in terms of upgrading or constructing new housing with sustainable materials. This aligns with the definition of the 'Housing' category. There's also an emphasis on improving environmental sustainability and strengthening the supply chain for bamboo construction. The specific mention of Manabi does not provide enough context to classify it as either urban or rural, given that it is a province rather than a type of setting. The text does not explicitly mention any aspect related to homelessness, transitional housing, incremental improvements in existing housing structures (like slum upgrading), social housing models like community land trusts or cooperative housing, market-related activities such as mortgages or rent-to-own housing arrangements, nor does it specify if the activities are targeted at urban or rural locations. Therefore, there is insufficient evidence in the text to classify it under those categories.",True,False,False,False,False,False,False,False
REFUGEES ESCAPE ROOM Título completo del proyecto: REFUGIADOS ESCAPE ROOM :: IMPLEMENTAR UNA ESCAPE ROOM COMO ESPACIO INTERACTIVO PARA EMPATIZAR CON LA POBLACION SOMETIDA A DESASTRES NATURALES O HUMANOS Y SE HAN VISTO OBLIGADAS A SALIR DE SU PAIS,99820,False,False,False,False,False,False,False,False,"The title 'REFUGEES ESCAPE ROOM' refers to a project implementing an interactive escape room space designed to foster empathy with populations affected by natural or human-made disasters and who have been forced to leave their country. This context implies involvement with refugees, which typically involves emergency shelters, refugee camps, or temporary supportive housing. The concept of 'escape room' is metaphorical here, aimed at creating awareness rather than providing physical shelter. Therefore, this project may align with the 'Transitional' class due to its focus on empathy and understanding for displaced populations, though it does not directly address provision of shelters.",False,False,True,False,False,False,False,False
Promoting the human right to adequate housing for the most marginalised among the poor in India,15150,True,False,False,False,False,False,False,False,"The text mentions promoting the human right to adequate housing, which suggests an effort related to providing or improving housing conditions. This aligns with the 'Housing' class as it involves activities such as provision of housing and upgrading inadequate housing. The focus on the most marginalized among the poor may imply addressing issues in underprivileged areas, potentially both urban and rural settings, but without explicit mention, we cannot definitively classify it under 'Urban' or 'Rural'. There is no specific reference to homelessness shelters, transitional accommodations like refugee camps, incremental improvements such as slum upgrading, social housing models like public housing, market-rate activities, or geographical focus on specific urban or rural locations.",True,False,False,False,False,False,False,False
"NOM DE L'ORGANISME : NOUVELLE PLANÈTE / PROJET : MISE EN PLACE D'UNE ADDUCTION D'EAU GRAVITAIRE POUR 5'000 HABITANTS L'objectif est de garantir l'accès à l'eau potable pour couvrir les besoins quotidiens des 5'000 habitants à proximité de leur habitation pendant toute l'année, afin de diminuer les trajets et le temps consacré par les femmes pour chercher l'eau et l'absentéisme des filles à l'école, de réduire la prévalence des maladies hydriques liées à la mauvaise qualité de l'eau, de permettre aux femmes de se consacrer aux activités génératrices de revenus, d'améliorer la qualité de vie des villageois et de luttre contre l'exode rural. Le projet prévoit la construction de l'adduction d'eau comprenant 8 bornes-fontaines et un lavoir, la création , structuration et renforcement des capacités du comité de l'eau, ainsi que des formations en technique/entretien de deux techniciens locaux. Les villageois concernés seront sensibilisés à l'entretien, l'hygiène et l'assainissement.",14030,True,False,False,False,False,False,False,True,"The project described is focused on providing access to potable water for a rural community of approximately 5,000 people by constructing an adduction d'eau gravitaire (gravity-fed water supply system). The main goals include reducing the time spent fetching water, particularly impacting women and school attendance for girls, reducing waterborne diseases, enabling women to focus on income-generating activities, improving quality of life, and combating rural exodus. Key components of the project are the construction of water distribution points (bornes-fontaines), a washing facility (lavoir), and training initiatives for local technicians, alongside community sensitization efforts about maintenance, hygiene, and sanitation.

The text does not explicitly describe activities related to housing provision, homelessness shelters, emergency or temporary housing, slum upgrading, cooperative or public housing arrangements, urban market-rate developments, specific mortgage solutions, or any of the other direct classifications under 'Housing' or 'Homelessness'. However, it implicitly supports improved living conditions in a rural setting by addressing water access and related quality-of-life issues. The focus on infrastructure development for water supply within a rural area aligns with the definition of activities happening specifically in rural locations.",False,False,False,False,False,False,False,True
WARM WINTER FOR OLD PEOPLE emergency assistance to the most vulnerable people in temporary accommodation,16010,False,False,True,False,False,False,False,False,"The description provided is 'WARM WINTER FOR OLD PEOPLE emergency assistance to the most vulnerable people in temporary accommodation.' The focus seems to be on providing immediate, short-term support for older individuals who are currently living in temporary housing situations. This aligns with elements of the 'Transitional' category since it involves 'emergency shelters' or 'temporary supportive housing,' which are mentioned as examples under this class. There is no explicit mention of homelessness, social housing structures like community land trusts or cooperative housing, market-rate activities, specific urban or rural locations, or any incremental improvements to existing housing. Therefore, the primary classification should be 'Transitional.'",False,False,True,False,False,False,False,False
"SHELTER, PROTECTION AND HEALTH SUPPORT TO DISPLACED AND THE MOST VULNERABLE PEOPLE AFFECTED BY CYCLONE IDAI",72050,False,False,True,False,False,False,False,False,"The title mentions 'Shelter, Protection and Health Support to Displaced and the Most Vulnerable People Affected by Cyclone Idai.' Let's analyze this in relation to each class:

- **Housing**: The mention of 'shelter' could imply housing provision. However, it does not specify construction or upgrading of permanent housing.
- **Homelessness**: There is no direct mention of tents for the homeless, encampments, or shelters specifically for homelessness. The focus seems more on displacement due to a cyclone rather than urban homelessness.
- **Transitional**: The term 'displaced people' suggests temporary relocation solutions. This aligns with emergency shelters and temporary supportive housing, typical in transitional contexts like those affected by natural disasters.
- **Incremental**: There is no mention of specific activities related to incremental classes such as slum upgrading or structural repairs.
- **Social**: No explicit mention of community land trusts, cooperative housing, or public housing.
- **Market**: There's no reference to home rental, mortgages, rent-to-own schemes, or market-rate housing.
- **Urban**: The text does not specify an urban location for these activities.
- **Rural**: Similarly, there is no specific mention of rural locations.

Given the context of displacement due to a cyclone and the need for shelter as part of immediate response efforts, 'Transitional' seems like the most fitting classification.",False,False,True,False,False,False,False,False
Infrastructure and Rural Finance Support Program (IRFSP),31120,False,False,False,False,False,False,False,True,"The title 'Infrastructure and Rural Finance Support Program (IRFSP)' suggests a focus on infrastructure development and financial support in rural areas, rather than directly addressing housing or specific categories within the housing sector. Let's break down the components:

1. **Infrastructure**: This term is broad and can encompass various types of physical structures like roads, bridges, water systems, etc., but it doesn't explicitly mention housing.
2. **Rural Finance Support**: Financial support in rural areas can be related to many sectors including agriculture, small businesses, or community development projects. It may indirectly affect the housing sector by improving economic conditions, but it's not specific enough to classify it directly under housing-related categories.
3. **Rural Context**: The term 'rural' indicates that activities occur in rural areas, which aligns with one of our classifications focusing on location.

Given these considerations, while the program isn't explicitly focused on any specific category like 'Housing', 'Social', or 'Market', it does relate to the rural context. Therefore, it may fit under the 'Rural' classification due to its focus on rural areas.",False,False,False,False,False,False,False,True
CHILD FRIENDLY CITIES INITIATIVE (CFCI) - UNICEF (CHILD FRIENDLY CITIES PROGRAMME) The initiative was launched in 1996 by UNICEF and UN-Habitat to act on the resolution passed during the second United Nations Conference on Human Settlements (Habitat II) to make cities liveable places for all. The UN Conference declared that the wellbein,15160,False,False,False,False,False,False,True,False,"The given text describes an initiative aimed at making cities more livable, indicating a focus on urban development. Although it mentions cities and refers to making them 'liveable,' there is no explicit mention of housing or any specific aspects such as provision, upgrading, or policy directly related to housing. However, the context suggests improvements in urban environments which can be linked with housing initiatives even if not explicitly stated. The text does not mention homelessness, transitional shelters, incremental changes like slum upgrades, social housing types like cooperative housing, market-rate housing mechanisms, or activities specifically targeting rural areas.",False,False,False,False,False,False,True,False
"ON THE GROUND OPERATIONAL COSTS IN SIERRA LEONE THROUGH THE PROJECT FIDUCIARY MANAGEMENT UNIT (PFMU) These expenses cover the various expenditures on the ground in Sierra Leone, such as material costs for the building of smoke oven shelters, salaries for staff on the ground in Sierra Leone, administrative costs for the PFMU at the Sierra Leone Ministry of Finance, and other costs.",14030,True,False,True,False,False,False,False,False,"The text describes various operational expenses related to a project in Sierra Leone focusing on 'the building of smoke oven shelters.' This implies an effort to provide some form of temporary or emergency sheltering solutions for individuals, likely in response to a need for housing support due to inadequate existing options. The mention of smoke ovens indicates it might be aimed at addressing basic living conditions where cooking facilities are necessary but traditional homes aren't feasible or available. These shelters can align with the 'Housing' category under emergency provision and sheltering solutions. Furthermore, there is no explicit mention of homelessness, transitional housing (such as refugee camps), incremental improvements (like slum upgrades), social housing models, market-based activities, specific urban locations, or rural locales beyond the general reference to Sierra Leone.",True,False,False,False,False,False,False,False
"EDMUND RICE DEVELOPMENT REINFORCING 'COVID 19 TRANSMIS ES AT RUBEN HEALTH CENTRE TO E NSURE CONTINUITY OF ROUTINE HE ALTH SERVICES IN MUKURU SLUM, PUB The Reinforcing 'covid 19 transmission' control measures at Ruben Health Centre to ensure continuity of routine health services in Mukuru slum, public health responses and social counter measures aims to carry out health activities to address the control of Covid-19 in Kenya.",12264,False,False,False,False,False,False,True,False,"The text describes a development activity focused on reinforcing COVID-19 transmission control measures at a health center located within the Mukuru slum. The primary objective is to ensure continuity of routine health services amidst the pandemic. Here's how this relates to each class:

- **Housing**: The project occurs in the Mukuru slum, indicating involvement with housing conditions as they relate to health service delivery, but it does not explicitly focus on improving or providing housing itself.
- **Homelessness**: There is no mention of tents for the homeless, encampments, or homeless shelters.
- **Transitional**: The project does not describe emergency shelters, refugee shelters, camps, or temporary supportive housing.
- **Incremental**: While slum upgrading might be relevant to broader health services continuity, there's no explicit focus on housing sites, services, technical assistance, structural repairs, or neighborhood integration related specifically to housing improvements.
- **Social**: There is no mention of community land trusts, cooperative housing, or public housing as part of the initiative.
- **Market**: The project does not describe home-rental, mortgages, rent-to-own housing, or market-rate housing activities.
- **Urban**: The activity explicitly mentions taking place in the Mukuru slum, which is an urban location. Thus, it fits into this category.
- **Rural**: There is no indication that the project involves rural locations.

Overall, the text primarily relates to an urban setting and indirectly addresses housing through its focus on health services in a slum area.",False,False,False,False,False,False,True,False
"ACCESS TO THE RIGHT TO A DECENT HOUSING AND BASIC SANITATION FOR 49 WOMEN AND THEIR FAMILIES IN A VULNERABLE SITUATION OF THE RURAL COMMUNITY OF H Título completo del proyecto: Acceso al derecho a la vivienda digna con saneamiento básico para 49 mujeres y sus familias en situación de vulnerabilidad de la comunidad rural de H.R. Palyam, área de Madakasira, distrito de Anantapur :: El proyecto plantea hacer efectivo el derecho a una vivienda digna con saneamiento básico proporcionándoles los recursos humanos, materiales y técnicos necesarios para la correcta construcción de viviendas. Se promueve la reducción de la discriminación que sufren las mujeres, aumentando su consideración social dentro de sus familias y comunidad.",16030,True,False,False,False,True,False,False,True,"The project description focuses on providing decent housing and basic sanitation to 49 women and their families in a vulnerable situation within a rural community. The primary activities include the construction of dignified housing, provision of necessary resources for proper housebuilding, and improving social considerations for women. This aligns well with several potential classifications:

1. **Housing**: The description explicitly mentions 'providing dignified housing' and constructing houses, which matches the definition related to construction and upgrading inadequate housing.
2. **Incremental**: The focus on providing resources and technical assistance for correct housebuilding can be associated with incremental approaches like housing services and structural repairs.
3. **Rural**: The project is set in a rural community (the community of H) which aligns with activities described specifically in rural locations.

The description does not mention any elements related to homelessness, transitional shelters, social land trusts, cooperative or public housing models, market-rate housing, rental systems, or specific urban areas. Therefore, these classifications do not apply.",True,False,False,True,False,False,False,True
"HUMANITARIAN ASSISTANCE FOR DISPLACED PEOPLE BECAUSE OF OTHER SITUATIONS OF VIOLENCE IN THE DEPARTMENT OF PETEN GUATEMALA Este proyecto responde a la situación de crisis humanitaria ocasionada por el desplazamiento masivo de población del norte de Centroamérica en situación de vulnerabilidad económica, social, ambiental y/o política que llega al Departamento de Petén (Guatemala) en su tránsito hacia México y los EE.UU. El proyecto se orienta a fortalecer las capacidades técnicas, estratégicas y materiales de las socias locales participantes en el proyecto para hacer frente a la creciente demanda de refugio por parte de la población migrante en tránsito, brindar refugio adecuado, a la vez que se atiende y apoya las solicitudes de refugio en coordinación con titulares de obligaciones. Asimismo, el proyecto incluye acciones de recogida de testimonio, incidencia y sensibilización en Guatemala y la CAV.",72010,True,False,True,False,False,False,False,False,"The text describes a humanitarian assistance project aimed at supporting displaced people due to violence in the Petén region of Guatemala. The focus is on addressing the humanitarian crisis caused by mass displacement from Northern Central America, with an emphasis on providing refuge and support for migrants passing through Guatemala en route to Mexico and the United States. Key elements include strengthening technical, strategic, and material capacities of local partners to meet growing demands for shelter, as well as coordinating refugee requests. The project involves setting up shelters and offering adequate refuge, which aligns with specific classifications. There is also a mention of activities related to testimonial collection, advocacy, and awareness in Guatemala and the CAV (Central American Verge), indicating efforts in an urban setting.",False,False,True,False,False,False,True,False
