text,sector_code,Housing DK,Homelessness DK,Transitional DK,Incremental DK,Social DK,Market DK,Urban DK,Rural DK,thoughts AI,Housing AI,Homelessness AI,Transitional AI,Incremental AI,Social AI,Market AI,Urban AI,Rural AI
"SHELTER, PROTECTION AND HEALTH SUPPORT TO DISPLACED AND THE MOST VULNERABLE PEOPLE AFFECTED BY CYCLONE IDAI",72050,False,False,True,False,False,False,False,False,"The title mentions providing shelter and support to displaced people affected by Cyclone Idai. This suggests a focus on temporary housing solutions for those who have been forced from their homes due to the cyclone, which aligns with the 'Transitional' class as it involves emergency shelters or similar temporary accommodations. The term 'shelter' in this context likely refers to immediate and short-term housing needs rather than permanent structures, fitting well within the definition of transitional housing. There is no explicit mention of homelessness, incremental improvements, social housing models, market-based solutions, or specific urban or rural settings, so these classes do not seem applicable based on the given text.",False,False,True,False,False,False,False,False
Infrastructure and Rural Finance Support Program (IRFSP),31120,False,False,False,False,False,False,False,True,"The title 'Infrastructure and Rural Finance Support Program (IRFSP)' suggests a focus on infrastructure development and financial support within rural areas. The mention of 'rural' directly aligns with the definition for the 'Rural' class, which encompasses activities in specific rural locations. However, there is no explicit mention of housing or related terms such as provision of shelter, upgrading inadequate housing, construction of housing, etc., that would classify it under 'Housing'. Similarly, there are no references to homelessness, transitional shelters, incremental housing improvements, social housing models, market-rate housing activities, or specific urban locations. Therefore, based on the given title and description, the most fitting classification is 'Rural' due to its explicit mention of rural areas.",False,False,False,False,False,False,False,True
CHILD FRIENDLY CITIES INITIATIVE (CFCI) - UNICEF (CHILD FRIENDLY CITIES PROGRAMME) The initiative was launched in 1996 by UNICEF and UN-Habitat to act on the resolution passed during the second United Nations Conference on Human Settlements (Habitat II) to make cities liveable places for all. The UN Conference declared that the wellbein,15160,False,False,False,False,False,False,True,False,"The text describes the Child Friendly Cities Initiative (CFCI), launched by UNICEF and UN-Habitat, aimed at making cities more livable for everyone. This initiative is linked to urban development as it focuses on improving city environments, which aligns with activities in specific urban locations. The mention of 'cities' suggests an urban context. There are no explicit mentions of housing provision, homelessness, transitional shelters, incremental improvements, social housing models, market-rate housing, or rural activities within the provided text. Therefore, based on the definitions and descriptions given, the most relevant classification is 'Urban'.",False,False,False,False,False,False,True,False
"ON THE GROUND OPERATIONAL COSTS IN SIERRA LEONE THROUGH THE PROJECT FIDUCIARY MANAGEMENT UNIT (PFMU) These expenses cover the various expenditures on the ground in Sierra Leone, such as material costs for the building of smoke oven shelters, salaries for staff on the ground in Sierra Leone, administrative costs for the PFMU at the Sierra Leone Ministry of Finance, and other costs.",14030,True,False,True,False,False,False,False,False,"The text describes operational costs related to a project in Sierra Leone that involves building 'smoke oven shelters.' The mention of 'shelters' suggests some form of housing or temporary accommodation provision. However, there is no explicit mention of emergency situations, transitional housing, or specific types like refugee camps or temporary supportive housing, which would classify it under 'Transitional.' Similarly, the text does not specify slum upgrading or neighborhood integration, which are key for 'Incremental' classification.

The term 'shelters' could imply a form of basic shelter provision, potentially aligning with 'Housing,' especially if these shelters serve as permanent housing solutions. However, without explicit mention of housing policy, technical assistance, or construction of housing in the traditional sense, this remains an assumption rather than a clear classification.

The text does not provide information about homelessness services like tents for the homeless or encampments, so it doesn't fit 'Homelessness.' There is no mention of community land trusts, cooperative housing, or public housing, which would be necessary for 'Social' classification. Similarly, there are no references to home-rental, mortgages, rent-to-own housing, or market-rate housing, ruling out the 'Market' class.

The project's location in Sierra Leone is mentioned, but it does not specify whether these activities occur in urban or rural settings, so we cannot definitively classify it under 'Urban' or 'Rural.'

Overall, the closest potential match based on the provided information is 'Housing,' due to the construction of shelters, which could be interpreted as a form of housing provision. However, this classification is tentative and relies on interpreting 'shelters' broadly within the context of housing.",True,False,False,False,False,False,False,False
"EDMUND RICE DEVELOPMENT REINFORCING 'COVID 19 TRANSMIS ES AT RUBEN HEALTH CENTRE TO E NSURE CONTINUITY OF ROUTINE HE ALTH SERVICES IN MUKURU SLUM, PUB The Reinforcing 'covid 19 transmission' control measures at Ruben Health Centre to ensure continuity of routine health services in Mukuru slum, public health responses and social counter measures aims to carry out health activities to address the control of Covid-19 in Kenya.",12264,False,False,False,False,False,False,True,False,"The provided text describes an initiative by Edmund Rice Development focused on reinforcing COVID-19 transmission control measures at Ruben Health Centre within Mukuru Slum. The primary goal is to ensure continuity of routine health services, which involves public health responses and social countermeasures related to controlling the spread of COVID-19 in Kenya.

To classify this text according to the given categories:
1. **Housing**: The text does not explicitly mention any activities directly related to housing provision, construction, upgrading, or policy.
2. **Homelessness**: There is no explicit reference to tents for the homeless, encampments, or shelters specifically for the homeless.
3. **Transitional**: While it involves a health center in a slum area, there's no mention of emergency shelters, refugee camps, or temporary supportive housing.
4. **Incremental**: The text does not explicitly describe activities like housing sites, technical assistance, slum upgrading, structural repairs, or neighborhood integration.
5. **Social**: There is no explicit reference to community land trusts, cooperative housing, or public housing.
6. **Market**: No mention of home-rental, mortgages, rent-to-own housing, or market-rate housing.
7. **Urban**: The activity takes place in Mukuru Slum, which is an urban location. This aligns with the definition provided for 'urban' activities.
8. **Rural**: There's no mention of specific rural locations; the focus is on an urban slum area.

Based on these considerations, the text primarily matches the 'Urban' category due to its explicit reference to Mukuru Slum, a known urban location.",False,False,False,False,False,False,True,False
"ACCESS TO THE RIGHT TO A DECENT HOUSING AND BASIC SANITATION FOR 49 WOMEN AND THEIR FAMILIES IN A VULNERABLE SITUATION OF THE RURAL COMMUNITY OF H Título completo del proyecto: Acceso al derecho a la vivienda digna con saneamiento básico para 49 mujeres y sus familias en situación de vulnerabilidad de la comunidad rural de H.R. Palyam, área de Madakasira, distrito de Anantapur :: El proyecto plantea hacer efectivo el derecho a una vivienda digna con saneamiento básico proporcionándoles los recursos humanos, materiales y técnicos necesarios para la correcta construcción de viviendas. Se promueve la reducción de la discriminación que sufren las mujeres, aumentando su consideración social dentro de sus familias y comunidad.",16030,True,False,False,False,True,False,False,True,"The project description focuses on providing decent housing and basic sanitation to women and their families in a vulnerable situation within a rural community. The key elements include the construction of housing with necessary resources and technical assistance, which aligns with the 'Housing' class definition as it involves the provision of housing and upgrading inadequate housing conditions. Additionally, since the project is located in a rural community, it fits the 'Rural' class due to its explicit mention of activities in a specific rural location. The description does not explicitly mention homelessness, transitional shelters, incremental improvements beyond construction, social housing models like cooperatives or public housing, market-rate housing initiatives, or urban settings.",True,False,False,False,False,False,False,True
"HUMANITARIAN ASSISTANCE FOR DISPLACED PEOPLE BECAUSE OF OTHER SITUATIONS OF VIOLENCE IN THE DEPARTMENT OF PETEN GUATEMALA Este proyecto responde a la situación de crisis humanitaria ocasionada por el desplazamiento masivo de población del norte de Centroamérica en situación de vulnerabilidad económica, social, ambiental y/o política que llega al Departamento de Petén (Guatemala) en su tránsito hacia México y los EE.UU. El proyecto se orienta a fortalecer las capacidades técnicas, estratégicas y materiales de las socias locales participantes en el proyecto para hacer frente a la creciente demanda de refugio por parte de la población migrante en tránsito, brindar refugio adecuado, a la vez que se atiende y apoya las solicitudes de refugio en coordinación con titulares de obligaciones. Asimismo, el proyecto incluye acciones de recogida de testimonio, incidencia y sensibilización en Guatemala y la CAV.",72010,True,False,True,False,False,False,False,False,"The text describes a humanitarian assistance project aimed at addressing the crisis caused by the mass displacement of vulnerable populations from Northern Central America to Petén, Guatemala. The focus is on strengthening local partners' capacities to handle increasing demands for refuge and providing adequate shelter while coordinating with relevant authorities. Key elements include technical, strategic, and material support for local entities involved in managing refugee shelters or temporary housing solutions. This aligns closely with the 'Transitional' class due to its emphasis on emergency shelters and temporary supportive housing for displaced people. The project also involves coordination with authorities responsible for granting asylum, which further supports this classification. There is no explicit mention of urban or rural settings specific enough to classify it under those categories. Similarly, there are no references to homelessness (tents, encampments), incremental housing solutions (slum upgrading, structural repairs), social housing models (community land trusts, cooperative housing), market-based approaches (rental, mortgages), or general housing provision outside the context of emergency and transitional support.",False,False,True,False,False,False,False,False
"PROVIDING FOOD AND SOAP FOR THE POOR AND UNDERPRIVILEGED FAMILIES OF STUDENTS OF THREE SLUM SCHOOLS IN RESPONSE TO COVID-19 The NGO Glory Bandhu-protim Samaj Kallayan Sangstha (GBSKS) has successfully established and is running 3 schools in Dhaka's slums. Most of the students' parents work in the low income sector, e.g. as rickshaw or van pullers. Because of the countrywide lockdown resulting from the current COVID-19 crisis, many of them have lost their job and are unable to provide their families with food and other essentials. The project aims to support the families of the 1,500 students in during the COVID-19 emergency situation and the lockdown through distributing packages of basic food items and soap.",12240,False,False,False,True,False,False,True,False,"The text describes an initiative by an NGO that provides essential supplies like food and soap to families affected by the COVID-19 crisis, specifically targeting those living in slums. The focus is on supporting low-income families whose parents have lost their jobs due to a lockdown. While the description does not explicitly mention housing or shelter-related activities such as construction, upgrading, or provision of housing services, it does touch upon the broader context of inadequate living conditions often associated with slum areas. Slums are typically characterized by overcrowded and substandard housing, which aligns with themes related to 'Incremental' class activities like slum upgrading and neighborhood integration. The mention of schools in slums also suggests an urban setting, as slums are generally found in cities. There is no explicit reference to homelessness, transitional shelters, social housing models, market-rate housing, or rural settings.",False,False,False,True,False,False,True,False
"LOGEMENT ROM DE KAKANJ 2018/2019 Founded in 1901 as a catholic organisation, Caritas Switzerland (CACH) prevents, alleviates and combats poverty, while working across sectors and focusing on food security, access to clean and safe water, climate protection and disaster prevention, migration and education for children and adults. With its international programme that combines humanitarian work and development, CACH reaches out to 30 countries in Africa, Latin America and Asia as well as in Eastern Europe.",16040,True,False,False,False,False,False,False,False,"The text describes Caritas Switzerland's (CACH) activities, which include preventing, alleviating, and combating poverty through various sectors such as food security, access to clean water, climate protection, disaster prevention, migration, and education. The organization operates in multiple countries across different continents. While the description provides a broad overview of CACH's work, it does not explicitly mention any specific activities related to housing provision, homelessness, transitional shelters, incremental housing improvements, social housing models, market-rate housing, or urban/rural distinctions. Therefore, there are no explicit matches with the defined classes based on the provided text.",False,False,False,False,False,False,False,False
"PACIFIC URBAN DEVELOPMENT INVESTMENT PLANNING AND CAPACITY DEVELOPMENT FACILITY The knowledge and support technical assistance (TA) will support Pacific island countries to objectively analyze the costs and benefits of available urban investment options, to plan, design and prioritize investments, assess technical suitability, economic, financial and social viability, capacity and institutional issues, address environmental and social safeguards and, identify measures to strengthen project implementation capacity of urban investment projects. At the same time, the countries need to develop institutional, policy and human resource capacity to effectively plan and manage urban investments, so that social and economic benefits are maximized. ADB continues to receive requests from Pacific DMCs to assist in addressing challenges they face. The proposed knowledge and support TA will serve as a facility to support Pacific DMCs in making informed and strategic decisions on urban investments by supporting necessary activities such as capacity development, training, knowledge sharing and dissemination, technical advice, peer reviews etc.The proposed TA will support the Pacific Approach 2016-2020 strategic priority of enabling value creation by promoting livable and economically vibrant urban areas , supporting projects that will help governments with long-term urban planning to ensure that services can be sustained, and encourage private sector and civil society organization (CSO) involvement in the provision of urban infrastructure and services. The proposed TA will also support the Pacific Approach to provide (i) stronger, better, faster project delivery through expanded use of regional approaches and faster delivery mechanisms, and (ii) improved generation and sharing of knowledge.",14022,True,False,False,False,False,False,True,False,"The text describes a technical assistance facility aimed at supporting urban development in Pacific island countries. It focuses on planning, designing, and prioritizing investments for urban areas, with an emphasis on capacity building, policy development, and institutional strengthening to manage urban investments effectively. The goal is to create livable and economically vibrant urban areas by promoting long-term urban planning and involving the private sector and civil society organizations in infrastructure provision. Given these details, several classifications can be considered:

1. **Housing**: While not explicitly mentioned, urban development often includes housing as a component, especially when discussing investments in urban infrastructure.
2. **Urban**: The text explicitly mentions activities related to urban investment planning and management, making this classification directly applicable.
3. **Social**: Although not explicitly stated, the involvement of civil society organizations (CSOs) suggests an element of social engagement or support within the urban development framework.
4. **Market**: There is no explicit mention of market-rate housing or financial mechanisms like mortgages, so this classification does not apply directly.
5. **Transitional**, **Incremental**, and **Homelessness** are not applicable as there is no mention of emergency shelters, refugee camps, slum upgrading, or homelessness-related activities.
6. **Rural**: The focus is explicitly on urban areas, so rural development is not relevant here.

Based on these considerations, the most fitting classifications for this text are 'Urban' and potentially 'Housing', given the broader context of urban investment planning that often includes housing components.",True,False,False,False,False,False,True,False
"PROTECTION DES PERSONNES DÉPLACÉES INTERNES À TRAVERS L'APPROCHE DE PROTECTION COMMUNAUTAIRE, LES ABRIS ET LES ARTICLES MÉNAGERS ESSENTIELS",72010,True,False,True,False,False,False,False,False,"The title 'Protection des personnes déplacées internes à travers l'approche de protection communautaire, les abris et les articles ménagers essentiels' translates to 'Protection of internally displaced persons through community-based protection approaches, shelters and essential household items.' This description involves several key elements that can be mapped to the defined classes:

1. **Transitional**: The mention of 'abris' (shelters) aligns with transitional housing as it suggests temporary accommodations for internally displaced persons.
2. **Housing**: Although not explicitly stated, providing shelters and essential household items could fall under the broader category of housing provision in emergencies or upgrading inadequate living conditions.

The focus on community-based protection approaches does not directly match any specific class but supports the transitional nature by emphasizing temporary solutions for displaced individuals.",True,False,True,False,False,False,False,False
"IMPROVE LIVING CONDITIONS OF REFUGE[AWARDS-  COOPERATIVE AGREEMENTS] Improve safety and well-being of refugees, asylum seekers, vulnerable migrants and community members by improving access to protection, assistance and sustainable solutions",72010,False,False,False,False,False,False,False,False,"The text mentions 'improving living conditions' for refugees, which suggests an effort related to housing or shelter. The focus on 'refugees' implies a temporary or transitional nature of the support provided. There is no explicit mention of homelessness shelters or permanent housing solutions like public housing, so it doesn't fit those categories directly. The text does not specify urban or rural settings, nor does it explicitly refer to market-rate housing or cooperative models. However, given that refugees often reside in temporary accommodations such as camps or emergency shelters, the context aligns with transitional housing efforts. Incremental improvements could also be inferred if the focus is on upgrading existing conditions, but this isn't explicitly stated.",False,False,True,False,False,False,False,False
"PROVISION OF SHELTER AID TO IDP FAMILIES IN YEMEN Providing 14,001 shelter kits, 4,000 emergency shelters, and 2,000 other shelters for IDP families all over Yemen.",72010,True,False,True,False,False,False,False,False,"The text describes the provision of shelter aid to internally displaced persons (IDPs) in Yemen. It mentions providing shelter kits, emergency shelters, and other types of shelters specifically for IDP families. This aligns with several classes:

1. **Housing**: The text explicitly talks about the provision of shelter, which falls under housing activities.
2. **Transitional**: The mention of 'emergency shelters' suggests a temporary solution for displaced individuals, fitting the transitional category.
3. **Urban/Rural**: While the text does not specify urban or rural locations, it mentions that these provisions are distributed all over Yemen. This could imply both urban and rural settings depending on where the IDPs are located.",True,False,True,False,False,False,False,False
MANNAR: NEW HOSTEL TO HOUSE THE CHILDREN OF POOR FISHERMEN AND POOR STAFF FAMILIES Mannar: new hostel and staff house to house the children of poor fishermen and destitute families and staff.,16010,True,False,True,False,False,False,False,False,"The text describes a project in Mannar involving the construction of a new hostel intended to accommodate the children of poor fishermen and destitute families, as well as staff families. This indicates an effort to provide housing solutions for specific groups in need. The mention of 'hostel' suggests a form of shelter or accommodation, aligning with the definition of 'Housing' which includes provision of housing and upgrading inadequate housing. Additionally, since Mannar is mentioned specifically, it could imply an urban setting if Mannar is recognized as such; however, without explicit confirmation that Mannar is an urban location in this context, we cannot definitively classify it under 'Urban'. The focus on poor fishermen and destitute families might suggest a social aspect, but there's no direct mention of community land trusts, cooperative housing, or public housing. Therefore, the primary classification would be 'Housing' due to the provision of shelter.",True,False,False,False,False,False,False,False
"IRICS (APPRAISAL & DESIGN) - RECOMMENDATIONS FROM ADOLESCENT GIRLS ON BUILDING BACK BETTER IN URBAN AREAS IRICs will be delivered by the Foreign, Commonwealth and Development Office in close coordination with Ministry of Housing and Urban Affairs and will support cities to become engines of inclusive growth attracting investment and generating jobs. IRICs will target up to 5 Indian cities to help them deliver better urban services effectively and enable all residents to contribute to and benefit from environmentally sustainable growth. The programme will enable India and the UK to share experiences, best practices and ideas on how cities can best be planned and managed in the face of the opportunities and threats of the 21st Century. It will also guide businesses and investors to drive forward partnerships, raise investment, identify opportunities, accelerate progress and remove bottlenecks for the wider development of the cities.",43030,False,False,False,False,False,False,True,False,"The text describes a programme called IRICS (APPRAISAL & DESIGN) aimed at improving urban areas in India with support from the Foreign, Commonwealth and Development Office, Ministry of Housing and Urban Affairs, and UK collaboration. The focus is on making cities engines of inclusive growth by delivering better urban services, attracting investment, generating jobs, and ensuring environmentally sustainable development. The programme targets up to 5 Indian cities and emphasizes planning and managing cities effectively in response to modern challenges. Given the emphasis on urban areas and improving city infrastructure and services, this text aligns with the 'Urban' classification. There is no explicit mention of housing provision, homelessness, transitional shelters, incremental improvements, social housing models, or market-rate housing activities, so these classifications do not apply.",False,False,False,False,False,False,True,False
