text,sector_code,Housing DK,Homelessness DK,Transitional DK,Incremental DK,Social DK,Market DK,Urban DK,Rural DK,thoughts AI,Housing AI,Homelessness AI,Transitional AI,Incremental AI,Social AI,Market AI,Urban AI,Rural AI
"INTEGRATED TERRITORIAL DEVELOPMENT PROGRAM IN THE PROVINCE OF ANGARAES El Programa busca potenciar la gestión socio ambiental integrada, participativa, concertada y con equidad de género del territorio de las microcuencas de la provincia de Angaraes. La  población destinataria, según el mapa de pobreza se ubica en el Quintil 1 - los más pobres- con ingreso por debajo de 30 euros/mes/familia, alto porcentaje de mujeres analfabetas, tasa de desnutrición infantil sobre el 50%, e IDH de los más críticos del Perú. Los beneficiarios directos son 13.645 habitantes, los indirectos 55.704.  La propuesta se divide en 4 componentes:1. La gobernabilidad ambiental para realizar la gestión territorial ordenada, planificada y concertada de las microcuencas que contribuya en la conservación y el aprovechamiento sostenible de los recursos naturales. Se incorporan estrategias de gestión integrada del medio ambiente, especialmente del agua como elemento central, en función al Plan de Ordenamiento Territorial y a nivel distrital implementando las acciones en función a los Planes de Gestión Ambiental. Para la sostenibilidad se propone la participación activa de las municipalidades a nivel provincial y distrital. A nivel de los actores se promueve la constitución de la Plataforma Social del Manejo Ambiental para promover la participación y vigilancia ambiental. 2. Agua para la producción con el objetivo de contribuir en la dinamización del proceso de desarrollo económico territorial a través de la gestión social de riego equitativa y enfocada a la mejora de la producción agropecuaria. La estrategia es el fortalecimiento de la organización de regantes para una mejor administración, mantenimiento y distribución del riego, a nivel de la infraestructura de riego, mejorar la eficiencia de conducción, distribución y aplicación del agua en las chacras (parcelas). A nivel familiar, promover el desarrollo de capacidades para el manejo eficiente de las chacras para no solo producir alimentos suficientes, sino comercializar el excedente. Así mismo, se contribuye en la diversificación productiva con promoción de cultivos andinos de alto valor nutritivo y hortalizas y en la parte media y baja con la producción de frutales.3. Familias y comunidades saludables para disminuir los factores determinantes de enfermedades diarréicas y respiratorias agudas y parasitosis, que son responsables directas de la desnutrición. Se impulsa un mejor acceso al consumo de agua segura, manejo adecuado de residuos sólidos, manejo eficiente de efluentes líquidos - excretas con la construcción de baños ecológicos, sensibilización en la mejora de prácticas de higiene, alimentación balanceada y ordenamiento de las viviendas familiares con cocinas mejoradas para disminuir humos y el alto consumo de leña. Para asegurar la sostenibilidad se fortalecen los espacios de planificación y monitoreo de los servicios de salud y se fortalecen las organizaciones de usuarios de agua (JASS). 4. Fortalecimiento institucional que busca mejorar la gestión corporativa del desarrollo territorial",43040,True,False,False,True,False,False,False,True,"The text describes an Integrated Territorial Development Program focused on the Province of Angaraes with various components addressing environmental governance, water management for production, community health, and institutional strengthening. I need to determine if any of these components or their implications fall under the defined classes related to housing sectors.

1. **Environmental Governance**: This component emphasizes territorial planning and resource conservation but does not explicitly address housing, homelessness, or shelters.
2. **Water for Production**: Focuses on irrigation management and agricultural productivity without mentioning housing directly.
3. **Families and Communities Health**: Mentions improving living conditions with the construction of ecological toilets and better cooking facilities to enhance family health. This could potentially relate to 'incremental' improvements if it involves structural repairs or enhancements in existing inadequate housing, but explicit mention is lacking.
4. **Institutional Strengthening**: Relates to governance improvement rather than housing directly.

Overall, the text does not explicitly describe any of the specified categories such as provision of housing, homelessness shelters, transitional shelters, incremental housing improvements, social or market housing models, or specific urban/rural activities within the context provided. There is some indirect reference to improving living conditions (e.g., improved kitchens and toilets), which could suggest 'incremental' aspects if considered broadly.",False,False,False,False,False,False,False,False
"POR EL ACCESO DE LAS COMUNIDADES URBANO-POPULARES DEL DEPARTAMENTO DE GUATEMALA A UN HÁBITAT DIGNO El presente proyecto está dirigido a aumentar las capacidades de las comunidades urbanas del Departamento de Guatemala con el fin de contribuir al impulso de una fuerza social comunitaria que esté en condiciones de proponer y llevar a cabo cambios en el Estado de Guatemala para el combate de la pobreza estructural y la discriminación en cualquiera de sus formas. El proyecto busca especialmente el fortalecimiento organizativo, la articulación y el empoderamiento de las organizaciones comunitarias de mujeres y comisiones sectoriales de cuatro municipios del departamento.  El proyecto plantea cuatro líneas básicas de actuación: 1.El fortalecimiento de capacidades organizativas, políticas y de articulación regional de organizaciones comunitarias y coordinadoras municipales.2.Realización de acciones de incidencia desde el marco de la nueva Ley de Vivienda, para el acceso a un hábitat digno y medioambiente saludable.3.Fortalecimiento de capacidades organizativas y políticas de organizaciones de mujeres para aumentar su presencia y capacidad de incidencia en defensa de sus DESC.4.Fortalecimiento de capacidades de las comunidades para la defensa de su territorio y la formulación de propuestas técnicas para la prevención de desastres.Durante el proyecto se realizará acompañamiento permanente a estas organizaciones para la formulación e impulso de propuestas alternativas de desarrollo sectorial y territorial, así como de incidencia ante gobiernos municipales y estatales.",15150,True,False,False,False,False,False,True,False,"The provided text discusses a project aimed at increasing the capabilities of urban communities in the Department of Guatemala to improve access to dignified housing and address poverty and discrimination. Here’s an analysis based on each class definition:

1. **Housing**: The text explicitly mentions improving access to ""un hábitat digno"" (a dignified habitat), which relates directly to housing provisions.
2. **Homelessness**: There is no mention of tents, encampments, or homeless shelters, so this class does not apply.
3. **Transitional**: No reference is made to emergency shelters, refugee camps, or temporary supportive housing; therefore, it doesn't fit the transitional category.
4. **Incremental**: The text discusses improving living conditions and habitat but doesn’t specify slum upgrading, structural repairs, or neighborhood integration directly, so this might not apply explicitly.
5. **Social**: There is no explicit mention of community land trusts, cooperative housing, or public housing, which are typical in the social category.
6. **Market**: The project does not discuss home rentals, mortgages, rent-to-own housing, or market-rate housing, so this class doesn’t apply.
7. **Urban**: The text explicitly states that the project is directed at urban communities in the Department of Guatemala, which fits perfectly with activities in specific urban locations.
8. **Rural**: There are no indications of rural area involvement; hence, this does not apply.",True,False,False,False,False,False,True,False
Strengthening civic participation of inhabitants and their grass roots organisations in slum areas of Recife,15150,False,False,False,False,False,False,True,False,"The description mentions 'strengthening civic participation of inhabitants and their grassroots organizations in slum areas.' This suggests activities related to community engagement, which could be part of upgrading or integrating neighborhoods. The focus on 'slum areas' hints at efforts for improvement or development within those communities, aligning with the concept of slum upgrading or neighborhood integration, both falling under the category of 'Incremental'. There is no mention of specific housing provision or homelessness directly; instead, it centers around community involvement and potentially enhancing living conditions through civic engagement. The location mentioned is Recife, an urban area, which means this activity likely takes place in a city setting, aligning with 'Urban' as well. Therefore, the classes that match are 'Incremental' due to the focus on slum areas and potential upgrades or integrations, and 'Urban' because it specifies activities in Recife.",False,False,False,True,False,False,True,False
"APPUI AUX FAMILLES MILITAIRES DES CAMPS DE KINDU (2IÈME PHASE) ET LOKANDU - FAMIKI II/FAMILO België heeft militaire partnerschappen (Programme de Partenariat Militaire - PPM), met verschillende landen in Afrika, teneinde er ter plaatse de hervorming van de veiligheidssector te ondersteunen en mee te werken aan de oprichting van een professioneel nationaal leger, dat ten diensten staat van haar bevolking en de mensenrechten eerbiedigt. Het militaire partnerschap met de Democratische Republiek Congo omvat vooral de vorming van, toezicht op en evaluatie van een 'URR' brigade (Unité de Réaction Rapide  - een soort paracommando's) bestaande uit drie elite bataljons (321e, 322e en 323e Bataillons de Réaction Rapide) te Kindu, naast de vorming, de begeleiding en evaluatie van de onderrichters van de Militaire Academie van Kananga en van de Genieschool in Likasi. Het 321e bataljon werd eind 2008-begin 2009 gevormd te Kananga, het 322e bataljon eind 2011-begin 2012 te Kindu en tenslotte het 323e bataljon in de loop van 2013 te Kindu. Blijft nog de vorming van de staf van de brigade die de drie gevormde elite bataljons zal omkaderen. Wanneer een militair in de Democratische Republiek Congo een standplaats krijgt toegewezen om er tijdelijk te verblijven, trekt zijn gezin bijna altijd mee. Deze verplaatsingen resulteren vaak in moeilijke levensomstandigheden voor de families. Die families dienen op zoek te gaan naar een onderkomen, naar gezondheidszorgen, naar een school voor hun kinderen en naar landbouwgrond om voedsel te kunnen produceren. Dit gebeurt vaak ten koste van de lokale populatie met conflicten als gevolg. Om aan deze tendens een halt toe te roepen, willen de Congolese regering en de Stafdienst van het leger (FARDC – Forces Armées de la République Démocratique du Congo) de militairen en hun gezin een vaste woonplaats bezorgen. Het is de bedoeling de militairen te huisvesten in garnizoensteden verspreid over het hele land. Zo zullen de militairen die op missie vertrekken, gerust gesteld zijn dat hun familie veilig en degelijk gehuisvest is.Kindu gelegen in de provincie Maniema is één van die garnizoensteden. De drie door België opgeleide bataljons worden gehuisvest te Kindu en omgeving, meer bepaald het 321e bataljon in het militaire kamp Lwama, het 322e bataljon in het militaire kamp Lokandu en het 323e bataljon in het militaire kamp Jericho.Nu bevonden deze militaire kampen zich in een lamentabele toestand wegens verwaarlozing ingevolge de oorlogen die de DRC de laatste jaren had gekend. De Belgische defensie in zijn partnerschapsakkoord met de DRC voorziet in de rehabilitatie van de infrastructuur van die kampen maar er waren onvoldoende fondsen voorzien voor de huisvesting van de militairen. Bijgevolg werd aan onze FOD Buitenlandse Zaken, Buitenlandse Handel en Ontwikkelingssamenwerking in het kader van een 3D benadering (défence, diplomatie et développement) gevraagd financieel bij te dragen voor de rehabilitatie van de huisvesting in deze kampen. In een eerste fase werd besloten het kamp Lwama te Kindu te rehabiliteren. GENERAL PURPOSE:  Contribuer à la consolidation de la sécurité avec le rétablissement de l'Autorité de l'Etat dans la partie EST de la RDC et dans la province du Maniema en particulier.SPECIFIC RESULTS:  Volet A: FAMIKI IIR1. Des logements décents pour 223 militaires et leur familles sont construits ,R2. L'accès à l'eau potable pour les familles du camp est assuré ,R3. Des activités sociales, y compris des activités génératrices de revenus, sont fournies et pérennisées.Volet B : FAMILOR4. Des logements décents sont construits pour 200 familles de militaires ,R5. L'accès à l'eau potable pour les familles du camp est assuré.SPECIFIC PURPOSE:  Les conditions de vie des familles des militaires des camps de Kindu et Lokandu ainsi que des populations avoisinantes sont améliorées.",16040,True,False,False,False,False,False,True,False,"The text describes a program aimed at supporting military families in the Democratic Republic of Congo (DRC) by providing them with decent housing within military barracks located across different regions, specifically mentioning camps in Kindu and Lokandu. The initiative is part of a broader effort to stabilize and secure parts of eastern DRC, involving infrastructure rehabilitation and addressing basic needs such as water access and social activities for military families.

- 'Housing' is applicable here because the text explicitly mentions the construction of decent housing for military personnel and their families within military camps. It addresses upgrading inadequate living conditions and providing shelter, aligning with the definition provided for this class.
- 'Transitional' might seem relevant due to the temporary nature of deployment mentioned; however, there's a focus on creating permanent housing solutions rather than short-term or emergency shelters.
- The mention of social activities and economic empowerment initiatives could hint at 'Social,' but these are more supportive measures than central elements defining the housing intervention.
- While the text does not explicitly categorize the locations as urban or rural, it specifies them as military camps in specific provinces (Kindu in Maniema), which suggests a potential 'Urban' classification due to their structured and strategic nature. However, without explicit mention of an urban setting beyond military installations, this is less certain.
- There's no direct reference to homelessness, incremental approaches like slum upgrading, or market-rate housing strategies that would align with other classifications such as 'Homelessness,' 'Incremental,' or 'Market.'

Given the focus on providing and improving housing for military families within specified camps in the DRC, the most fitting classification is primarily 'Housing.' The details about infrastructure rehabilitation further support this categorization. While there are elements that could suggest additional classifications, such as the nature of social support activities or the strategic importance of the locations, these do not overtly align with their respective definitions based on the text provided.",True,False,False,False,False,False,False,False
E+ KA1 EA JOINT MASTERS PROGRAMMES (EPMC) A3 MUNDUS URBANO Master of Science in International Cooperation and Urban Development,11420,False,False,False,False,False,False,True,False,"The provided title is for a joint Masters Program in International Cooperation and Urban Development. The focus on 'Urban Development' suggests an emphasis on activities related to urban settings, which aligns with the 'Urban' class based on its explicit mention of activities associated with specific urban locations. Additionally, the program's nature as an educational initiative for international cooperation might touch upon topics like housing policies or upgrading inadequate housing within urban contexts, potentially linking it indirectly to the 'Housing' category. However, there is no direct reference to any other specific classes such as Homelessness, Transitional, Incremental, Social, Market, or Rural.",True,False,False,False,False,False,True,False
"CHONGQING INTEGRATED LOGISTICS DEMONSTRATION The project will develop a modern and efficient multimodal logistics system in Chongqing. The outputs of the project will be (i) the Chongqing transportation logistics park, (ii) the Nanpeng logistics park, (iii) the Yangtze River inland waterway roll-on roll-off (Ro-Ro) operations, (iv) a logistics information system, and (v) institutional capacity building. The proposed project is the third urban development project in Chongqing. Lessons from past and ongoing projects were incorporated in the project design, such as devolving more responsibilities to the implementing agency while strengthening its project management and financial management capacity. The proposed project will have demonstration features, namely integrated logistics parks, logistics information system, and inland waterway Ro-Ro operations. These features are all relatively new for logistics projects in the PRC, and their successful introduction through this project will offer opportunities for replication and scaling up. Integrated logistics functions and services in the new logistics parks will reduce wasteful freight movements. Logistics information services will enable logistics service providers, such as freight forwarding companies, to increase efficiency and reduce costs through better tracking and control over the supply chain. Ro-Ro operations will reduce the time and costs of transshipments, incentivizing freight movement on inland waterways.",21040,False,False,False,False,False,False,True,False,"The project description focuses on developing a logistics system in Chongqing by constructing modern facilities such as transportation logistics parks, logistics information systems, and inland waterway Ro-Ro operations. The main goal is to enhance efficiency and reduce costs in freight movements. While the text discusses urban development elements (specifically mentioning it's an urban development project), there is no explicit mention of housing-related activities or any other direct categories from our classification definitions. The focus remains on logistics rather than housing, homelessness, transitional solutions, incremental improvements, social housing models, market-rate housing, or specifically rural initiatives. Therefore, based on the provided text and its emphasis, only one potential match exists under 'Urban' due to the specified location of Chongqing as an urban area.",False,False,False,False,False,False,True,False
USAID/OFDA GRANT FOR FIJI/CYCLONE-2016 Shelter and Settlements Intervention with IFRC in Fiji,72010,False,False,True,False,False,False,False,False,"The title mentions a USAID grant for shelter and settlements intervention following Cyclone-2016, which implies emergency response activities. The involvement of the International Federation of Red Cross and Red Crescent Societies (IFRC) suggests that there may be efforts related to providing immediate housing or settlement solutions in an emergency context. Given this information, we can infer potential matches with certain classes:

1. **Housing**: The intervention is likely focused on providing shelter immediately after the cyclone, which aligns with 'provision of shelter in emergencies' under the Housing class.
2. **Transitional**: As the response to a disaster like Cyclone-2016 would often involve setting up emergency shelters and temporary settlements for those displaced by the cyclone, it could be categorized under Transitional activities such as emergency shelters or temporary supportive housing.

The title does not provide specific details about the nature of the interventions beyond 'shelter and settlements,' nor does it explicitly mention urban or rural settings. Therefore, we cannot definitively classify this intervention as either Urban or Rural without additional context. Similarly, there are no explicit references to homelessness (homeless shelters), incremental improvements (slum upgrading), social housing models (community land trusts), or market-rate activities (mortgages).",True,False,True,False,False,False,False,False
ACCORD CADRE CR 2017-2019 Construire des habitations durables à 350 ménages à Ronkh pour mieux les protéger contre les intempéries,16040,True,False,False,False,False,False,False,False,"The project title describes the construction of durable housing for 350 households in Ronkh. This suggests an activity focused on providing shelter, which aligns with the 'Housing' class as it explicitly mentions constructing housing and improving protection against weather conditions. There is no mention of homelessness, transitional shelters, incremental improvements, social or market-specific mechanisms like cooperatives or mortgages, or a specific focus on either urban or rural settings beyond mentioning Ronkh (which does not provide sufficient detail to classify strictly as 'Urban' or 'Rural'). Therefore, the primary classification that applies here would be 'Housing'.",True,False,False,False,False,False,False,False
"ICRC - PROVISION OF SHELTER, FOOD, WATER AND SANITATION To deliver an effective response to the basic needs of vulnerable people impacted by the crisis in the North East of Nigeria. The programme will deliver humanitarian assistance in nutrition and food security, protection and Education in Emergencies, multi",99810,True,False,True,False,False,False,False,False,"The provided text describes a programme led by ICRC focusing on delivering shelter, along with other basic necessities like food, water, and sanitation to vulnerable people affected by the crisis in North East Nigeria. The explicit mention of 'provision of shelter' fits within the definition for the 'Housing' class as it encompasses provision of housing or shelter in emergencies. There is no specific reference to homelessness shelters, transitional or incremental housing types, social or market housing models, or any indication that these activities are specifically urban or rural based. The text does not mention any explicit indicators required for classifications like 'Homelessness', 'Transitional', 'Incremental', 'Social', 'Market', 'Urban', or 'Rural'. Therefore, the most fitting classification is under 'Housing' due to the direct reference to shelter provision in an emergency context.",True,False,False,False,False,False,False,False
"BUILDING HOST CENTRES FOR CHILDREN MONTE CARMELO Se quiere construir una casa de acogida para 60 niños dalits y de comunidades tribales. La intención no es solo dotarles de una vivienda digna, sino facilitarles el acceso a la educación. La mayoría de ellos no son huérfanos, pero sus padres viven en zonas rurales tan apartadas que no pueden desplazarse diariamente al colegio. El nuevo edificio se distribuiría en dos plantas y contaría con comedor, sala de estudio, dormitorio y taquillas. El proyecto consiste en: Construcción de dos salas, cada una de 10x20 m, división de la planta baja en dos espacios (comedor y sala de estudio), vestuario y dormitorio en la sala del primer piso.",11120,True,False,False,False,False,False,False,True,"The project described is focused on constructing a host center for children from dalits and tribal communities in a rural area, as it mentions the parents living in 'zonas rurales' (rural areas) that are difficult to access daily for school purposes. The primary goal is to provide these children with dignified housing while also facilitating their access to education. This aligns well with elements of the 'Housing' category, which includes construction of housing and provision of shelter. The project's rural context explicitly fits the 'Rural' classification. There are no direct references to homelessness, transitional or temporary structures, incremental development such as slum upgrading, specific social models like community land trusts or cooperative housing, market-based activities, or urban settings.",True,False,False,False,False,False,False,True
"ACCESS TO DRINKING WATER IN 210 HOUSES IN THE TOWN OF PAXOT 2, QUICHE El proyecto pretende resolver la insalubridad de las viviendas de 210 familias de Paxot II, mediante la dotación de agua potable para reducir el impacto de las enfermedades derivadas del consumo de agua contaminada. El sistema de abastecimiento será por perforación de un pozo artesanal y el mantenimiento de la red mediante una cuota familiar mensual.",14030,True,False,False,False,False,False,False,False,"The provided text describes a project focused on improving the living conditions of 210 families in Paxot II by providing access to potable water. The primary goal is to address unsanitary housing conditions and reduce diseases caused by contaminated water consumption. The method involves drilling an artisanal well for water supply, with maintenance funded through a monthly family fee. Although the project indirectly affects housing conditions, it does not explicitly mention any of the categories such as construction or upgrading of housing, nor does it involve activities directly related to homelessness, transitional, incremental, social, market, urban, or rural classifications in the context of housing development. The focus is on water supply rather than housing itself.",False,False,False,False,False,False,False,False
