text,sector_code,Housing DK,Homelessness DK,Transitional DK,Incremental DK,Social DK,Market DK,Urban DK,Rural DK,thoughts AI,Housing AI,Homelessness AI,Transitional AI,Incremental AI,Social AI,Market AI,Urban AI,Rural AI
"PROMOTING LEGAL EMPOWERMENT OF THE URBAN POOR IN NIGERIA THROUGH AN INTER-CITY COMMUNITY PARALEGAL NETWORK Approximately 67% of urban populations in Nigeria live in informal settlements and are caught in a poverty trap characterized by marginalization and insecurity. Communities lack access to basic services and security of tenure and they face discrimination and threats of physical violence. Ethnic minorities, urban migrants, and women are particularly vulnerable to social and political exclusion. To date, approaches to urban development have emphasized policies of decongestion, formalization of informal settlements, or beautification, which have often resulted in arrests, forced evictions, and demolitions of informal settlement communities. Many people living on the margins of Nigeria's cities have struggled to exercise their basic rights.   Against that backdrop, this project aims to address some of the most critical justice and governance challenges facing Nigeria's urban poor. The research builds on five years of experience of an innovative inter-city network of community paralegals, trained and supported by Justice and Empowerment Initiatives – Nigeria. The network currently serves over 100 informal settlements (slums) in Lagos and Port Harcourt.    The research will comprise three streams. First, the team will identify the priority justice challenges experienced by informal settlement residents, with their direct participation. Another stream will study the immediate costs and longer-term impacts of these justice challenges on residents, with a view to understanding their relationship with the poverty trap. A final stream will explore the broader societal costs of current urban policy approaches and will conduct cost-benefit analyses on proposed alternatives. Research findings will be used to identify and test legal empowerment strategies to improve urban poor communities' capacity to respond to priority justice challenges. Findings will also feed efforts to improve public awareness and perceptions about the development and justice challenges faced by the urban poor and to foster collaborative engagement between urban poor communities, civil society, and government. Researchers and informal settlement residents will co-produce outputs and knowledge products.",15130,True,False,False,True,False,False,True,False,"The provided text focuses on promoting legal empowerment for the urban poor in Nigeria, particularly those living in informal settlements within cities like Lagos and Port Harcourt. The project addresses justice and governance challenges faced by these communities, emphasizing their marginalization, lack of access to basic services, and insecurity of tenure. It involves an inter-city network of community paralegals working across multiple informal settlements. Given the context and content, several classifications can be considered:

1. **Urban**: The project explicitly mentions activities in specific urban locations (Lagos and Port Harcourt), focusing on addressing issues faced by residents of informal settlements within these cities.
2. **Housing**: While not directly about constructing or upgrading housing, the text discusses challenges related to security of tenure and access to basic services, which are closely linked to housing issues in informal settlements.
3. **Social**: The project involves community paralegals working with urban poor communities, aiming at legal empowerment and addressing social exclusion, which aligns with efforts typically associated with social housing initiatives like cooperative housing or public housing support.

The text does not explicitly mention homelessness, transitional shelters, incremental housing improvements, market-rate housing, or rural activities. Therefore, these classifications are less relevant to the described project.",True,False,False,False,True,False,True,False
"SUPPORT FOR THE REDUCTION OF URBAN AND SOCIAL BACKWARDNESS The general objective of this Technical Cooperation (TC) is to support the Ministry of Agrarian, Territorial and Urban Development (SEDATU) in its purpose of reducing urban and social backwardness, through the implementation of the Urban Improvement Program (PMU). The specific objectives are: (i) increase SEDATU's institutional technical capacities in relation to environmental safeguards, gender and inclusion, risks and climate change, and (ii) strengthen mechanisms for verification and follow-up of environmental and gender management in SEDATU's programs.",16040,False,False,False,False,False,False,True,False,"The text describes a Technical Cooperation aimed at supporting the Ministry of Agrarian, Territorial and Urban Development to reduce urban and social backwardness through an Urban Improvement Program. The focus is on increasing institutional technical capacities related to environmental safeguards, gender and inclusion, risks, and climate change, as well as strengthening mechanisms for verification and follow-up in these areas within SEDATU's programs.

The key terms here are 'urban' and 'social backwardness,' which suggest a focus on urban development. The mention of an Urban Improvement Program directly aligns with activities related to urban locations. However, there is no explicit mention of housing provision, homelessness, transitional shelters, incremental improvements, social housing models like community land trusts or cooperative housing, market-rate housing, or specific rural activities.

Given the context and definitions provided:
- 'Urban' is a clear match because the text explicitly mentions urban improvement and focuses on urban locations.
- 'Social' could be considered due to the mention of reducing social backwardness, but it does not specifically describe community land trusts, cooperative housing, or public housing as defined in the class description.",False,False,False,False,False,False,True,False
Adapting Local Integrated Urban Development Plans tothe Sustainable Developments Goals Through Multistakeholderand Multi-Governance Approaches,43030,False,False,False,False,False,False,True,False,"The title provided is 'Adapting Local Integrated Urban Development Plans to the Sustainable Development Goals Through Multistakeholder and Multi-Governance Approaches.' The key terms in this title are 'Local Integrated Urban Development Plans' and 'Sustainable Development Goals,' along with mentions of 'Multistakeholder' and 'Multi-Governance Approaches.' 

The phrase 'Urban Development Plans' directly suggests activities related to urban areas, which aligns with the definition for the 'Urban' class. The focus on integration and adaptation within these plans implies a broad scope that could potentially involve housing policies or strategies as part of sustainable development goals. However, there is no explicit mention of specific types of housing or homelessness interventions.

The title does not explicitly mention any activities related to providing housing, shelters for the homeless, transitional accommodations, incremental improvements, social housing models, market-based housing solutions, or rural activities. Therefore, these classes do not have direct matches based on the given definitions and explicit mentions required by the classification criteria.",False,False,False,False,False,False,True,False
AFFORDABLE HOUSING PROJECT (LISP III) The objective of the project is to improve significantly the living conditions of low and lower-middle income population by providing wider access to affordable and improved quality housing.,14020,True,False,False,False,True,False,False,False,"The text describes an initiative aimed at improving living conditions for low and lower-middle-income populations through increased access to affordable, high-quality housing. This aligns with the 'Housing' class as it involves the provision of housing that is both affordable and improved in quality. The focus on affordability suggests a connection to the 'Social' class since social housing often aims at providing affordable options for low-income groups. However, there's no explicit mention of community land trusts or cooperative/public housing models, which are specific indicators for the 'Social' classification. Additionally, there is no information about urban or rural settings, nor any indication that this project addresses homelessness, transitional living situations, incremental improvements, or market-rate housing.",True,False,False,False,False,False,False,False
"PROMOTION OF BEEKEEPING ACTIVITY IN THE BUFFER ZONE OF THE PUCA WILDLIFE REFUGE To extend Forest Service efforts to improve forest policies and practices internationally, address climate change, conserve and protect critical global forest environments and resources, and improve the lives of forest-dependent peoples by awarding grants to and entering into cooperative agreements with nonprofit organizations, multilateral organizations, and other individuals, organizations, institutions, and governments engaged in forest conservation and management.",41030,False,False,False,False,False,False,False,False,"The provided text describes a project focused on promoting beekeeping activities within the buffer zone of the Puca Wildlife Refuge. The primary aim is to improve forest policies and practices internationally, address climate change, conserve critical global forest environments, and enhance the lives of forest-dependent peoples through grants and cooperative agreements with various organizations and governments involved in forest conservation and management.

To determine if this text matches any of the specified classes related to housing:
- **Housing**: The text does not mention anything about providing or improving housing directly.
- **Homelessness**: There is no reference to tents, encampments, or shelters for the homeless.
- **Transitional**: No mention of emergency shelters, refugee camps, or temporary supportive housing.
- **Incremental**: No explicit mention of housing sites, slum upgrading, structural repairs, or neighborhood integration.
- **Social**: There is no reference to community land trusts, cooperative housing, or public housing.
- **Market**: The text does not discuss home-rental, mortgages, rent-to-own housing, or market-rate housing.
- **Urban**: No specific urban locations are mentioned in the context of activities.
- **Rural**: Although the project is located in a buffer zone of a wildlife refuge, which might imply a rural setting, there is no explicit mention of 'rural' activities as defined by the class. However, given that wildlife refuges are typically situated in less urbanized areas, this could be considered an implicit match.

Overall, while the text does not explicitly address any housing-related classes directly, it can be inferred that the project takes place in a rural setting due to its location within a wildlife refuge buffer zone.",False,False,False,False,False,False,False,True
CLIMATE CHANGE RESILIENCE - EMERGENCY SHELTERS This Activity aims to strengthen Tokelau's resilience to the impacts of climate change through the design and construction of climate resilient emergency shelters.,43060,False,False,True,False,False,False,False,False,"The description provided focuses on the design and construction of 'climate resilient emergency shelters' in response to climate change impacts, specifically for Tokelau. The key term here is 'emergency shelters,' which aligns with the definition of the 'Transitional' class as it involves temporary housing solutions typically used during emergencies or crises. There are no explicit mentions of homelessness, incremental improvements, social housing models, market-based approaches, specific urban or rural locations beyond the general mention of Tokelau, or broader housing policy or technical assistance that would align with other classes.",False,False,True,False,False,False,False,False
MULTISECTORAL SUPPORT TO ENHANCE INTEGRATION OF UKRAINIAN AND THIRD COUNTRY NATIONALS IN POLAND 1) Temporary shelter and non-food relief supplies (including winter relief supplies)(2) Psychological and emotional care for vulnerable groups,93010,False,False,True,False,False,False,False,False,"The text describes a project providing 'temporary shelter' and 'non-food relief supplies,' which aligns with the definition of 'Transitional' as it involves emergency shelters or temporary supportive housing. The mention of psychological and emotional care, while important, does not directly relate to any specific class definitions provided. There is no explicit reference to homelessness, incremental improvements, social housing models, market-related activities, or specific urban or rural locations.",False,False,True,False,False,False,False,False
"SUPPORT FOR VICTIMS OF HUMAN TRAFFICKING TO RECEIVE PSYCHOSOCIAL ASSISTANCE Support victims of human trafficking to receive individually-tailored, victim-centred psychosocial support by means of capacitating NGO-run shelters for victims of human trafficking.",12340,False,False,True,False,False,False,False,False,"The text describes a program aimed at supporting victims of human trafficking through psychosocial assistance provided in NGO-run shelters. The key elements to consider are the provision of shelter and the nature of these shelters as being specifically for victims of human trafficking, which implies they may be temporary or transitional in nature. There is no explicit mention of housing construction, urban or rural settings, homelessness encampments, incremental upgrades, social housing models like community land trusts or cooperative housing, or market-rate housing activities. The focus on psychosocial support and the use of shelters aligns most closely with 'Transitional' due to their temporary nature for victims in need of immediate assistance.",False,False,True,False,False,False,False,False
"F.A: STRENGTHENING YOUTH VOICE FOR CIVIC ACTION The young people in Uganda have the know-how, passion, drive, and dynamism to provoke significant change around them. Yet, they are rarely included in civic dialogue, poorly represented in political spaces, and all too often sidelined from decision making. The civic and political participation of Ugandan youth is hindered by lack of political will, mistrusts between youth and duty bearers and socio-economic constraints such as unemployment. The overall objective is to contribute to a peaceful Ugandan society where young men and women actively contribute to transformation of conflicts, maintenance of peace, and socio-economic development of their communities. The expected result is improved capacity of youth to lead actions against the root causes of conflict and violence in their communities. Furthermore, the capacity of networks and youth-led organisations is strengthened to participate in decision making and influence policy discourse. The project also aims to enhance capacity of local duty bearers in state and non-state institutions to engage actively with the youth and play a more active role in enabling youth aspirations.      Right-holders/beneficiaries: 10,060 youth (50% M and 50% F) and indirectly 20, 000 young people between 15 and 30 years, including young women, refugee youth, youth with disabilities, youth in schools, youth out of school, youth in grassroot organizations and youth in slum areas.Duty bearers: Local government technical and political leaders, teachers, members of parliament, leaders in CSOs, parents, religious and cultural leaders, women leaders and private sector. Implementing partner: Uganda Muslim Youth Development Forum (UMYDF)",15220,False,False,False,False,False,False,False,False,"The project description focuses on strengthening youth civic action and participation in Uganda. It aims to empower young people to engage in decision-making processes, influence policy discourse, and address socio-economic challenges such as unemployment. The text mentions various groups of youth beneficiaries, including those from slum areas, which suggests a focus on urban settings. However, there is no explicit mention of housing-related activities or policies, nor any direct reference to homelessness, transitional shelters, incremental housing improvements, social housing models, market-based housing solutions, or rural-specific initiatives. The primary themes revolve around civic engagement and youth empowerment rather than the housing sector.",False,False,False,False,False,False,True,False
"IMPROVING THE SEXUAL AND REPRODUCTIVE HEALTH OF WOMEN IN SANTA ROSA DE COPÁN. Título completo del proyecto: Mejora de la salud sexual y reproductiva de las mujeres en Santa Rosa de Copán. :: Este proyecto se centra en la mejora de infraestructuras del Hogar maternal, una casa refugio que acoge a mujeres embarazadas en las semanas previas al parto y tras él, a mujeres que habiendo recibido el alta, no pueden llevar a sus hijos-as a casa por estar ingresados-as.Las usuarias del Hogar, son mayoritariamente mujeres campesinas que viven lejos de la ciudad, que se acercan a la ciudad, en ocasiones a pie desde largas distancias con antelación al parto. Tras la visita médica, si el Hospital le recomienda ingresar en el Hogar deben hacerlo o quedarse en la ciudad. Con anterioridad a la existencia del Hogar, las mujeres vagaban por la ciudad, sin cobijo ni protección, lo que daba lugar incluso a asaltos y muertes de madres y criaturas por la falta de atención previa al parto.",12230,False,False,True,False,False,False,True,True,"The project description focuses on improving the sexual and reproductive health of women in Santa Rosa de Copán by enhancing the infrastructure of a maternal home, which serves as a refuge for pregnant women before and after childbirth. The text highlights that this facility accommodates women who cannot return to their homes due to hospitalization of their newborns. It mentions that these users are primarily rural women who travel long distances to reach the city. The project addresses issues faced by these women when there was no maternal home, such as wandering the city without shelter or protection, leading to assaults and deaths. Based on this analysis, several classifications can be considered:

1. **Housing**: The text describes improving infrastructure for a refuge that provides shelter for pregnant women, which aligns with the provision of housing in emergencies.
2. **Transitional**: The maternal home serves as temporary supportive housing for women before and after childbirth, fitting the definition of transitional housing.
3. **Rural**: The project specifically mentions rural women who travel from distant areas to access services in Santa Rosa de Copán, indicating a focus on rural activities.

The text does not explicitly mention homelessness, incremental improvements, social housing models like community land trusts or cooperative housing, market-rate housing, or specific urban locations beyond the general reference to Santa Rosa de Copán. Therefore, these classifications are less applicable.",True,False,True,False,False,False,False,True
"IMPROVING ENERGY EFFICIENCY IN THE BUILDING SECTOR THROUGH THE USE OF RENEWABLE RAW MATERIALS FROM AGROFORESTRY SYSTEMS The project has two main objectives: (a) increasing energy efficiency in the housing sector and (b) providing a local source of sustainable building and insulation materials to substitute fossil-based materials and wood imports. The main target groups of the project are manufacturers, construction companies, and farmers. Through the cooperation with wood processing companies in Uzbekistan, long-term impulses for the sustainable development of the timber construction sector are being set in the local business environment. Key stakeholders as well as a broader audience will be reached through training and e-learning modules for vocational and higher education and by constructing a model house. The project activities are organized into three threads. The first one focuses on analyzing the current situation and capacities of the wood processing industry and how to improve it. In the second thread we design a building system based on local materials and construct an affordable model house, bearing in mind contemporary needs for climate-adaptive architecture, local building traditions as well as challenges related to the use of renewable energies. The third thematic thread of the project focuses on education and developing e-learning materials on the use of locally available renewable resources (e.g. from poplars and other fast-growing wood species) for innovative building systems in Uzbekistan.",23183,True,False,False,False,False,False,False,False,"The text describes a project aimed at improving energy efficiency in the housing sector by using renewable raw materials from agroforestry systems. The objectives include increasing energy efficiency specifically within the housing sector and providing sustainable building materials, which directly relates to the 'Housing' class as it involves upgrading housing with better materials and methods. Additionally, there is a focus on constructing an affordable model house, further emphasizing activities related to housing construction and urban development. There are no explicit mentions of homelessness, transitional shelters, incremental housing services, social housing models like community land trusts or cooperative housing, market-rate housing, specific urban locations, or rural areas in the text. Therefore, these classes do not apply.",True,False,False,False,False,False,False,False
"MAINTENANCE OF THE DISPLACEMENT TRACKING MATRIX EMERGENCY EVENT TRACKING, IMPLEMENTATION OF A COMPREHENSIVE EMERGENCY RESPONSE PROGRAM. Maintenance of the Displacement Tracking Matrix Emergency Event Tracking, Implementation of a comprehensive Emergency Response Program, focusing on the provision of emergency Non-Food Items kits and shelter solutions as well as emergency health response",72010,False,False,True,False,False,False,False,False,"The text describes activities related to maintaining a Displacement Tracking Matrix and implementing an emergency response program. It specifically mentions the provision of emergency shelters and shelter solutions, which align with the 'Transitional' class due to its focus on temporary supportive housing in emergencies. The mention of Non-Food Items kits and emergency health response indicates a broader humanitarian effort but does not directly relate to other specific classes such as 'Housing', 'Homelessness', or others listed. There is no explicit reference to urban or rural settings, social or market-oriented activities, incremental improvements, or homelessness-specific shelters like tents or encampments.",False,False,True,False,False,False,False,False
