text,sector_code,Housing DK,Homelessness DK,Transitional DK,Incremental DK,Social DK,Market DK,Urban DK,Rural DK,summary AI,reasoning AI,Housing AI,Homelessness AI,Transitional AI,Incremental AI,Social AI,Market AI,Urban AI,Rural AI
"2022-LANK-25. BRIDGES AND RESILIENCE. A PALESTINIAN LOOK AT THE JORDAN VALLEY Título completo del proyecto: 2022-LANK-25.  Puentes y resiliencia. Una mirada palestina al valle del Jordán :: Desde 1948 el Estado de Israel inició la Nakba, un proceso de desplazamiento forzoso y violento de la población palestina de sus lugares de origen. Esta estrategia que se manifiesta de diferentes maneras (sistema de permisos, zonificación, segregación, confiscación de tierras, denegación de acceso a recursos y servicios, supresión de la resistencia, debilitamiento de la identidad, entre otras) busca el debilitamiento de la identidad nacional y la resistencia colectiva, afectando especialmente el relevo generacional y los mecanismos de resistencia comunitarios. El desplazamiento interno y refugio de la población palestina ha condicionado su acceso a servicios básicos y medios de vida ante la dependencia del mercado de trabajo israelí y la ayuda humanitaria en los campamentos de refugiados. Adicionalmente, su sociedad es ampliamente conservadora y patriarcal, lo cual relega a los jóvenes y mujeres a un segundo plano. Se estima que casi el 30% de la población palestina es joven (15-29 años), pese al alto nivel de alfabetización la juventud debe hacer frente a altas tasas de desempleo (40%), asimismo, las mujeres jóvenes sufren con frecuencia un contexto doblemente opresor de sus derechos y libertades que les impide implicarse y participar en la lucha por la liberación palestina. El proyecto contará con la participación de 7 organizaciones y tiene como objetivo ?Organizaciones Comunitarias (CBOs) de jóvenes, mujeres, refugiados/as y desplazados/as internos/as fortalecen sus lazos, su identidad y sus estrategias de resistencia colectiva frente a las políticas israelíes de segregación y desposesión?.",15160,False,False,False,False,False,False,True,True,"The project titled 'Bridges and Resilience. A Palestinian Look at the Jordan Valley' aims to strengthen the ties, identity, and collective resistance strategies of Community-Based Organizations (CBOs) involving youth, women, refugees, and internally displaced persons in Palestine against Israeli policies of segregation and dispossession.","The text discusses a project focused on empowerment, resilience building, and addressing issues stemming from forced displacement in the Jordan Valley. The project's activities center around enhancing community organization among various marginalized groups to resist segregation and dispossession. While it addresses housing indirectly through its mention of internally displaced persons, the primary focus is on human rights rather than direct housing provision or improvement. Therefore:

- Housing: Not a match. Although displacement is mentioned, there is no explicit description of activities such as shelter provision or upgrading.
- Homelessness: Not a match. There are no explicit mentions of temporary shelters or homeless encampments.
- Transitional: Partially related. While it involves displaced persons, the emphasis is not on emergency housing but rather resistance and identity strengthening.
- Incremental: Not a match. No mention of slum upgrading or neighborhood integration.
- Social: Not a direct match. The focus isn't explicitly on low-cost housing, public housing, etc., though community empowerment could align loosely with social housing concepts.
- Market: Not a match. There is no mention of activities related to mortgages, rental markets, or market-rate housing.
- Urban: Not specified. The Jordan Valley is mentioned but not in the context of specific urban locations.
- Rural: Partially related. Activities are conducted in the Jordan Valley, which could be characterized as rural rather than strictly urban.",False,False,True,False,False,False,False,True
"HOLISTIC LIVELIHOOD SECURITY FOR SMALLHOLDER FAMILIES WITH A FOCUS ON SUSTAINABLE AGRICULTURE AND HOUSING IMPROVEMENT IN EASTERN EL SALVADOR The living situation of smallholder families improves through the production of sufficient, healthy, varied food as well as the improvement of existing and newly built dwellings in an earthquake-resistant and ecological manner. Local decision-makers advocate for the dissemination of smallholder practices and environmental protection. A special focus is placed on the participation of women.",31120,True,False,False,False,False,False,False,True,"The initiative aims to enhance the livelihoods of smallholder families in Eastern El Salvador through sustainable agriculture and housing improvement, specifically focusing on building earthquake-resistant and ecological dwellings. It also emphasizes the role of local decision-makers in promoting these practices and environmental protection, with a special focus on women's participation.","The text explicitly mentions 'improvement of existing and newly built dwellings,' which aligns with the provision or upgrading of housing. This indicates an activity within the 'Housing' class. The context is rural, as it refers to smallholder families, which points towards activities in specific rural locations, fitting the 'Rural' classification. There is no explicit mention of homelessness shelters, transitional housing due to crises, incremental housing sites or services, social housing initiatives like cooperatives or public housing, market-based housing solutions such as mortgages or rentals, nor urban-specific activities.",True,False,False,False,False,False,False,True
"STRENGTHENING NETWORKING FOR PRO-POOR URBAN DEVELOPMENT IN LATIN AMERICA The project contributes to a profound social change in Latin America that promotes, defends and upholds the rights of all people to the territories they inhabit and to a safe place where they can live in peace, dignity and in harmony with nature. (LDC-Part)",16030,True,False,False,False,False,False,True,False,"The project aims to support pro-poor urban development in Latin America by promoting social change that defends the rights of people to safe and dignified living spaces, focusing on housing policies and administrative management.","The text explicitly mentions 'Housing policy', which aligns with the definition of the 'Housing' class as it involves technical assistance for housing. The emphasis on urban development places it under the 'Urban' classification since it specifies activities in specific urban locations (Latin America). The project's focus on promoting rights to safe living spaces also indirectly relates to upgrading inadequate housing conditions, reinforcing the 'Housing' category.",True,False,False,False,False,False,True,False
"PROMOTING LEGAL EMPOWERMENT OF THE URBAN POOR IN NIGERIA THROUGH AN INTER-CITY COMMUNITY PARALEGAL NETWORK Approximately 67% of urban populations in Nigeria live in informal settlements and are caught in a poverty trap characterized by marginalization and insecurity. Communities lack access to basic services and security of tenure and they face discrimination and threats of physical violence. Ethnic minorities, urban migrants, and women are particularly vulnerable to social and political exclusion. To date, approaches to urban development have emphasized policies of decongestion, formalization of informal settlements, or beautification, which have often resulted in arrests, forced evictions, and demolitions of informal settlement communities. Many people living on the margins of Nigeria's cities have struggled to exercise their basic rights.   Against that backdrop, this project aims to address some of the most critical justice and governance challenges facing Nigeria's urban poor. The research builds on five years of experience of an innovative inter-city network of community paralegals, trained and supported by Justice and Empowerment Initiatives – Nigeria. The network currently serves over 100 informal settlements (slums) in Lagos and Port Harcourt.    The research will comprise three streams. First, the team will identify the priority justice challenges experienced by informal settlement residents, with their direct participation. Another stream will study the immediate costs and longer-term impacts of these justice challenges on residents, with a view to understanding their relationship with the poverty trap. A final stream will explore the broader societal costs of current urban policy approaches and will conduct cost-benefit analyses on proposed alternatives. Research findings will be used to identify and test legal empowerment strategies to improve urban poor communities' capacity to respond to priority justice challenges. Findings will also feed efforts to improve public awareness and perceptions about the development and justice challenges faced by the urban poor and to foster collaborative engagement between urban poor communities, civil society, and government. Researchers and informal settlement residents will co-produce outputs and knowledge products.",15130,True,False,False,True,False,False,True,False,"The project focuses on promoting legal empowerment for Nigeria's urban poor through an inter-city community paralegal network. It addresses issues like marginalization, lack of basic services, and insecurity in informal settlements, particularly affecting ethnic minorities, migrants, and women. The initiative involves research to identify justice challenges, analyze their costs and impacts, and explore the societal costs of current urban policies. It aims to develop legal empowerment strategies, improve public awareness, and foster collaboration between communities, civil society, and government.","The text describes activities related to addressing issues faced by the urban poor in Nigeria's informal settlements. These include marginalization, lack of basic services, insecurity, and discrimination, which are primarily urban challenges. The project focuses on legal empowerment rather than direct housing provision or improvements. It does not explicitly mention homelessness, transitional shelters, incremental housing services, social housing models like cooperatives or public housing, or market-oriented housing solutions such as mortgages or rent-to-own schemes. Instead, the text's emphasis is on addressing urban poverty and governance challenges through community paralegal networks, making it specifically related to urban settings.",False,False,False,False,False,False,True,False
"SUPPORT FOR THE REDUCTION OF URBAN AND SOCIAL BACKWARDNESS The general objective of this Technical Cooperation (TC) is to support the Ministry of Agrarian, Territorial and Urban Development (SEDATU) in its purpose of reducing urban and social backwardness, through the implementation of the Urban Improvement Program (PMU). The specific objectives are: (i) increase SEDATU's institutional technical capacities in relation to environmental safeguards, gender and inclusion, risks and climate change, and (ii) strengthen mechanisms for verification and follow-up of environmental and gender management in SEDATU's programs.",16040,False,False,False,False,False,False,True,False,"The text describes a Technical Cooperation aimed at reducing urban and social backwardness by supporting the Ministry of Agrarian, Territorial and Urban Development (SEDATU) through an Urban Improvement Program. The objectives include enhancing institutional technical capacities related to environmental safeguards, gender and inclusion, risks, and climate change, as well as strengthening mechanisms for monitoring these aspects in SEDATU's programs. The sector is identified as low-cost housing.","The text explicitly mentions the support of a program focused on urban improvement, which aligns with the 'Urban' classification. It also refers to low-cost housing as part of its sector focus, fitting the 'Social' classification due to its connection to affordable or social housing initiatives designed to reduce social backwardness.",False,False,False,False,True,False,True,False
Adapting Local Integrated Urban Development Plans tothe Sustainable Developments Goals Through Multistakeholderand Multi-Governance Approaches,43030,False,False,False,False,False,False,True,False,The text describes efforts to adapt local integrated urban development plans in alignment with the Sustainable Development Goals using multistakeholder and multi-governance approaches within the context of urban development and management.,"The primary objective is to integrate urban development plans with sustainable development goals, indicating a focus on broad urban planning strategies. The text explicitly mentions 'urban development and management,' which directly corresponds to activities within specific urban locations. There are no explicit references to any other sector such as homelessness, transitional housing, incremental improvements, social housing initiatives, market-driven housing developments, or rural activities.",False,False,False,False,False,False,True,False
AFFORDABLE HOUSING PROJECT (LISP III) The objective of the project is to improve significantly the living conditions of low and lower-middle income population by providing wider access to affordable and improved quality housing.,14020,True,False,False,False,True,False,False,False,"The Affordable Housing Project aims to enhance the living conditions for low and lower-middle income populations by increasing access to affordable, high-quality housing.","The text explicitly mentions 'affordable' and 'housing', which directly aligns with the class definitions. Although it also refers to water supply and sanitation, these services are part of upgrading inadequate housing as per the expanded definition of the housing sector. The primary focus is on affordable housing provision for specific income groups.",True,False,False,False,True,False,False,False
"PROMOTION OF BEEKEEPING ACTIVITY IN THE BUFFER ZONE OF THE PUCA WILDLIFE REFUGE To extend Forest Service efforts to improve forest policies and practices internationally, address climate change, conserve and protect critical global forest environments and resources, and improve the lives of forest-dependent peoples by awarding grants to and entering into cooperative agreements with nonprofit organizations, multilateral organizations, and other individuals, organizations, institutions, and governments engaged in forest conservation and management.",41030,False,False,False,False,False,False,False,False,"The text describes a promotion of beekeeping activity within the buffer zone of the Puca Wildlife Refuge. The initiative is part of efforts by the Forest Service to improve forest policies internationally, address climate change, conserve critical global forest environments and resources, and enhance the lives of forest-dependent peoples through grants and cooperative agreements with various entities engaged in forest conservation and management.","The text focuses on biodiversity within a wildlife refuge area and does not mention any activities related directly to housing or shelter. It emphasizes beekeeping, which is an agricultural activity, rather than human habitation or living conditions. Consequently, there are no explicit references to the provision of housing, homelessness shelters, transitional housing due to crises, incremental housing improvements, social housing programs, market-rate housing initiatives, or specific urban/rural development activities within this text.",False,False,False,False,False,False,False,False
CLIMATE CHANGE RESILIENCE - EMERGENCY SHELTERS This Activity aims to strengthen Tokelau's resilience to the impacts of climate change through the design and construction of climate resilient emergency shelters.,43060,False,False,True,False,False,False,False,False,"The activity focuses on strengthening Tokelau's resilience to climate change by designing and constructing climate-resilient emergency shelters, falling under the sector of disaster risk reduction.",The text describes the construction of emergency shelters aimed at addressing the impacts of climate change. This aligns with the 'Transitional' class because it involves housing provided due to crises/disasters/emergencies. It also matches the 'Housing' class as it includes the provision and construction of shelter in emergencies.,True,False,True,False,False,False,False,False
MULTISECTORAL SUPPORT TO ENHANCE INTEGRATION OF UKRAINIAN AND THIRD COUNTRY NATIONALS IN POLAND 1) Temporary shelter and non-food relief supplies (including winter relief supplies)(2) Psychological and emotional care for vulnerable groups,93010,False,False,True,False,False,False,False,False,"The activities described focus on providing temporary shelters and non-food relief to Ukrainian nationals and third-country nationals, along with psychological and emotional support. This is aimed at enhancing their integration in Poland.","The text explicitly mentions the provision of 'temporary shelter,' which aligns with transitional housing as it involves housing provided due to crises or emergencies for displaced persons. Additionally, although not directly stated, the context implies this is specifically for refugees/asylum seekers, further supporting the classification under transitional activities. The inclusion of psychological and emotional care indicates a holistic approach but does not expand into other housing-specific sectors such as incremental, social, or market.",False,False,True,False,False,False,False,False
"SUPPORT FOR VICTIMS OF HUMAN TRAFFICKING TO RECEIVE PSYCHOSOCIAL ASSISTANCE Support victims of human trafficking to receive individually-tailored, victim-centred psychosocial support by means of capacitating NGO-run shelters for victims of human trafficking.",12340,False,False,True,False,False,False,False,False,"The text describes a program that provides psychosocial assistance to victims of human trafficking through non-governmental organization (NGO) run shelters, focusing on individualized and victim-centered support.","The primary focus of the activity is providing psychosocial support within NGO-run shelters for human trafficking victims. While it mentions 'shelters,' these are not described in terms directly related to housing provision or homelessness services such as tents, encampments, or homeless shelters. The context here is more about crisis intervention and care rather than traditional housing solutions or homelessness alleviation. Therefore, it does not match the definitions provided for any of the classes under housing sector activities.",False,False,False,False,False,False,False,False
"F.A: STRENGTHENING YOUTH VOICE FOR CIVIC ACTION The young people in Uganda have the know-how, passion, drive, and dynamism to provoke significant change around them. Yet, they are rarely included in civic dialogue, poorly represented in political spaces, and all too often sidelined from decision making. The civic and political participation of Ugandan youth is hindered by lack of political will, mistrusts between youth and duty bearers and socio-economic constraints such as unemployment. The overall objective is to contribute to a peaceful Ugandan society where young men and women actively contribute to transformation of conflicts, maintenance of peace, and socio-economic development of their communities. The expected result is improved capacity of youth to lead actions against the root causes of conflict and violence in their communities. Furthermore, the capacity of networks and youth-led organisations is strengthened to participate in decision making and influence policy discourse. The project also aims to enhance capacity of local duty bearers in state and non-state institutions to engage actively with the youth and play a more active role in enabling youth aspirations.      Right-holders/beneficiaries: 10,060 youth (50% M and 50% F) and indirectly 20, 000 young people between 15 and 30 years, including young women, refugee youth, youth with disabilities, youth in schools, youth out of school, youth in grassroot organizations and youth in slum areas.Duty bearers: Local government technical and political leaders, teachers, members of parliament, leaders in CSOs, parents, religious and cultural leaders, women leaders and private sector. Implementing partner: Uganda Muslim Youth Development Forum (UMYDF)",15220,False,False,False,False,False,False,False,False,The project aims to empower Ugandan youth by enhancing their civic participation and capacity for peace-building and socio-economic development. It focuses on engaging young people in decision-making processes and fostering cooperation between them and local duty bearers.,"1. Housing: The text does not explicitly mention any activities related to the provision or improvement of housing, shelter, services, construction, policy, technical assistance, or finance for housing.
2. Homelessness: There is no reference to tents, encampments, or shelters specifically for the homeless.
3. Transitional: There are no mentions of housing provided due to crises/disasters/emergencies, refugee shelters, camps, or temporary supportive housing.
4. Incremental: The project does not explicitly address housing sites, services, technical assistance, slum upgrading, improvements/repairs, or neighborhood integration.
5. Social: While the project includes youth from various socio-economic backgrounds (e.g., in schools, out of school, slums), it does not specifically describe community land trusts, cooperative housing, public housing, affordable housing, or low-cost housing initiatives.
6. Market: The text does not mention home-rental, mortgages, rent-to-own housing, or market-rate housing activities.
7. Urban: There is a reference to youth in slum areas, indicating some urban context involvement.
8. Rural: While the project includes rural beneficiaries indirectly through its wide reach of young people, there are no specific activities explicitly described for rural settings.",False,False,False,False,False,False,True,False
"IMPROVING THE SEXUAL AND REPRODUCTIVE HEALTH OF WOMEN IN SANTA ROSA DE COPÁN. Título completo del proyecto: Mejora de la salud sexual y reproductiva de las mujeres en Santa Rosa de Copán. :: Este proyecto se centra en la mejora de infraestructuras del Hogar maternal, una casa refugio que acoge a mujeres embarazadas en las semanas previas al parto y tras él, a mujeres que habiendo recibido el alta, no pueden llevar a sus hijos-as a casa por estar ingresados-as.Las usuarias del Hogar, son mayoritariamente mujeres campesinas que viven lejos de la ciudad, que se acercan a la ciudad, en ocasiones a pie desde largas distancias con antelación al parto. Tras la visita médica, si el Hospital le recomienda ingresar en el Hogar deben hacerlo o quedarse en la ciudad. Con anterioridad a la existencia del Hogar, las mujeres vagaban por la ciudad, sin cobijo ni protección, lo que daba lugar incluso a asaltos y muertes de madres y criaturas por la falta de atención previa al parto.",12230,False,False,True,False,False,False,True,True,"The project aims to improve the sexual and reproductive health of women in Santa Rosa de Copán by enhancing the infrastructures of a maternal home, which provides shelter for pregnant women before and after childbirth when they cannot return home due to their children's hospitalization. This initiative specifically addresses the needs of rural campesina women who travel from distant areas into the city for medical care.","The text describes improvements in infrastructure related to a maternal home, which is part of healthcare provision rather than housing per se. While it does address a form of shelter (a house refuge), it does not focus on traditional housing elements like construction or urban development. It involves healthcare services for women and children rather than addressing homelessness or transitional housing needs specifically due to crises/disasters/emergencies. There's no indication of incremental upgrades typical in the housing sector, nor is there a discussion about social or market-driven housing initiatives. The activities are centered around basic health infrastructure improvements specific to rural locations.",False,False,False,False,False,False,False,True
