text,sector_code,Housing DK,Homelessness DK,Transitional DK,Incremental DK,Social DK,Market DK,Urban DK,Rural DK,thoughts AI,Housing AI,Homelessness AI,Transitional AI,Incremental AI,Social AI,Market AI,Urban AI,Rural AI
AFFORDABLE HOUSING PROJECT (LISP III) The objective of the project is to improve significantly the living conditions of low and lower-middle income population by providing wider access to affordable and improved quality housing.,14020,True,False,False,False,True,False,False,False,"The title and description of the 'Affordable Housing Project (LISP III)' mention improving living conditions for low and lower-middle-income populations through increased access to affordable and improved quality housing. This aligns with the definition of 'Housing' as it involves the provision of housing, improvement in housing quality, and potentially includes urban development or technical assistance for housing. There is no explicit reference to homelessness shelters, transitional housing (like emergency shelters), incremental upgrades such as structural repairs or slum upgrading, specific forms of social housing like community land trusts or cooperative housing, market-rate activities such as home-rental or mortgages, or a particular focus on urban or rural locations. Therefore, the primary classification that matches is 'Housing'.",True,False,False,False,False,False,False,False
"PROMOTION OF BEEKEEPING ACTIVITY IN THE BUFFER ZONE OF THE PUCA WILDLIFE REFUGE To extend Forest Service efforts to improve forest policies and practices internationally, address climate change, conserve and protect critical global forest environments and resources, and improve the lives of forest-dependent peoples by awarding grants to and entering into cooperative agreements with nonprofit organizations, multilateral organizations, and other individuals, organizations, institutions, and governments engaged in forest conservation and management.",41030,False,False,False,False,False,False,False,False,"The given text describes an activity related to promoting beekeeping within the buffer zone of a wildlife refuge, focusing on forest policies, climate change, conservation, and improving lives of forest-dependent peoples through grants and cooperative agreements for forest conservation and management. Based on these details, let's evaluate each potential class:

- **Housing**: The text does not mention housing-related activities such as construction, upgrading, or policy.
- **Homelessness**: There are no mentions of tents, encampments, or shelters specifically for the homeless.
- **Transitional**: There is no mention of emergency shelters, refugee camps, or temporary supportive housing.
- **Incremental**: The text does not describe activities like slum upgrading, structural repairs, or neighborhood integration related to housing.
- **Social**: There are no mentions of community land trusts, cooperative housing, or public housing.
- **Market**: There is no mention of home-rental, mortgages, rent-to-own housing, or market-rate housing.
- **Urban**: The activity does not specify being in an urban location; it is mentioned as a buffer zone within a wildlife refuge, which implies a more natural or rural setting.
- **Rural**: Although the text does not explicitly mention 'rural,' the description of activities within a wildlife refuge buffer zone suggests involvement with natural or non-urban areas, aligning more closely with rural characteristics than urban ones.",False,False,False,False,False,False,False,True
CLIMATE CHANGE RESILIENCE - EMERGENCY SHELTERS This Activity aims to strengthen Tokelau's resilience to the impacts of climate change through the design and construction of climate resilient emergency shelters.,43060,False,False,True,False,False,False,False,False,"The activity described is focused on designing and constructing emergency shelters that are resilient to climate change in Tokelau. The term 'emergency shelters' directly aligns with one of the defined classes, specifically 'Transitional,' which includes emergency shelters as a key element. There is no mention of specific urban or rural locations, so those classifications do not apply here. Similarly, there's no mention of housing provision, homelessness solutions like tents for the homeless, social housing models such as cooperative housing, market-based solutions like mortgages, or incremental approaches like slum upgrading. Therefore, the primary classification that matches this description is 'Transitional.'",False,False,True,False,False,False,False,False
MULTISECTORAL SUPPORT TO ENHANCE INTEGRATION OF UKRAINIAN AND THIRD COUNTRY NATIONALS IN POLAND 1) Temporary shelter and non-food relief supplies (including winter relief supplies)(2) Psychological and emotional care for vulnerable groups,93010,False,False,True,False,False,False,False,False,"The description of the activity involves providing temporary shelter and psychological/emotional support to Ukrainian and third country nationals in Poland. The term 'temporary shelter' aligns with the definition of 'Transitional', which includes emergency shelters, refugee shelters, refugee camps, or temporary supportive housing. This indicates that the effort is focused on offering short-term living arrangements for displaced persons, qualifying it under the Transitional class. There is no mention of activities specifically related to homelessness (e.g., tents or encampments), housing provision in a broader sense, slum upgrading, community land trusts, cooperative housing, market-rate housing, specific urban or rural locations, or other classes defined by their respective criteria.",False,False,True,False,False,False,False,False
"SUPPORT FOR VICTIMS OF HUMAN TRAFFICKING TO RECEIVE PSYCHOSOCIAL ASSISTANCE Support victims of human trafficking to receive individually-tailored, victim-centred psychosocial support by means of capacitating NGO-run shelters for victims of human trafficking.",12340,False,False,True,False,False,False,False,False,"The text describes the provision of support to victims of human trafficking through NGOs running shelters. The focus is on providing psychosocial assistance, which indicates a form of sheltering. Shelters in this context align closely with transitional housing solutions as they are likely temporary and aimed at recovery rather than permanent residence. They serve a similar function to emergency or supportive accommodations for vulnerable populations. There isn't any explicit mention of homelessness shelters, incremental upgrades, social housing models like community land trusts, market-rate initiatives, specific urban or rural activities, or broad housing policy measures in the text.",False,False,True,False,False,False,False,False
"F.A: STRENGTHENING YOUTH VOICE FOR CIVIC ACTION The young people in Uganda have the know-how, passion, drive, and dynamism to provoke significant change around them. Yet, they are rarely included in civic dialogue, poorly represented in political spaces, and all too often sidelined from decision making. The civic and political participation of Ugandan youth is hindered by lack of political will, mistrusts between youth and duty bearers and socio-economic constraints such as unemployment. The overall objective is to contribute to a peaceful Ugandan society where young men and women actively contribute to transformation of conflicts, maintenance of peace, and socio-economic development of their communities. The expected result is improved capacity of youth to lead actions against the root causes of conflict and violence in their communities. Furthermore, the capacity of networks and youth-led organisations is strengthened to participate in decision making and influence policy discourse. The project also aims to enhance capacity of local duty bearers in state and non-state institutions to engage actively with the youth and play a more active role in enabling youth aspirations.      Right-holders/beneficiaries: 10,060 youth (50% M and 50% F) and indirectly 20, 000 young people between 15 and 30 years, including young women, refugee youth, youth with disabilities, youth in schools, youth out of school, youth in grassroot organizations and youth in slum areas.Duty bearers: Local government technical and political leaders, teachers, members of parliament, leaders in CSOs, parents, religious and cultural leaders, women leaders and private sector. Implementing partner: Uganda Muslim Youth Development Forum (UMYDF)",15220,False,False,False,False,False,False,False,False,"The description provided focuses on the civic engagement and empowerment of youth in Uganda rather than directly addressing housing or shelter-related activities. The project's objective is to strengthen the capacity of young people for civic action, leadership against conflict and violence, participation in decision-making, and influencing policy discourse. There are no explicit mentions of provision of housing, shelters, slum upgrading, community land trusts, cooperative housing, public housing, home rental, mortgages, or any market-rate housing activities that would match the definitions provided for each class. Additionally, there are no specific references to homelessness, transitional housing such as refugee camps or emergency shelters, incremental housing services like structural repairs or neighborhood integration, social housing entities, urban or rural location-specific housing activities. The primary focus is on youth involvement in civic and political spaces, with attention given to including young people from various backgrounds (e.g., refugees, those in slum areas), but this does not translate directly into any of the specific housing sector classes listed.",False,False,False,False,False,False,False,False
"IMPROVING THE SEXUAL AND REPRODUCTIVE HEALTH OF WOMEN IN SANTA ROSA DE COPÁN. Título completo del proyecto: Mejora de la salud sexual y reproductiva de las mujeres en Santa Rosa de Copán. :: Este proyecto se centra en la mejora de infraestructuras del Hogar maternal, una casa refugio que acoge a mujeres embarazadas en las semanas previas al parto y tras él, a mujeres que habiendo recibido el alta, no pueden llevar a sus hijos-as a casa por estar ingresados-as.Las usuarias del Hogar, son mayoritariamente mujeres campesinas que viven lejos de la ciudad, que se acercan a la ciudad, en ocasiones a pie desde largas distancias con antelación al parto. Tras la visita médica, si el Hospital le recomienda ingresar en el Hogar deben hacerlo o quedarse en la ciudad. Con anterioridad a la existencia del Hogar, las mujeres vagaban por la ciudad, sin cobijo ni protección, lo que daba lugar incluso a asaltos y muertes de madres y criaturas por la falta de atención previa al parto.",12230,False,False,True,False,False,False,True,True,"The project description focuses on improving the sexual and reproductive health of women in Santa Rosa de Copán by enhancing the facilities of a maternal home that serves as a refuge for pregnant women before and after childbirth. Key elements include supporting women who are predominantly rural, coming from distant areas to access medical services, and staying at this refuge either prior to or post-delivery when recommended by healthcare providers. The project addresses issues faced by these women in urban settings before the establishment of the maternal home, such as lacking shelter which led to safety risks. Given the context, potential classifications could include aspects related to 'Transitional' housing due to the nature of the refuge as a temporary supportive environment and 'Urban' due to activities specifically taking place in Santa Rosa de Copán, an urban location. 'Rural' might also be considered since the women primarily come from rural areas.",False,False,True,False,False,False,True,False
"IMPROVING ENERGY EFFICIENCY IN THE BUILDING SECTOR THROUGH THE USE OF RENEWABLE RAW MATERIALS FROM AGROFORESTRY SYSTEMS The project has two main objectives: (a) increasing energy efficiency in the housing sector and (b) providing a local source of sustainable building and insulation materials to substitute fossil-based materials and wood imports. The main target groups of the project are manufacturers, construction companies, and farmers. Through the cooperation with wood processing companies in Uzbekistan, long-term impulses for the sustainable development of the timber construction sector are being set in the local business environment. Key stakeholders as well as a broader audience will be reached through training and e-learning modules for vocational and higher education and by constructing a model house. The project activities are organized into three threads. The first one focuses on analyzing the current situation and capacities of the wood processing industry and how to improve it. In the second thread we design a building system based on local materials and construct an affordable model house, bearing in mind contemporary needs for climate-adaptive architecture, local building traditions as well as challenges related to the use of renewable energies. The third thematic thread of the project focuses on education and developing e-learning materials on the use of locally available renewable resources (e.g. from poplars and other fast-growing wood species) for innovative building systems in Uzbekistan.",23183,True,False,False,False,False,False,False,False,"The description provided primarily revolves around enhancing energy efficiency within the housing sector by utilizing renewable raw materials derived from agroforestry systems. Key components include improving the timber construction sector, developing sustainable building and insulation materials, and constructing a model house using local resources for climate-adaptive architecture. The project targets manufacturers, construction companies, and farmers in Uzbekistan, indicating an emphasis on practical application within the housing domain. This aligns with activities associated with housing development and upgrading inadequate housing through innovative practices. Additionally, there's no mention of addressing homelessness, transitional needs such as emergency or refugee shelters, incremental improvements like slum upgrading, or specific urban or rural settings, although the project is based in Uzbekistan, which could imply a general rural focus due to its agroforestry aspect. The description does not explicitly involve social housing projects like community land trusts or cooperative housing, nor market-related activities such as home-rental or mortgages. Therefore, the classification primarily fits under 'Housing' with possible consideration for 'Rural'.",True,False,False,False,False,False,False,True
"MAINTENANCE OF THE DISPLACEMENT TRACKING MATRIX EMERGENCY EVENT TRACKING, IMPLEMENTATION OF A COMPREHENSIVE EMERGENCY RESPONSE PROGRAM. Maintenance of the Displacement Tracking Matrix Emergency Event Tracking, Implementation of a comprehensive Emergency Response Program, focusing on the provision of emergency Non-Food Items kits and shelter solutions as well as emergency health response",72010,False,False,True,False,False,False,False,False,"The text describes activities related to maintaining a Displacement Tracking Matrix and implementing an Emergency Response Program. Key elements include emergency event tracking, providing non-food items kits, shelter solutions, and emergency health response. The mention of 'shelter solutions' suggests involvement with temporary or transitional housing scenarios. However, it does not specify any permanent housing construction, social housing models like public housing or cooperative housing, nor explicitly describe homelessness shelters or encampments. It also lacks details on urban or rural-specific activities and doesn't discuss market mechanisms such as mortgages or rent-to-own schemes. The primary focus appears to be on transitional support during emergencies rather than long-term solutions.",False,False,True,False,False,False,False,False
"GAZA  - WORLD HEALTH ORGANIZATION INTERAGENCY FLASH APPEAL - 2023/GAZA - APPEL ÉCLAIR INTERINSTITUTIONS DE L'ORGANISATION MONDIALE DE LA SANTÉ - 2023 October 2023 -  the Office for the Coordination of Humanitarian Affairs (OCHA) issued a three-month interagency Flash Appeal for USD 294 million to address the most urgent needs of affected populations in West Bank and Gaza, and neighboring countries, including Egypt and Lebanon, including food, shelter, emergency health assistance, water sanitation and hygiene, protection services and other life-saving humanitarian assistance.With GAC's support, the World Health Organization (WHO) will respond to immediate health needs in West Bank and Gaza, and neighboring countries, including Egypt and Lebanon. This project is expected to help meet the health and nutrition needs of up to 600,000 people. Project activities include: 1) treating the wounded, trauma-affected and others in need of heath care, prioritizing emergency medical services people with disabilities, older persons, children and other vulnerable groups, 2) providing life-saving sexual and reproductive health services, including prenatal care, and 3) coordinating the health cluster response to emergency health needs. / Octobre 2023 - Le Bureau de la coordination des affaires humanitaires (OCHA) a lancé un appel éclair interinstitutions de trois mois pour un montant de 294 millions USD afin de répondre aux besoins les plus urgents des populations touchées en Cisjordanie et à Gaza, ainsi que dans les pays voisins, notamment l'Égypte et le Liban, notamment en matière de nourriture, d'abris, d'aide sanitaire d'urgence, d'eau, d'assainissement et d'hygiène, de services de protection et d'autres formes d'aide humanitaire vitale.Avec le soutien du GAC, l'Organisation mondiale de la santé (OMS) répondra aux besoins immédiats en matière de santé en Cisjordanie et à Gaza, ainsi que dans les pays voisins, notamment l'Égypte et le Liban. Ce projet devrait permettre de répondre aux besoins sanitaires et nutritionnels de 600 000 personnes. Les activités du projet comprennent 1) le traitement des blessés, des personnes ayant subi un traumatisme et des autres personnes ayant besoin de soins de santé, en accordant la priorité aux services médicaux d'urgence, aux personnes handicapées, aux personnes âgées, aux enfants et aux autres groupes vulnérables , 2) la fourniture de services de santé sexuelle et génésique vitaux, y compris les soins prénataux , et 3) la coordination de la réponse du groupe de santé aux besoins sanitaires d'urgence.",72010,True,False,True,False,False,False,False,False,"The text describes a humanitarian appeal by the World Health Organization (WHO) and the Office for the Coordination of Humanitarian Affairs (OCHA) to address urgent needs in West Bank, Gaza, Egypt, and Lebanon. The focus is on health and nutrition assistance alongside food, shelter, emergency health, water sanitation, hygiene, protection services, and other life-saving humanitarian aid. In analyzing the text against the given class definitions:

1. **Housing**: The appeal mentions 'shelter' as part of the urgent needs but does not provide details about housing construction, upgrading, or urban development.
2. **Homelessness**: There's no specific mention of tents for the homeless, encampments, or homeless shelters.
3. **Transitional**: No explicit mention of emergency shelters, refugee camps, or temporary supportive housing is made.
4. **Incremental**: The text does not explicitly describe activities such as slum upgrading, housing structural repairs, or neighborhood integration.
5. **Social**: There's no reference to community land trusts, cooperative housing, or public housing.
6. **Market**: No mention of home rental, mortgages, rent-to-own housing, or market-rate housing is found in the text.
7. **Urban**: The assistance is provided in specific locations including urban areas (West Bank and Gaza), which are mentioned explicitly as part of the geographic focus.
8. **Rural**: While rural areas may be included within West Bank and Gaza, there's no explicit mention or focus on activities specifically targeting rural areas alone.

The primary classification that aligns with the text is 'Urban' due to the specific reference to urban locations like West Bank and Gaza where the aid is being directed.",False,False,False,False,False,False,True,False
Climate change adaptation in vulnerable coastal cities and ecosystems of the Uruguay River URBAN DEVELOPMENT AND MANAGEMENT Reduce vulnerability conditions and contribute to build climate change and variability resilience in vulnerable coastal communities and ecosystems of the lower Uruguay river  including adaptation measures based on communities and ecosystems  while focusing and streamlining human rights  gender and generations perspectives,43030,False,False,False,False,False,False,True,False,"The title and description mention 'climate change adaptation' and 'vulnerable coastal cities and ecosystems,' which suggests a focus on urban areas, specifically those near the Uruguay River. The text discusses reducing vulnerability conditions and building resilience in these communities and ecosystems, focusing on human rights, gender, and generational perspectives. This aligns with activities that are typically associated with urban development due to the reference to 'urban development' and 'management.' While the description does not explicitly mention housing or any specific type of housing activity (like transitional or incremental), it implies a broader context of urban planning and adaptation, which is often linked with urban classifications. There is no explicit reference to homelessness, social housing models like community land trusts, cooperative housing, or public housing; nor is there mention of market-based activities such as home rental or mortgages. The focus on coastal communities does not directly imply rural areas unless those communities are specified as non-urban, which the text does not suggest. Therefore, based on these considerations, 'Urban' is the most relevant classification.",False,False,False,False,False,False,True,False
"Project title: PIPS V - Providing Integrated Protection Services in Mardin, Diyarbakir and Istanbul, Sector: Food security and livelihoods Protection Shelter and settlements WASH, Subsector: N/A, Execution Country: Türkiye, Partner Name: GAC-DE",72010,True,False,True,False,False,False,True,False,"The project title 'PIPS V - Providing Integrated Protection Services in Mardin, Diyarbakir and Istanbul' suggests a focus on integrated services related to protection. The sectors mentioned include Food security and livelihoods, Protection Shelter and settlements, and WASH (Water, Sanitation, and Hygiene). Although the primary focus is not explicitly on housing or shelters, the mention of 'Protection Shelter and settlements' could imply activities related to providing shelter or improving settlement conditions. Mardin, Diyarbakir, and Istanbul are all urban locations in Turkey, which suggests an urban context for the project's execution. The absence of specific details about the nature of the shelter services makes it challenging to classify under more detailed categories like 'Housing,' 'Transitional,' or others without further information.",False,False,False,False,False,False,True,False
SERVICES.MEETINGS / TRAINING APW for logistics and accommodation services.,13040,False,False,False,False,False,False,False,False,"The text mentions training on logistics and accommodation services, which might be related to providing housing solutions or support structures. However, it does not explicitly describe any of the specific activities listed under the defined classes such as provision of housing, shelters for homelessness, transitional housing, or any other forms like social or market-oriented housing solutions. The text lacks direct mention of housing sites, slum upgrades, public housing, mortgages, community land trusts, etc., which are required to classify it under 'Housing', 'Homelessness', 'Transitional', 'Incremental', 'Social', 'Market'. There is no indication that the activities take place in specific urban or rural locations. Therefore, none of these definitions appear to match directly with the text provided.",False,False,False,False,False,False,False,False
