text,sector_code,Housing DK,Homelessness DK,Transitional DK,Incremental DK,Social DK,Market DK,Urban DK,Rural DK,summary AI,reasoning AI,Housing AI,Homelessness AI,Transitional AI,Incremental AI,Social AI,Market AI,Urban AI,Rural AI
Strengthening civic participation of inhabitants and their grass roots organisations in slum areas of Recife,15150,False,False,False,False,False,False,True,False,"The activities focus on strengthening civic participation among inhabitants and grassroots organizations within slum areas of Recife, emphasizing democratic participation and the involvement of civil society.","The text describes efforts to enhance civic participation and support grassroots organizations in slum areas. This aligns with 'Incremental' due to its mention of 'slum upgrading,' which involves improving living conditions through community engagement. It also fits within 'Urban' because it specifies activities in Recife, a city setting. The focus on democratic participation and civil society doesn't explicitly describe housing provision or homelessness but highlights community involvement typically associated with urban incremental improvements.",False,False,False,True,False,False,True,False
"APPUI AUX FAMILLES MILITAIRES DES CAMPS DE KINDU (2IÈME PHASE) ET LOKANDU - FAMIKI II/FAMILO België heeft militaire partnerschappen (Programme de Partenariat Militaire - PPM), met verschillende landen in Afrika, teneinde er ter plaatse de hervorming van de veiligheidssector te ondersteunen en mee te werken aan de oprichting van een professioneel nationaal leger, dat ten diensten staat van haar bevolking en de mensenrechten eerbiedigt. Het militaire partnerschap met de Democratische Republiek Congo omvat vooral de vorming van, toezicht op en evaluatie van een 'URR' brigade (Unité de Réaction Rapide  - een soort paracommando's) bestaande uit drie elite bataljons (321e, 322e en 323e Bataillons de Réaction Rapide) te Kindu, naast de vorming, de begeleiding en evaluatie van de onderrichters van de Militaire Academie van Kananga en van de Genieschool in Likasi. Het 321e bataljon werd eind 2008-begin 2009 gevormd te Kananga, het 322e bataljon eind 2011-begin 2012 te Kindu en tenslotte het 323e bataljon in de loop van 2013 te Kindu. Blijft nog de vorming van de staf van de brigade die de drie gevormde elite bataljons zal omkaderen. Wanneer een militair in de Democratische Republiek Congo een standplaats krijgt toegewezen om er tijdelijk te verblijven, trekt zijn gezin bijna altijd mee. Deze verplaatsingen resulteren vaak in moeilijke levensomstandigheden voor de families. Die families dienen op zoek te gaan naar een onderkomen, naar gezondheidszorgen, naar een school voor hun kinderen en naar landbouwgrond om voedsel te kunnen produceren. Dit gebeurt vaak ten koste van de lokale populatie met conflicten als gevolg. Om aan deze tendens een halt toe te roepen, willen de Congolese regering en de Stafdienst van het leger (FARDC – Forces Armées de la République Démocratique du Congo) de militairen en hun gezin een vaste woonplaats bezorgen. Het is de bedoeling de militairen te huisvesten in garnizoensteden verspreid over het hele land. Zo zullen de militairen die op missie vertrekken, gerust gesteld zijn dat hun familie veilig en degelijk gehuisvest is.Kindu gelegen in de provincie Maniema is één van die garnizoensteden. De drie door België opgeleide bataljons worden gehuisvest te Kindu en omgeving, meer bepaald het 321e bataljon in het militaire kamp Lwama, het 322e bataljon in het militaire kamp Lokandu en het 323e bataljon in het militaire kamp Jericho.Nu bevonden deze militaire kampen zich in een lamentabele toestand wegens verwaarlozing ingevolge de oorlogen die de DRC de laatste jaren had gekend. De Belgische defensie in zijn partnerschapsakkoord met de DRC voorziet in de rehabilitatie van de infrastructuur van die kampen maar er waren onvoldoende fondsen voorzien voor de huisvesting van de militairen. Bijgevolg werd aan onze FOD Buitenlandse Zaken, Buitenlandse Handel en Ontwikkelingssamenwerking in het kader van een 3D benadering (défence, diplomatie et développement) gevraagd financieel bij te dragen voor de rehabilitatie van de huisvesting in deze kampen. In een eerste fase werd besloten het kamp Lwama te Kindu te rehabiliteren. GENERAL PURPOSE:  Contribuer à la consolidation de la sécurité avec le rétablissement de l'Autorité de l'Etat dans la partie EST de la RDC et dans la province du Maniema en particulier.SPECIFIC RESULTS:  Volet A: FAMIKI IIR1. Des logements décents pour 223 militaires et leur familles sont construits ,R2. L'accès à l'eau potable pour les familles du camp est assuré ,R3. Des activités sociales, y compris des activités génératrices de revenus, sont fournies et pérennisées.Volet B : FAMILOR4. Des logements décents sont construits pour 200 familles de militaires ,R5. L'accès à l'eau potable pour les familles du camp est assuré.SPECIFIC PURPOSE:  Les conditions de vie des familles des militaires des camps de Kindu et Lokandu ainsi que des populations avoisinantes sont améliorées.",16040,True,False,False,False,False,False,True,False,"The activity involves supporting Congolese military families by improving their living conditions through the construction of decent housing and ensuring access to clean water in Kindu and Lokandu camps. This is part of a broader initiative by Belgium, in partnership with Congo, to enhance security and stability in Eastern DRC. Rehabilitation efforts focus on infrastructure within these military camps.","The text describes the construction of housing for military families in specific locations (Kindu and Lokandu), which directly aligns with activities in the 'Housing' class as it involves provision and upgrading of housing facilities. The emphasis on decent living conditions and infrastructural improvement also fits within this classification.

The initiative includes low-cost housing, which is explicitly mentioned as a goal for military families, fitting into the 'Social' class. This is due to its focus on affordable solutions for specific communities (military families).

Since the activities are concentrated in specific urban locations (Kindu and Lokandu), they also match the 'Urban' classification. 

The activity does not mention homelessness or temporary shelters, so it doesn't align with the 'Homelessness' class. It's not transitional housing since it focuses on more permanent solutions rather than temporary accommodations for crises.

There is no specific mention of market-driven housing initiatives (like mortgages), excluding the 'Market' classification. Similarly, there are no indications of rural activities, so 'Rural' is also excluded.",True,False,False,False,True,False,True,False
E+ KA1 EA JOINT MASTERS PROGRAMMES (EPMC) A3 MUNDUS URBANO Master of Science in International Cooperation and Urban Development,11420,False,False,False,False,False,False,True,False,"The text describes a joint master's program named E+ KA1 EA JOINT MASTERS PROGRAMMES, specifically the 'MUNDUS URBANO' which is a Master of Science focused on International Cooperation and Urban Development. The primary objective is to provide higher education in these areas.","The text explicitly mentions 'Urban Development', linking it to activities within urban settings or contexts as part of its educational focus. There is no explicit mention of housing provision, homelessness, transitional housing, incremental housing projects, social or market-specific types of housing, nor rural activities. The emphasis on higher education and the specific inclusion of urban development suggest a focus on urban areas rather than directly engaging in housing services or infrastructure.",False,False,False,False,False,False,True,False
"CHONGQING INTEGRATED LOGISTICS DEMONSTRATION The project will develop a modern and efficient multimodal logistics system in Chongqing. The outputs of the project will be (i) the Chongqing transportation logistics park, (ii) the Nanpeng logistics park, (iii) the Yangtze River inland waterway roll-on roll-off (Ro-Ro) operations, (iv) a logistics information system, and (v) institutional capacity building. The proposed project is the third urban development project in Chongqing. Lessons from past and ongoing projects were incorporated in the project design, such as devolving more responsibilities to the implementing agency while strengthening its project management and financial management capacity. The proposed project will have demonstration features, namely integrated logistics parks, logistics information system, and inland waterway Ro-Ro operations. These features are all relatively new for logistics projects in the PRC, and their successful introduction through this project will offer opportunities for replication and scaling up. Integrated logistics functions and services in the new logistics parks will reduce wasteful freight movements. Logistics information services will enable logistics service providers, such as freight forwarding companies, to increase efficiency and reduce costs through better tracking and control over the supply chain. Ro-Ro operations will reduce the time and costs of transshipments, incentivizing freight movement on inland waterways.",21040,False,False,False,False,False,False,True,False,"The project aims to develop a modern multimodal logistics system in Chongqing, focusing on creating two logistics parks, improving Yangtze River Ro-Ro operations, implementing a logistics information system, and enhancing institutional capacity. It emphasizes efficient freight movement and integration of various logistical functions.","Upon analyzing the text against each classification:
- Housing: The project does not explicitly mention housing provision, shelter in emergencies, or any urban development specifically related to residential areas.
- Homelessness: There are no descriptions of tents for the homeless, encampments, or shelters directly associated with homelessness.
- Transitional: The text does not discuss housing provided due to crises/disasters/emergencies, refugee shelters, or temporary supportive housing.
- Incremental: The project lacks explicit mention of slum upgrading, housing improvements/repairs, or neighborhood integration services.
- Social: There is no reference to community land trusts, cooperative housing, public housing, affordable housing, or low-cost housing projects.
- Market: No aspects like home-rental, mortgages, rent-to-own housing, or market-rate housing are mentioned.
- Urban: The project is explicitly set in the urban location of Chongqing and involves urban development through logistics parks and systems.
- Rural: The text does not describe activities specific to rural locations.",False,False,False,False,False,False,True,False
USAID/OFDA GRANT FOR FIJI/CYCLONE-2016 Shelter and Settlements Intervention with IFRC in Fiji,72010,False,False,True,False,False,False,False,False,The text describes a USAID/OFDA grant provided to the International Federation of Red Cross (IFRC) for shelter and settlements intervention in Fiji following Cyclone-2016. The focus is on providing material relief assistance and services.,"The description indicates that this project involves responding to an emergency situation (Cyclone-2016) by offering shelter and related services, which fits the definition of housing provided due to crises/disasters/emergencies. This aligns with the 'Transitional' class, as it addresses temporary housing needs following a disaster. The mention of material relief assistance could also suggest elements that improve or provide transitional shelters, further confirming its fit within this classification. No specific information about homelessness, incremental improvements, social housing, market-rate housing, or explicit urban/rural settings is provided.",False,False,True,False,False,False,False,False
ACCORD CADRE CR 2017-2019 Construire des habitations durables à 350 ménages à Ronkh pour mieux les protéger contre les intempéries,16040,True,False,False,False,False,False,False,False,The activity involves constructing durable homes for 350 households in Ronkh to enhance their protection against weather conditions. The focus is on providing low-cost housing.,"The text describes the construction of dwellings, which matches the 'Housing' class due to its explicit mention of housing provision and upgrading inadequate housing to protect against elements. It mentions 'low-cost housing,' aligning with the 'Social' class as it pertains to affordable housing solutions aimed at low-income families.",True,False,False,False,True,False,False,False
"ICRC - PROVISION OF SHELTER, FOOD, WATER AND SANITATION To deliver an effective response to the basic needs of vulnerable people impacted by the crisis in the North East of Nigeria. The programme will deliver humanitarian assistance in nutrition and food security, protection and Education in Emergencies, multi",99810,True,False,True,False,False,False,False,False,"The ICRC program aims to address the basic needs of vulnerable individuals affected by a crisis in Northeast Nigeria by providing shelter, food, water, and sanitation. It encompasses multiple sectors such as nutrition, food security, protection, and education, although specific sectors are not detailed.","The text explicitly mentions the provision of shelter, which directly aligns with the 'Housing' class definition. The reference to delivering humanitarian assistance in emergencies supports a potential match with the 'Transitional' class due to its context of responding to crises. However, it does not specifically mention housing related to homelessness, incremental improvements, or specific urban/rural settings, so those classes do not fit based on the given text.",True,False,True,False,False,False,False,False
"BUILDING HOST CENTRES FOR CHILDREN MONTE CARMELO Se quiere construir una casa de acogida para 60 niños dalits y de comunidades tribales. La intención no es solo dotarles de una vivienda digna, sino facilitarles el acceso a la educación. La mayoría de ellos no son huérfanos, pero sus padres viven en zonas rurales tan apartadas que no pueden desplazarse diariamente al colegio. El nuevo edificio se distribuiría en dos plantas y contaría con comedor, sala de estudio, dormitorio y taquillas. El proyecto consiste en: Construcción de dos salas, cada una de 10x20 m, división de la planta baja en dos espacios (comedor y sala de estudio), vestuario y dormitorio en la sala del primer piso.",11120,True,False,False,False,False,False,False,True,"The activity involves constructing a host center for 60 children from Dalit and tribal communities, aimed at providing them with dignified living conditions and facilitating access to education. The project includes building two floors with specific areas such as a dining area, study room, dormitory, and lockers.","The primary focus of the text is on constructing housing for children who are not necessarily orphans but whose parents live in remote rural areas, making daily school travel impractical. The construction includes facilities that serve educational purposes (like a study room), but these are part of a residential setup meant to provide shelter and dignity to these children. Thus, it involves the provision of housing in a specific context related to education support.

- Housing: The text describes constructing accommodation for 60 children, making it relevant to the 'Housing' class as it includes providing shelter and upgrading living conditions.
- Homelessness: There is no mention of tents or shelters specifically for homeless people; hence this does not match.
- Transitional: This scenario is not due to crises/disasters/emergencies; thus, it doesn't fit here.
- Incremental: While improvements are being made to the children's living conditions, the text does not explicitly describe slum upgrading or housing repairs.
- Social: The project has a social aspect as it targets vulnerable groups (Dalits and tribal communities), but there is no explicit mention of public or affordable housing structures like cooperative housing.
- Market: There are no elements related to home rental, mortgages, or market-rate housing involved in this text.
- Urban: The setting involves rural areas where children's parents reside, thus making it relevant to 'Rural.'
- Rural: Since the children come from remote rural locations and the project aims to ease their access to education by providing nearby accommodation, it fits within the 'Rural' class.",True,False,False,False,False,False,False,True
"ACCESS TO DRINKING WATER IN 210 HOUSES IN THE TOWN OF PAXOT 2, QUICHE El proyecto pretende resolver la insalubridad de las viviendas de 210 familias de Paxot II, mediante la dotación de agua potable para reducir el impacto de las enfermedades derivadas del consumo de agua contaminada. El sistema de abastecimiento será por perforación de un pozo artesanal y el mantenimiento de la red mediante una cuota familiar mensual.",14030,True,False,False,False,False,False,False,False,"The project aims to improve the living conditions of 210 families in Paxot II, Quiché by providing access to clean drinking water. This is intended to reduce health issues caused by contaminated water consumption. The system will involve drilling a well for water provision and maintaining the network through a monthly family fee.","The project explicitly focuses on improving basic services (safe water) in housing, which aligns with activities described under 'Housing'. It involves technical assistance to provide drinking water infrastructure and finance mechanisms via maintenance fees, both of which fall within this category. There is no mention of homelessness, transitional shelters, incremental improvements or repairs, social cooperative models, market-rate initiatives, specific urban or rural settings in the project description.",True,False,False,False,False,False,False,False
Fighting structural hindrances regarding the access to dignified living space in rural areas of Argentina,15150,True,False,False,False,False,False,False,True,The text describes efforts to address structural barriers affecting access to dignified living spaces specifically in rural areas of Argentina. It involves democratic participation and civil society engagement.,"The mention of 'dignified living space' suggests an emphasis on improving housing conditions, which aligns with the Housing class. The focus on 'structural hindrances' indicates that there might be efforts toward incremental improvements or addressing inadequate housing. Since these activities are specifically mentioned in rural areas of Argentina, this matches the Rural classification.",True,False,False,True,False,False,False,True
Support centre for street children in Bangladesh.,11120,False,False,False,False,False,False,True,False,The support center provides education facilities and training to street children in Bangladesh.,"The text describes a support center aimed at providing education and training, focusing on street children. It does not mention any housing-related activities such as provision of shelter or housing services. Therefore, it doesn't match the specific definitions for classes related to housing, homelessness, transitional, incremental, social, market, urban, or rural housing activities.",False,False,False,False,False,False,False,False
"THE WAY FORWARD FOR REFORMS IN THE HOUSING SECTOR: EMPOWERING GRASSROOT  HOMEOWNERS ASSOCIATIONS IN AZERBAIJAN, BELARUS, GEORGIA, MOLDOVA  AND UKRAINE The overall objective is to strengthen and promote the role of CSOs in grass-root decision-making processes in the housing sector in AZ, BY, GE, MD and UA.",16030,True,False,False,False,False,False,False,False,"The text describes an initiative aimed at empowering grassroots homeowners associations in Azerbaijan, Belarus, Georgia, Moldova, and Ukraine to enhance their role in decision-making processes within the housing sector. The focus is on strengthening civil society organizations (CSOs) related to housing policy and administrative management.","The primary activity described involves policy and administrative reforms rather than direct provision of housing or addressing homelessness. It emphasizes empowering homeowners associations for better decision-making, which aligns with broader housing policies and administration. The text does not specify activities like construction, slum upgrading, or provision of shelters; thus, it is more aligned with the overarching policy and management aspects of housing.

- Housing: Matches because the objective involves housing sector reforms and administrative management, even though direct housing provision isn't mentioned.
- Homelessness: Does not match as there's no mention of shelters or encampments for the homeless.
- Transitional: Does not match since it doesn’t describe temporary housing related to crises or disasters.
- Incremental: No explicit reference to incremental housing improvements, slum upgrading, or technical assistance.
- Social: Could be considered a match as it relates to community involvement in housing through CSOs, but no specific mention of public housing or affordable housing initiatives is made.
- Market: Does not match because there are no references to market-rate housing or financial mechanisms like mortgages or rent-to-own schemes.
- Urban: No explicit focus on urban-specific activities; the countries mentioned have both urban and rural contexts.
- Rural: Similarly, there's no specific focus on rural activities.",True,False,False,False,True,False,False,False
Provision of integrated health services for the newly arrived South Sudanese refuges in White Nile and South Kordofan,72010,False,False,False,False,False,False,False,False,"The activities involve providing integrated health services to recently arrived South Sudanese refugees in the White Nile and South Kordofan sectors, along with material relief assistance and other services.","The text describes the provision of integrated health services for newly arrived South Sudanese refugees. This implies a focus on immediate needs following crises or emergencies, typically associated with transitional housing activities. The mention of 'material relief assistance' suggests support in basic necessities, which could relate to transitional shelters and camps where such services are commonly provided. However, there is no explicit reference to housing provision, shelter construction, or any specific type of housing, so it does not clearly fit into the 'Housing', 'Homelessness', 'Incremental', 'Social', 'Market', 'Urban', or 'Rural' classes. The context implies a setting related to crisis management and temporary support rather than permanent housing solutions.",False,False,True,False,False,False,False,False
URBAN DEVELOPMENT AND POOR NEIGHBORHOOD UPGRADING PROJECT,14020,False,False,False,True,False,False,True,False,"The text describes an urban development project focused on upgrading poor neighborhoods, specifically involving large water supply and sanitation systems.","The mention of 'urban development' aligns with the Urban class as it explicitly refers to activities in specific urban locations. The term 'poor neighborhood upgrading' connects with the Incremental class due to its reference to slum upgrading or housing improvements/repairs, which are part of incremental upgrades. The focus on 'water supply and sanitation - large systems' fits under Housing, as it involves providing basic services like safe water and sanitation in inadequate housing conditions.",True,False,False,True,False,False,True,False
