text,sector_code,Housing DK,Homelessness DK,Transitional DK,Incremental DK,Social DK,Market DK,Urban DK,Rural DK,summary AI,reasoning AI,Housing AI,Homelessness AI,Transitional AI,Incremental AI,Social AI,Market AI,Urban AI,Rural AI
REFUGEES ESCAPE ROOM Título completo del proyecto: REFUGIADOS ESCAPE ROOM :: IMPLEMENTAR UNA ESCAPE ROOM COMO ESPACIO INTERACTIVO PARA EMPATIZAR CON LA POBLACION SOMETIDA A DESASTRES NATURALES O HUMANOS Y SE HAN VISTO OBLIGADAS A SALIR DE SU PAIS,99820,False,False,False,False,False,False,False,False,The project involves implementing an interactive escape room designed to foster empathy for populations displaced by natural or human-made disasters. The aim is to promote development awareness rather than directly addressing housing needs.,"The text describes an activity focused on raising awareness and promoting empathy through a simulated experience, rather than directly providing shelter, upgrading housing, or offering transitional housing solutions. It does not mention specific activities related to the provision of housing, homelessness shelters, temporary housing in crises, or any incremental improvements in existing structures.

- Housing: No explicit mention of housing provision or upgrade activities.
- Homelessness: Does not describe providing tents, encampments, or shelters for homeless individuals.
- Transitional: Lacks a description of housing provided due to disasters or emergencies, such as refugee camps or temporary supportive housing.
- Incremental: There is no reference to slum upgrading, neighborhood integration, or housing improvements/repairs.
- Social: No mention of community land trusts, cooperative housing, public housing, affordable housing, or low-cost housing.
- Market: Does not discuss home-rental, mortgages, rent-to-own schemes, or market-rate housing.
- Urban: The text does not specify that the activity is located in an urban setting.
- Rural: Similarly, there are no details indicating a rural location for this project.",False,False,False,False,False,False,False,False
Promoting the human right to adequate housing for the most marginalised among the poor in India,15150,True,False,False,False,False,False,False,False,The text describes an effort aimed at promoting the human right to adequate housing specifically targeting marginalized groups among the poor in India. The focus is on democratic participation and strengthening civil society.,"The primary activity described involves ensuring access to adequate housing, which fits within the 'Housing' category as it pertains to housing policy and technical assistance for housing. There's no explicit mention of homelessness, transitional shelters, incremental improvements, social or market-specific models, urban or rural settings, so these categories do not fit directly based on the provided information.",True,False,False,False,False,False,False,False
"NOM DE L'ORGANISME : NOUVELLE PLANÈTE / PROJET : MISE EN PLACE D'UNE ADDUCTION D'EAU GRAVITAIRE POUR 5'000 HABITANTS L'objectif est de garantir l'accès à l'eau potable pour couvrir les besoins quotidiens des 5'000 habitants à proximité de leur habitation pendant toute l'année, afin de diminuer les trajets et le temps consacré par les femmes pour chercher l'eau et l'absentéisme des filles à l'école, de réduire la prévalence des maladies hydriques liées à la mauvaise qualité de l'eau, de permettre aux femmes de se consacrer aux activités génératrices de revenus, d'améliorer la qualité de vie des villageois et de luttre contre l'exode rural. Le projet prévoit la construction de l'adduction d'eau comprenant 8 bornes-fontaines et un lavoir, la création , structuration et renforcement des capacités du comité de l'eau, ainsi que des formations en technique/entretien de deux techniciens locaux. Les villageois concernés seront sensibilisés à l'entretien, l'hygiène et l'assainissement.",14030,True,False,False,False,False,False,False,True,"The project aims to establish a gravity-fed water supply system for 5,000 residents to ensure year-round access to clean drinking water near their homes. This initiative seeks to reduce the time women spend collecting water, improve school attendance among girls, decrease waterborne diseases, and allow women to focus on income-generating activities. The project involves constructing eight water taps and a washing area, strengthening a local water committee, training two local technicians, and promoting hygiene and sanitation awareness among villagers.","The text focuses on improving access to clean drinking water, which is part of the provision of basic services in inadequate housing under the 'Housing' class. The project's activities do not specifically mention tents, encampments, shelters for homelessness, or temporary housing solutions that would fit the 'Homelessness' and 'Transitional' classes. There are no explicit mentions of slum upgrading, incremental housing improvements, community land trusts, cooperative housing, public housing, affordable housing, or low-cost housing associated with 'Incremental' or 'Social' classes. Similarly, there is no mention of home-rental, mortgages, rent-to-own housing, or market-rate housing relevant to the 'Market' class. While the project benefits rural communities, it does not specifically describe activities limited to either urban or exclusively rural locations for classification under 'Urban' or 'Rural'. Thus, it matches best with the 'Housing' class due to its focus on basic service provision.",True,False,False,False,False,False,False,False
WARM WINTER FOR OLD PEOPLE emergency assistance to the most vulnerable people in temporary accommodation,16010,False,False,True,False,False,False,False,False,"The activity involves providing emergency assistance to elderly individuals living in temporary accommodations during winter. The primary objective is to ensure that the most vulnerable populations, specifically older adults, are protected from cold conditions.","The text mentions 'emergency assistance' and 'temporary accommodation,' which aligns with characteristics of transitional housing, as it addresses short-term solutions due to specific needs or crises. It also highlights support for a vulnerable group within the social protection sector, suggesting involvement in social aspects related to care and welfare.",False,False,True,False,True,False,False,False
"SHELTER, PROTECTION AND HEALTH SUPPORT TO DISPLACED AND THE MOST VULNERABLE PEOPLE AFFECTED BY CYCLONE IDAI",72050,False,False,True,False,False,False,False,False,"The text describes providing shelter, protection, and health support to displaced people and the most vulnerable affected by Cyclone Idai. The focus is on relief coordination and support services.","The description involves providing immediate housing solutions due to a crisis/emergency situation caused by Cyclone Idai. This aligns with the 'Transitional' class, which includes housing provided in response to crises or disasters. There is no specific mention of homelessness shelters, urban or rural specifics, slum upgrading, incremental improvements, community land trusts, cooperative housing, public or affordable housing, or market activities like home-rental or mortgages.",False,False,True,False,False,False,False,False
Infrastructure and Rural Finance Support Program (IRFSP),31120,False,False,False,False,False,False,False,True,The Infrastructure and Rural Finance Support Program (IRFSP) is described as focusing on agricultural development within a rural context. The program's primary objectives involve supporting infrastructure and financial mechanisms to enhance agricultural productivity and sustainability in rural areas.,"The text explicitly mentions 'Agricultural development' within the context of 'Infrastructure and Rural Finance Support Program (IRFSP)' which suggests activities related to improving agriculture, likely including aspects like irrigation, road access for farmers, or financial support services. The mention of a sector implies rural settings due to its focus on agricultural development.

- Housing: There is no mention of provision of housing, shelter in emergencies, upgrading inadequate housing, or other housing-related activities.
- Homelessness: There are no references to tents for the homeless, encampments for the homeless, or homeless shelters.
- Transitional: The text does not describe any temporary supportive housing, refugee shelters, or camps related to crises/disasters/emergencies.
- Incremental: No mention of housing sites, slum upgrading, housing improvements/repairs, or neighborhood integration is made.
- Social: There are no references to community land trusts, cooperative housing, public housing, affordable housing, or low-cost housing.
- Market: The text does not describe activities related to home-rental, mortgages, rent-to-own housing, or market-rate housing.
- Urban: The program is focused on rural areas, given the context of agricultural development, and thus there are no specific urban location activities described.
- Rural: The explicit focus on 'Agricultural development' within the IRFSP indicates that the activities are taking place in rural locations.",False,False,False,False,False,False,False,True
CHILD FRIENDLY CITIES INITIATIVE (CFCI) - UNICEF (CHILD FRIENDLY CITIES PROGRAMME) The initiative was launched in 1996 by UNICEF and UN-Habitat to act on the resolution passed during the second United Nations Conference on Human Settlements (Habitat II) to make cities liveable places for all. The UN Conference declared that the wellbein,15160,False,False,False,False,False,False,True,False,"The Child Friendly Cities Initiative (CFCI), launched by UNICEF and UN-Habitat in 1996, aims to transform cities into livable environments for all residents, emphasizing human rights. The initiative was inspired by resolutions from the second United Nations Conference on Human Settlements (Habitat II).","The text describes an initiative focused on making urban areas more liveable and inclusive, which aligns with urban development activities but does not explicitly mention housing-related tasks or services. There is no specific reference to providing shelter, upgrading housing, or addressing homelessness directly. The emphasis is on broader urban livability rather than the provision of housing itself.",False,False,False,False,False,False,True,False
"ON THE GROUND OPERATIONAL COSTS IN SIERRA LEONE THROUGH THE PROJECT FIDUCIARY MANAGEMENT UNIT (PFMU) These expenses cover the various expenditures on the ground in Sierra Leone, such as material costs for the building of smoke oven shelters, salaries for staff on the ground in Sierra Leone, administrative costs for the PFMU at the Sierra Leone Ministry of Finance, and other costs.",14030,True,False,True,False,False,False,False,False,"The text describes expenses related to operational activities in Sierra Leone by the Project Fiduciary Management Unit (PFMU). These include material costs for building smoke oven shelters, salaries for local staff, administrative costs at the Ministry of Finance, and other associated expenditures. The sector focus is on basic drinking water supply and sanitation.","The text mentions 'material costs for the building of smoke oven shelters,' which implies a provision related to shelter, aligning it with housing activities. Although primarily focused on water supply and sanitation sectors, these aspects often accompany adequate housing improvements or developments, fitting within a broader definition of housing. The mention of shelters suggests an element of temporary or incremental housing solutions, as smoke ovens are generally associated with transitional living conditions for those in need. No explicit mention of homelessness, transitional housing (like refugee camps), social, market-driven, urban, or rural activities was made, nor is there a specific focus on community land trusts, cooperative housing, public housing, affordable housing initiatives, home-rental, mortgages, rent-to-own housing, or market-rate housing. Urban or rural classifications are not specified as the text lacks details about location specifics.",True,False,False,True,False,False,False,False
"EDMUND RICE DEVELOPMENT REINFORCING 'COVID 19 TRANSMIS ES AT RUBEN HEALTH CENTRE TO E NSURE CONTINUITY OF ROUTINE HE ALTH SERVICES IN MUKURU SLUM, PUB The Reinforcing 'covid 19 transmission' control measures at Ruben Health Centre to ensure continuity of routine health services in Mukuru slum, public health responses and social counter measures aims to carry out health activities to address the control of Covid-19 in Kenya.",12264,False,False,False,False,False,False,True,False,The activity involves reinforcing COVID-19 transmission control measures at Ruben Health Centre located in the Mukuru slum to ensure the continuity of routine health services. The focus is on public health responses and social countermeasures to manage and address the spread of COVID-19 in Kenya.,"Let's analyze each class:

- Housing: There is no explicit mention of housing provision, upgrading, or related activities.
- Homelessness: No reference to tents, encampments, or shelters for the homeless.
- Transitional: Although the context involves health services continuity due to an emergency (COVID-19), it does not explicitly describe transitional housing like refugee camps or temporary supportive housing.
- Incremental: The text does not discuss slum upgrading, neighborhood integration, or related incremental housing activities.
- Social: There is no mention of community land trusts, cooperative housing, public housing, affordable housing, or low-cost housing initiatives.
- Market: No reference to home-rental, mortgages, rent-to-own housing, or market-rate housing.
- Urban: The activity occurs in Mukuru slum, which is a specific urban location, thus matching the 'Urban' classification.
- Rural: There is no mention of rural locations; the focus is on an urban setting (Mukuru slum).",False,False,False,False,False,False,True,False
"ACCESS TO THE RIGHT TO A DECENT HOUSING AND BASIC SANITATION FOR 49 WOMEN AND THEIR FAMILIES IN A VULNERABLE SITUATION OF THE RURAL COMMUNITY OF H Título completo del proyecto: Acceso al derecho a la vivienda digna con saneamiento básico para 49 mujeres y sus familias en situación de vulnerabilidad de la comunidad rural de H.R. Palyam, área de Madakasira, distrito de Anantapur :: El proyecto plantea hacer efectivo el derecho a una vivienda digna con saneamiento básico proporcionándoles los recursos humanos, materiales y técnicos necesarios para la correcta construcción de viviendas. Se promueve la reducción de la discriminación que sufren las mujeres, aumentando su consideración social dentro de sus familias y comunidad.",16030,True,False,False,False,True,False,False,True,"The project aims to provide 49 vulnerable women and their families in a rural community with access to decent housing and basic sanitation. It involves supplying the necessary human, material, and technical resources for proper construction of homes. The initiative also seeks to reduce discrimination against women by enhancing their social standing within their families and communities.","The project explicitly mentions the provision of 'housing' in a rural setting, as it discusses providing resources for constructing dignified housing with basic sanitation facilities, which falls under 'Housing'. It targets vulnerable groups, aligning with initiatives that improve inadequate housing conditions. The focus on a specific rural community places this within the 'Rural' classification due to the explicit mention of activities in rural locations.",True,False,False,False,False,False,False,True
"HUMANITARIAN ASSISTANCE FOR DISPLACED PEOPLE BECAUSE OF OTHER SITUATIONS OF VIOLENCE IN THE DEPARTMENT OF PETEN GUATEMALA Este proyecto responde a la situación de crisis humanitaria ocasionada por el desplazamiento masivo de población del norte de Centroamérica en situación de vulnerabilidad económica, social, ambiental y/o política que llega al Departamento de Petén (Guatemala) en su tránsito hacia México y los EE.UU. El proyecto se orienta a fortalecer las capacidades técnicas, estratégicas y materiales de las socias locales participantes en el proyecto para hacer frente a la creciente demanda de refugio por parte de la población migrante en tránsito, brindar refugio adecuado, a la vez que se atiende y apoya las solicitudes de refugio en coordinación con titulares de obligaciones. Asimismo, el proyecto incluye acciones de recogida de testimonio, incidencia y sensibilización en Guatemala y la CAV.",72010,True,False,True,False,False,False,False,False,"The project addresses a humanitarian crisis in Petén, Guatemala, caused by the massive displacement of vulnerable populations from Northern Central America. It aims to strengthen local partners' technical, strategic, and material capabilities to manage increasing demands for refugee accommodations while providing adequate shelter and support. The project also includes actions like testimony collection, advocacy, and awareness-raising.","The text explicitly describes efforts to provide 'refugio adecuado' (adequate refuge) to displaced people due to violence in Petén, Guatemala. This aligns with the definition of 'Transitional,' which involves housing provided due to crises or emergencies like refugee shelters and temporary supportive housing. The focus on strengthening capacities for managing demand and providing shelter further supports this classification. There is no explicit mention of urban or rural settings specific enough to classify under those categories. Additionally, while there are material relief efforts described, they do not specifically pertain solely to upgrading or providing basic services in housing; instead, the context aligns more with emergency response. Hence, it does not fit neatly into 'Housing,' 'Urban,' or 'Rural' as per their definitions.",False,False,True,False,False,False,False,False
"PROVIDING FOOD AND SOAP FOR THE POOR AND UNDERPRIVILEGED FAMILIES OF STUDENTS OF THREE SLUM SCHOOLS IN RESPONSE TO COVID-19 The NGO Glory Bandhu-protim Samaj Kallayan Sangstha (GBSKS) has successfully established and is running 3 schools in Dhaka's slums. Most of the students' parents work in the low income sector, e.g. as rickshaw or van pullers. Because of the countrywide lockdown resulting from the current COVID-19 crisis, many of them have lost their job and are unable to provide their families with food and other essentials. The project aims to support the families of the 1,500 students in during the COVID-19 emergency situation and the lockdown through distributing packages of basic food items and soap.",12240,False,False,False,True,False,False,True,False,"The NGO Glory Bandhu-protim Samaj Kallayan Sangstha (GBSKS) is providing food and soap to families of students from three slum schools in Dhaka during the COVID-19 lockdown, focusing on those whose parents have lost their jobs due to low-income work. The initiative aims to address basic nutrition needs amid the crisis.","The text describes an emergency response aimed at distributing basic necessities like food and soap to underprivileged families affected by job loss due to a lockdown. Here's why each class matches or does not match:

- Housing: There is no mention of housing provision, shelter, upgrades, urban development, or related activities.
- Homelessness: The text doesn't discuss tents, encampments, or shelters for the homeless.
- Transitional: While there is a response to an emergency situation (COVID-19 lockdown), it does not involve providing transitional housing like refugee shelters or temporary supportive housing.
- Incremental: There's no mention of housing sites, slum upgrading, housing improvements/repairs, or neighborhood integration activities.
- Social: No discussion on community land trusts, cooperative housing, public housing, affordable housing, or low-cost housing is present.
- Market: The text doesn't address home-rentals, mortgages, rent-to-own arrangements, or market-rate housing.
- Urban: The activities are specifically occurring in Dhaka's slums, which qualifies as an urban setting. Thus, this fits the 'Urban' classification.
- Rural: There is no indication that activities take place in rural areas.",False,False,False,False,False,False,True,False
"LOGEMENT ROM DE KAKANJ 2018/2019 Founded in 1901 as a catholic organisation, Caritas Switzerland (CACH) prevents, alleviates and combats poverty, while working across sectors and focusing on food security, access to clean and safe water, climate protection and disaster prevention, migration and education for children and adults. With its international programme that combines humanitarian work and development, CACH reaches out to 30 countries in Africa, Latin America and Asia as well as in Eastern Europe.",16040,True,False,False,False,False,False,False,False,"Caritas Switzerland (CACH) focuses on a range of initiatives aimed at combating poverty through international programs that include food security, access to clean water, climate protection, disaster prevention, migration support, and education. The specific activity in question is related to the provision of low-cost housing.","The text mentions 'low-cost housing,' which aligns with activities associated with providing affordable living solutions under the Social class category as defined by community land trusts, cooperative housing, public housing, affordable housing, or low-cost housing. The other classes are not explicitly matched based on the given definitions: there is no mention of homelessness, transitional scenarios like refugee shelters, incremental developments such as slum upgrading, market-based approaches like mortgages, specific urban or rural locations, or broader housing provisions that do not fall under 'low-cost.'",False,False,False,False,True,False,False,False
"PACIFIC URBAN DEVELOPMENT INVESTMENT PLANNING AND CAPACITY DEVELOPMENT FACILITY The knowledge and support technical assistance (TA) will support Pacific island countries to objectively analyze the costs and benefits of available urban investment options, to plan, design and prioritize investments, assess technical suitability, economic, financial and social viability, capacity and institutional issues, address environmental and social safeguards and, identify measures to strengthen project implementation capacity of urban investment projects. At the same time, the countries need to develop institutional, policy and human resource capacity to effectively plan and manage urban investments, so that social and economic benefits are maximized. ADB continues to receive requests from Pacific DMCs to assist in addressing challenges they face. The proposed knowledge and support TA will serve as a facility to support Pacific DMCs in making informed and strategic decisions on urban investments by supporting necessary activities such as capacity development, training, knowledge sharing and dissemination, technical advice, peer reviews etc.The proposed TA will support the Pacific Approach 2016-2020 strategic priority of enabling value creation by promoting livable and economically vibrant urban areas , supporting projects that will help governments with long-term urban planning to ensure that services can be sustained, and encourage private sector and civil society organization (CSO) involvement in the provision of urban infrastructure and services. The proposed TA will also support the Pacific Approach to provide (i) stronger, better, faster project delivery through expanded use of regional approaches and faster delivery mechanisms, and (ii) improved generation and sharing of knowledge.",14022,True,False,False,False,False,False,True,False,"The text describes a technical assistance facility aimed at helping Pacific island countries plan and manage urban investments effectively, with a focus on addressing challenges related to cost-benefit analysis, investment planning, economic viability, capacity building, institutional support, and policy development. The goal is to create livable and economically vibrant urban areas by enhancing project delivery and knowledge sharing in the context of sanitation and large systems.","The text explicitly discusses urban development activities through technical assistance for analyzing, planning, designing, prioritizing, assessing viability, addressing safeguards, and identifying measures to strengthen implementation capacity. The focus on 'urban investment' and efforts to make cities livable and economically vibrant directly aligns with the definition of 'Urban.' Additionally, the mention of large systems in sanitation supports the classification within 'Housing' due to its connection to urban infrastructure improvements. There is no explicit reference to rural settings, homelessness, transitional housing, incremental housing, social housing models, or market-specific activities that would justify those classifications.",True,False,False,False,False,False,True,False
