text,PurposeCode,Housing in general,Homelessness,Transitional housing,Incremental housing,Social housing,Market housing,Urban,Rural
"GOOD SHEPHERD SISTERS SUPPORTING THE IMMEDIATE SHELT AFFECTED BY TYPHOON GONI IN C ATANDUANES ISLAND, PHILIPPINES The Supporting the immediate shelter needs of families affected by typhoon Goni in Catanduanes Island, Philippines project aims to provide material relief assistance and services to those affected affected by emergency situations.",72010,1,0,1,0,0,0,0,1
"BUREAU OF INTERNATIONAL NARCOTICS AND LAW ENFORCEMENT AFFAIRS - FY22 INL WATER U.S. Department of State: Bureau of International Narcotics and Law Enforcement Affairs. FY22 INL Water[Covers costs of purchased utilities, i.e., purchase of water, gas, electricity (light and power), sewage, garbage and trash disposal, and metered hot water heating.]",91010,0,0,0,0,0,0,0,0
"HISTORIC CENTER REVITALIZATION PROGRAM FOR THE MUNICÍPIO OF SÃO LUÍS The Program will finance activities and projects of the  Municipality of São Luis' Historic Center Revitalization Program . The Program is structured in three components: a) Strategic Projects, b) Housing Improvement and c) Institutional strengthening.",15112,1,0,0,0,0,0,1,0
"HUMANITARIAN ASSISTANCE SHELTER EMERGENCY RELIEF Shelter relief for 19,000 of typhoon Hagupit particularly affected families on the island of Samar",72010,1,0,1,0,0,0,0,0
"This Program seeks to strengthen the capacity of people living with HIV AIDS (PLWHA) in Belize, Costa Rica, El Salvador, Guatemala, Honduras, Nicaragua and Panama through a social-community approach. One of the main objectives of the Program is to continue the development of risk profiles of PLWHA to determine their current situation in the region. The Program will involve monitoring the social impact of the national integrated approaches to HIV and AIDS. This will complement, from the community viewpoint, the objectives of the national government strategies to HIV and AIDS. The goal of this Program is to expand and consolidate the development and strengthening of technical and professional skills of PLWHA in Central America, to effectively participate in political advocacy, social monitoring and citizen inspection process in HIV and AIDS and influence the human development and quality of life of their peers in Central America. This is a consolidation of Round 10 and Round 7 HIV grants.",13040,0,0,0,0,0,0,0,0
DECENT WORK TEAM/COUNTRY OFFICE-PORT OF SPAIN Constituents have taken initiatives in policy areas that facilitate the transition from informality to formality,16020,0,0,0,0,0,0,0,0
"COLLABORATION AGREEMENT BETWEEN THE CITY COUNCIL OF GIJON AND THE SAHRAWI PEOPLE ASSOCIATION OF ASTURIAS FOR THE DEVELOPMENT OF PROGRAMS. Título completo del proyecto: Convenio de colaboración entre Ayuntamiento de Gijon y la Asociación Asturiana con el Pueblo Saharaui para el desarrollo de programas destinados a paliar las necesidades más acuciantes de la población refugiada y otros proyectos de cooperación con vigencia para el año 2016 :: Organización y desarrollo de actividades dirigidas a incrementar la cobertura de las necesidades básicas de la población saharaui y por ello contribuir a la mejora de sus condiciones de vida en un contexto de crisis humanitaria persistente en el tiempo. Incluye ayuda alimentaria, apoyo al sistema de salud saharaui, vacaciones en paz, atención alimentaria a personas mayores del Aiun, apoyo a vivienda de acogida de refugiados saharauis. .",72010,1,0,1,0,0,0,1,0
"ASSSTANCE TO DISPLACED SYRIAN FAMILIES IN AMMAN Shelter, health and psycho-social assistance to vulnerable refugees",72010,0,1,1,0,0,0,1,0
"THEORETICAL AND METHODOLOGICAL TRAINING PREPARATION APPLICATION AND VALIDATION OF EDUCATION MATERIAL IN THE BILINGUAL EDUCATION PROGRAM OF MOZAMBIQUE Este proyecto es la consolidación de un convenio de cooperación entre la Universidad Eduardo Mondlane y la Universidad de Vigo, para el desarrollo de proyectos, acciones y propuestas relacionadas con la Lingüística Aplicada, nombradamente en el ámbito de la educación bilingüe.Su objetivo principal es contribuir a avanzar cara un modelo de educación bilingüe basado en las lenguas indígenas mozambicanas mediante el ,Programa de Educação Bilingue, (PEB), el cual debe superar las limitaciones del actual y reconocer la necesidad formativa del profesorado como formador de futuros profesionales que desarrollarán su trabajo en el programa vigente o futuro de la educación bilingüe en Mozambique.Para este proyecto parte de una propuesta de investigación-acción participativa sustentada en la estrecha colaboración con profesorado de la Universidad Eduardo Mondlane, la más antigua y prestigiada de Mozambique. En concreto, con este proyecto se pretende contribuir a superar algunas de las principales problemáticas que están limitando la efectividad de la educación bilingüe en Mozambique: producción de materiales de enseñanza y aprendizaje, formación sociolingüística del profesorado, desarrollo de metalenguaje y de terminologías científico-técnicas en las lenguas bantú.El aproximación a este objetivo se materializa con el trabajo con 5 escuelas integradas en el PEB, cada una con una lengua mozambicana diferente, con el propósito de convertirlas en escuelas piloto de un proyecto más ambicioso consistente en extender en los próximos años esta metodología a todas las lenguas mozambicanas.",11110,0,0,0,0,0,0,0,0
"COOPERATION BETWEEN LOCAL AND REGIONAL GOVERNMENTS  AND THEIR ASSOCIATIONS OF LATVIA AND BELARUS Activities include exchange visits to share experience in the areas of education, territorial development, river instrastructure, facilitate cooperation in development of culture, tourism development, entrepreneurship, as well as small scale project (e.g. summer camp for kids).",15112,0,0,0,0,0,0,0,0
"ASSOCIAÇÃO HABITAT PARA A HUMANIDADE Programme: Brazil. Description: To strengthen the land rights and socio-environmental rights of low-income families living in urban areas in the north and northeast of Brazil. Habitat for Humanity Brazil is a national civil society organisation which, since 1992, has been working to fight inequalities by encouraging public policies for the right to the city. It seeks to increase access to housing, water, and sanitation in partnership with various sectors and affected communities.",15160,1,0,0,0,0,0,1,0
"DISPERSAL: A KEY TO REFILING SOUTHEAST ASIA S LARGEST TIGER LANDSCAPE THE PURPOSE OF THIS PROJECT IS TO (1) UNDERSTAND TIGER DISPERSAL POTENTIAL IN THE WESTERN FOREST COMPLEX (WEFCOM) USING A LANDSCAPE MODEL DEVELOPED TO INTEGRATE DISPERSAL MOVEMENTS, PREDICT TIGER AND PREY OCCUPANCY AND IDENTIFY AREAS FOR MANAGEMENT (2) CREATE A TIGER DATA DATABASE AT KHAO NANG RAM RESEARCH STATION FOR THE PERIOD 2007 TO PRESENT TO ESTABLISH A COMMON IDENTIFICATION SYSTEM LINKING COLLARED TIGER IDS FROM MULTIPLE PROJECTS AND INCORPORATE INTO AN EXISTING WEFCOM SPATIAL DATABASE COMPOSED OF THE PROBABILITY OF HABITAT OCCUPANCY BY TIGERS AND THEIR PRIMARY PREY (3) DEVELOP AND CONDUCT CONSERVATION EDUCATION WORKSHOPS AT NINE KEY KAREN VILLAGES IN THUNG YAI EAST AND WEST TO BUILD A PROGRAM TO INCREASE COMMUNITY CONSERVATION AND REDUCE SUBSISTENCE HUNTING AND (4) DEVELOP AND CONDUCT TWO WORKSHOPS WITH PROTECTED AREA CHIEFS, REGIONAL DNP RESEARCH STAFF, LOCAL AND INTERNATIONAL NGOS TO CREATE A STRATEGIC PLAN TO EXPAND THE DISTRIBUTION OF TIGER BREEDING HABITAT TO THE 63 OF WEFCOM WHERE TIGERS ARE NOT CURRENTLY BREEDING.",41030,0,0,0,0,0,0,0,0
"LOW ENERGY HOUSING IN SICHUAN AND SHENZHEN, CHINA    ENABLE AND ENFORCE ENERGY EFFICIENT BUILDING CONSTRUCTION It is to increase the sustainable use of resources in the building sector, improving the quality of life in the target area and creating a public-private partnership on sustainable building development",41010,1,0,0,0,0,0,1,0
"BBE AMB BOLIVIA ML The BAE (Bilateral Associate Expert) program was initiated by Sida in 1985, as a complement to the multilateral/UN program, JPO (Junior Professional Officer). The objective of the BAE program is to provide technical assistance to and strengthen capacity of the receiving organization through a young expert. A BAE is a young professional below the age of 33, who holds a university degree and has at least two years of relevant, paid, work experience. In the recruitment process, Sida and the receiving organization look for young professionals with knowledge and skills relevant for the organization, as well as the potential and willingness to learn and grow during the assignment. BAE:s are mainly placed within a cooperating partner organization in the global south, be it local/international NGO:s, public agencies, ministries, etc. working with international development, such as International Planned Parenthood Foundation, Saferworld, Slum Dwellers International, Western Indian Ocean Marine Science Association, Agence de l'Environnement et du Développement Durable in Mali, etc. The receiving organization drafts the ToR and is highly involved in the recruitment process, in order to ensure local ownership. Before deployment, all BAE:s undergo a one week onboarding in Sweden, to prepare for their missions. The BAE contract is for maximum three years and before starting the third year, a BAE may relocate to an Embassy working with international development.",33110,0,0,0,0,0,0,0,0
"OFFICE OF THE SECRETARY - FY22 GSA RENT AND SECURITY U.S. Department of State: Office of the Secretary. Establish for FY22 rent & security bill[Covers the costs of rents or leases of real property with or without option to purchase, including land, structures, and improvements, as well as fixed equipment and furnishings when included in the price. Also includes landlord charges for services such as porterage and separate maintenance costs.]",13040,0,0,0,0,0,1,0,0
"3_730_41143_3.3.1 3.3 HEALTHY SETTINGS AND HEALTH-IN-ALL POLICIES PROMOTED 3_730_41143_3.3.1 Countries enabled to adopt, review and revise laws, regulations and policies to create an enabling environment for healthy cities and villages, housing, schools and workplaces",12110,1,0,0,0,0,0,1,1
"UNITED CITIES AND LOCAL GOVERNMENTS, UCLG United Cities Local Governments (UCLG) has applied to Sida for SEK 40 million in support for implementation of the initiative, Local4Action Hub, during the period 2019-2022. The initiative is an integral part of UCLG  s Strategic Plan 2016-2022.  UCLG is a global membership-based organization for municipalities, regional authorities and cities and gathers actors in over 120 countries in all of the world's regions. UCLG supports partnerships and collaborations between members and engages in extensive advocacy in international contexts. A guiding principle for UCLG  s work is that decentralization and strengthening of local capacity are of central importance for sustainable development. The long-term priorities are defined in UCLG's Strategic Priorities 2016-2022, which particularly emphasizes the importance of local ownership and that the contributions of municipalities and cities towards the realization of Agenda 2030 need to be adapted to local conditions and needs. UCLG has established partnerships with several multilateral and bilateral actors, including the EU, which is the largest donor on the basis of a multi-year strategic partnership.  As an integral facet of UCLG  s strategy, Local4Action Hub is a facility to support and catalyse action-oriented implementation in line with the strategy  s overal goal to strengthening the role of cities and municipalities in influencing, implementing and monitoring the global development agendas. The cooperation with Sida is designed as a program support for this facility and thereby aims to scale up prioritized activities related to advocacy, policy, knowledge management and various operations (incl. decentralised cooperation and municipal peer-exchange) aimed at strengthening members' capacity to implement Agenda 2030 at local level. The initiative intends to build the capacity of local governments to address poverty, exclusion and gender inequality. The work plan draws to a large extent on the needs and priorities identified by UCLG  s members, with specific focus on SDG 11 but with bearing on the SDG-agenda at large. Themes and areas that may be addressed within specific activities include, for instance, climate adaptation, housing and basic services delivery, resilience and DRR, integrated urban planning, local economic development, migration, women  s representation in policy- and decision-making processes, etc. UCLG's World Secretariat based in Barcelona will lead the implementation of theinitiative, whereas the geographical sections (i.e., UCLG-Asia Pacific, UCLG Africa) will be involved in key activities through sub-granting arrangements.",15112,1,0,0,0,0,0,1,0
"THE PROJECT FOR THE CONSTRUCTION OF A GIRLS' DORMITORY AT ST. BENEDICT SECONDARY SCHOOL IN AMURIA DISTRICT St. Benedict Secondary School will construct a girls' dormitory, a latrine block and a bath shelter, and install a solar pv system and double decker beds.",11120,1,0,0,0,0,0,0,0
"PROGRAMME DE DÉVELOPPEMENT LOCAL DU TERROIR DE DIAPANGOU-PHASE II Background:  L'intervention d'Iles de Paix dans le terroir de Diapangou a été soutenue financièrement par le Fonds belge de survie entre 2004 et 2009. Elle s'est ensuite poursuivie jusqu'en 2011 sur fonds propres de l'association.  L'intervention a porté sur:  - le développement des activités agropastorales avec l'aménagement de périmètres maraîchers et de bas -fonds pour la riziculture, la formation d'exploitants,…  - le développement des activités génératrices de revenus, telles que l'embouche, l'apiculture ou la production de lait, ainsi que la mise en place d'un dispositif de microcrédit destiné à soutenir les activités de quelques 450 femmes,  - l'amélioration de la bonne gouvernance locale.  Résultats de la phase 1 Bref aperçu des résultats atteints au terme de la phase 1  (la poursuite des dynamiques amorcées dans le cadre du programme cofinancé, c'est -à -dire au -delà de 2009 est également comprise):  - Mise en valeur du  bas -fond de Panpangou: Construction d'un barrage de 550m. La zone d'influence compte 9 villages et une population totale de 7 105 personnes.  - Riziculture pluviale au travers de l'aménagement simplifié de bas -fonds: En 2009 -2010, la disponibilité alimentaire de 990 personnes a été améliorée, en leur assurant 16 -17% de leurs besoins céréaliers.  - Activités génératrices de revenus et fonds de micro -crédit rotatif (FMCR): 2 FMCR mis en place. 447 femmes participent au dispositif. Près de 3 400 crédits ont été octroyés. Les revenus sont dans la majorité des cas affectés au financement de première nécessité ou des services de base.  - Scolarisation primaire: construction de 18 salles de classe, de 11 logements pour enseignants et dotation en équipement de 16 écoles. Le taux brut de scolarisation dans la commune de Diapangou a connu une progression entre 2004 et 2010 (passage de 34% à 52%).  - Scolarisation secondaire: Le taux brut de scolarisation dans la commune a connu une progression entre 2004 et fin 2009 (passage de 10 % à 18 %). Il reste néanmois particulièrement faible, avec moins d'un enfant sur cinq qui fréquente l'enseignement secondaire (contre un enfant sur quatre au niveau national)  Évaluations Le programme a fait l'objet de deux évaluations externes commanditées par le FBSA:  - l'évaluation externe réalisée en 2008 par South Research s'est intéressé à l'ensemble des programmes d'Iles de Paix au Burkina Faso et Nord -Bénin cofinancés par le FBS,  - l'évaluation externe réalisée en décembre 2011 par COTA s'est intéressée spécifiquement à l'intervention menée à Diapangou. Elle a dressé le bilan de la 1ère phase et des actions qui se sont poursuivies jusqu'à aujourd'hui sur fonds propres d'Iles de Paix et a envisagé l'intérêt d'une phase de consolidation du programme.  L'évaluation menée par COTA asbl en décembre 2011 (annexe 7) conclut qu'une phase de consolidation des acquis du projet est pertinente et a formulé une série de recommandation pour la phase de consolidation. Un tableau présentant synthétiquem",43040,0,0,0,0,0,0,0,1
BUREAU OF INTERNATIONAL NARCOTICS AND LAW ENFORCEMENT AFFAIRS - SHELTERS WITH ADEQUATE FUNCTIONING SAFE BELIZE U.S. Department of State: Bureau of International Narcotics and Law Enforcement Affairs. To develop SOPs that will strengthen the institutional capacity of existing shelters to support and care for trafficking victims.,15130,0,1,0,0,0,0,0,0
"STRENGTHENING THE CAPACITY OF AUDITORS IN CUBA/RENFORCER LA CAPACITÉ DES VÉRIFICATEURS À CUBA This project aims to strengthen public accountability in Cuba by helping to build efficient, transparent public financial management systems at a time when Cuba is decentralising and introducing economic reforms. The initiative will draw on best Canadian and international practice to train auditors across Cuba to international standards, enabling their contribution to increased institutional accountability and reduced risk arising from corruption./Ce projet vise à renforcer l'obligation de rendre des comptes au public à Cuba en améliorant la capacité du gouvernement cubain à établir une gouvernance financière et économique transparente. L'ACDI contribue à un projet mis en œuvre par Cowater International, en mettant en place des approches et des techniques de vérification modernes fondées sur des modèles canadiens et internationaux. Le projet appuiera la décentralisation de la fonction de vérification dans l'ensemble de Cuba pour en accroître l'efficacité. Dans le cadre du projet, on cherche à former un nouveau groupe de vérificateurs conformément aux normes internationales pour permettre à celui-ci de contribuer de manière importante au renforcement de la responsabilisation institutionnelle au pays. Une plus grande reddition de comptes financiers au public est essentielle pour réduire le risque de fraude et de corruption pendant la réforme économique de Cuba, qui fera passer le pays d'un contrôle centralisé à une plus grande libéralisation. Parmi les principales activités du projet : i) fournir une formation pratique et théorique (cours, ateliers et conférences) à des vérificateurs du Système de vérification national en matière de méthodes de vérification et de pratiques de supervision et de contrôle, ii) fournir une formation et une assistance technique au Bureau du contrôleur général de Cuba et à ses vérificateurs pour les accréditer selon les normes internationales.",15110,0,0,0,0,0,0,0,0
"SAFEGUARDING HOUSING, LAND AND PROPERTY RIGHTS OF SYRIAN REFUGEES AND INTERNALLY DISPLACED PERSONS IN SYRIA II Information, advisory structures and procedures for safeguarding Housing, Land and Property claims of Syrian refugees and internally displaced persons have been improved.",15220,1,0,0,0,0,0,0,0
CONTRIBUTION TO REGIONAL HOUSING PROGRAMME (RHP) FUND The proposed action constitutes an additional EU funding allocation to the Fund of the Regional Housing Programme in order to achieve the results of the RHP to create durable housing solutions for the most v ulnerable population in the Western Balkans following the Balkan conflicts of the 90ies,73010,1,0,0,0,1,0,0,0
"WORLD BANK IDA CRISIS FACILITY - SUPPORT PROGRAMME FOR UKRAINE AND MOLDOVA (SPUR) International Development Association (IDA), member of World Bank Group, has established Crisis Facility designed to provide additional financing to support to IDA countries severely impacted by Russia's invasion of Ukraine. Finland's support through Crisis Facility is channeled to Special Program for Ukraine and Moldova Recovery (SPUR). SPUR is supporting Government of Ukraine to provide basic services, repairing critical infrastructure, implementing reforms and support long-term recovery and reconstruction in six critical sectors in the areas of health, transport, energy, agriculture, housing and social protection in Ukraine. SPUR complements efforts by multilateral and bilateral partners by addressing the continuing far-reaching social and economic impacts of this crisis. In Moldova the program is mainly supporting costs resulting from hosting refugees from Ukraine.",43010,1,0,0,0,0,0,0,0
"THIRD PARTY MONITORING OF MULTI YEAR HUMANITARIAN PROGRAMME INTERVENTIONS 2016/17 Support for up to three million of the most vulnerable people affected by natural disaster and conflict.  This will cover both immediate relief and early recovery interventions for shelter, food, non-food items, water and sanitation, livelihood and protection needs, depending on the emergency.   This programme will also support developments in the UN and local civil society which are required for humanitarian responses to be more locally owned and effective in future, as well as effective monitoring and evaluation, targeted active research and piloting.",43082,1,0,1,0,0,0,0,0
AUDIT FINANCIER ET DE SYSTÈME DU CONTRAT N° CRIS ENPI/2015/362-355 RENFORCER LA PARTICIPATION POUR LE DÉVELOPPEMENT DANS LE QUARTIER DE SIDI AMOR ABA,15150,0,0,0,0,0,0,0,0
Use of traditional knowledge for land resource management in protected areas of Vale do Javari,41030,0,0,0,0,0,0,0,0
"HOGAR EL FARO Support for the shelter-home for single mothers, pregnant women and / or victims of violence. The insituttion offers healthcare and psychological assistance and vocational training services.",15180,1,0,1,0,0,0,0,0
"OSCE SECURITY DAYS 2016-17 Make a significant contribution to complement and support formal discussions among participating States on how to restore co-operative security in the OSCE area by establishing an informal strategic dialogue process through sustained and  well-focused discussions involving representatives of Track II actors from academia, think tanks, civil society, youth, business, philanthropy and international, regional and sub-regional organizations. This is expected to result in concrete  recommendations for the OSCE.",15220,0,0,0,0,0,0,0,0
CORE SUPPORT FOR HFA The IKEA Foundation is partnering with Housing for All who provide management to Better Shelter to build the market demand for its housing solution and optimise the organisation for growth and sustainability.,72010,1,0,0,0,0,1,0,0
"ADES, MADAGASCAR La mort silencieuse était un rapport dans le bulletin de l'ADES en 2021. Depuis 3 ans, la sécheresse dure à Madagascar et menace l'existence de centaines de milliers de personnes. Les habitants sont habitués à des périodes de privation. La perte de forêts transforme en peu de temps les terres fertiles en un désert aride, les villages sont abandonnés et la disparition du tourisme entraîne la perte de précieux revenus pour les habitants. ADES tente de lutter à moyen et long terme contre la faim dans la région sud du pays. Par le biais des communautés villageoises, des stratégies sont élaborées pour les puits villageois, les cultures maraîchères et d'autres projets importants afin de maintenir la fertilité des terres et de produire plus de nourriture. Cette organisation est présente à Madagascar depuis 2001. La commune de Berikon a déjà soutenu ADES en 2015.",14031,0,0,0,0,0,0,0,1
"STREET CHILD Summary: This project targets some of Liberias most marginalised children. It supports those who are working on the streets and living in some of the most dangerous environments in the world in terms of health, safety and lack of safe shelter and education. Social workers engage with these children and offer them counselling and support to enable them to leave the streets and return home or live safely with other family members this is be done through a process of mediation. Once they have returned to live with their families, the project helps their families with small business schemes to help increase their income so that they can support their children to stay in school and away from the hazards of street living. Full grant commitment: GBP 49.96 thousand.",11220,0,1,0,0,0,0,0,0
SCHOLARSHIP FOR COSTS OF LIVING University covers costs of living (housing and meals) for a student enrolled at the course in Medicine and Surgery (single-cycle master degree),11420,1,0,0,0,0,0,0,0
"CRÉATION DE COMMUNAUTÉS CONSCIENTES DU CLIMAT POUR AMÉLIORER LE DÉVELOPPEMENT DES ENFANTS Renforcer l'atténuation et l'adaptation au changement climatique dans les communautés du projet pour améliorer le développement des enfants grâce à l'agriculture intelligente face au climat, réduction des risques de catastrophes environnementales, gestion des ressources en eau et reboisement.",41081,0,0,0,0,0,0,0,0
TO SUPPORT WORK ON FORMALIZATION IN JAMAICA Constituents have taken initiatives in policy areas that facilitate the transition from informality to formality - Outcome 6 - Formalization of the informal economy,16080,0,0,0,0,0,0,0,0
"TOUNEN LAKAY III L'Action proposée se compose donc de 3 axes complémentaires et intégrés : (i) la planification et la gestion d actions de développement urbain selon un processus co-piloté par les communautés , (ii) la réalisation de travaux d'amélioration de l'habitat (renforcement/ reconstruction de maisons-latrines) et du cadre de vie (aménagements infrastructurels visant à accroître l'accès aux services de base, sécuriser l'environnement face aux risques et désastres et contribuer à la dynamisation sociale e",43030,1,0,0,1,0,0,1,0
