text,PurposeCode,Housing in general,Homelessness,Transitional housing,Incremental housing,Social housing,Market housing,Urban,Rural
"SOLAR PHOTOVOLTAIC AND BATTERY STORAGE PILOT, THROUGH ESS TEC, INC. This feasibility study and pilot project will assist Total GD, in partnership with U.S. battery energy storage manufacturer ESS, Inc. (Wilsonville, OR), in assessing the financial, economic, technical , and regulatory feasibility of implementing a solar photovoltaic energy generation and long-duration energy storage system in the Brazilian state of GoiÃ¡s, The project will support the addition of over 20 megawatts of new energy generation for Brazil, and the project will offer commercial opportunities for wide range of U.S. equipment and services related to energy generation and storage.",23230,0,0,0,0,0,0,0,0
SOLAR POWERED SCHOOL Installation of solar panels and renovation of toilets,23210,0,0,0,0,0,0,0,0
"HOUSING FOR PERSONS WITH APPROVED INTERNATIONAL PROTECTION Providing accommodation for persons with approved international protection.During 2020, the right to finance accommodation was exercised by a total of 312 persons with approved international protection.In 40 state-owned apartments 120 people were placed and for whom utilities were paid. The remaining 192 persons with approved international protection were accommodated in 104 housing units on the basis of a lease agreement with third parties for which the Central State Office covered the costs of rent, utilities and current investment maintenance services.",93010,1,0,1,0,0,0,0,0
CONSTRUCTION OF DORMITORIES FOR A VOCATIONAL SCHOOL IN CHINDERI/DIOCESE OF JASIKAN Bau von Unterkünften in einer Berufsschule in Chinderi/Diözese Jasikan,11330,1,0,0,0,0,0,1,0
"PROMOTION OF THE RESOURCE GENERATION AND ENTREPRENEURSHIP CAPACITY OF 4 PRODUCER ASSOCIATIONS IN THE RURAL MUNICIPALITY OF SAFO Fomentada la capacidad de generación de recursos y emprendimiento de 4 asociaciones de productoras en la Comuna rural de Safo (Madarounfa, Maradi, Níger).La intervención tendrá como población destinataria a 190 mujeres agrupadas en 4 asociaciones de mujeres legalmente constituidas y que forman parte del Programa de Empoderamiento y Seguridad Alimentaria que el Socio Local e Infancia sin Fronteras implementan desde hace más de una década en la Región de Maradi en Níger. Creará un proceso de transferencia de capacidades que habilite a las asociaciones de productoras a emprender diferentes unidades de negocio con las que consolidar su rol en las economías domésticas y comunitarias, lo que redundará en su propio beneficio y en el de los niños y niñas de las aldeas.",43040,0,0,0,0,0,0,0,1
"FRONTIERS OF ENGINEERING FOR DEVELOPMENT The quality of water for swimming, during Rio Olympic 2016, was discussed several times. Although, for the period of the Olympic, these issues were temporarily resolved but they alarmed Brazilian urban and water managers and planners about their severe water contamination challenges. São Carlos is located on the geographic center of the São Paulo state in Brazil. The city has an active industrial profile with important national and international industries and certain agricultural importance. Due to its increasing number of high technology industries, the city has been proclaimed The National Capital of Technology by Brazilian President in 2011. However, these fast growing urban development, industrialisation and agriculture have caused severe water and environmental contamination in the whole city. On the other hand, lack of efficient and appropriate wastewater treatment system have exacerbated the contamination challenges. These contaminations have put a great risk to the health and wellbeing of the people and aquatic ecosystems. Promotion of resilience to water quality stresses and crises is a necessity in Sao Carlos. This resilience promotion requires development and enhancement of the knowledge and capacities to manage the emerging challenges and risks. Currently, a detailed and integrated map of active and potential contaminators across the city, is lacking.  The long-term vision of this research is to contribute to resilience promotion in Sao Carlos by developing a dynamic information platform for water quality monitoring and assessment. The current research aims to initiate this long-term plan by developing an integrated GIS map of the contaminators and contaminated areas in Sao Carlos. These maps could be used for water quality spatial and temporal analysis. Also, they will enable the local and national decision makers to proactively respond to water contamination across the region. Furthermore, these maps could be used for integrated urban wastewater system asset management plans.",43082,0,0,0,0,0,0,1,0
Waste Disposal Medjerdatal,14050,0,0,0,0,0,0,0,0
"TECHNICAL ASSISTANCE FOR REVENUE ADMINISTRATION AND REVENUE POLICY -CAMBODIA Project with Cambodias General Directorate of Tax (GDT) helped  draft regulations for oil and gas import production and develop tools and skills to audit oil and gas enterprises, in 2009 and 2010. Subsequent years have included collaboration in developing manuals and procedures to effectively audit financial institutions, construction industry, and telecommunications sector, collecting tax arrears and HR reform. The project supported the implementation of a systematic taxpayer education system to enhance the GDTs capacity to serve taxpayers and to educate the public in complying with tax law. Advisors providing guidance on arrears collection to reduce arrears balances and stem their growth. Advisors are helping to streamline the organizational structure and its management and improve the HR process to assure adequate and competent staffing.  The 2016 work plan continues assistance in the following areas: 1) internal audit, to establish the necessary checks and balances to prevent waste, fraud, and abuse, 2) tax arrears, supporting implementation of standardized procedures to resolve accounts and improve the GDTs ability to collect tax arrears due, 3) human resources, to include implementation of a merit-based personnel management system and support for the strategic and operational goals outlined in the governments Revenue Mobilization Strategy, and 4) specialized industry audit, to improve tax compliance and conduct quality audits in the telecommunications and transportation sectors.",15114,0,0,0,0,0,0,0,0
IRAQ - OA9: HOUSING Outcome area 9: Sustainable housing and settlements,72010,1,0,0,0,0,0,0,0
Set up of a model brickyard to promote production of the environment friendly adobe bricks and foster sustainable construction techniques,41081,1,0,0,0,0,0,0,0
"HUMANITARIAN PROJECT FOR THE RECEPTION OF UKRAINIAN MINORS. Título completo del proyecto: PROYECTO HUMANITARIO DE ACOGIDA DE MENORES UCRANIANOS. :: Siguiendo las recomendaciones y directrices de la OMS y la Sociedad Bielorrusa de Pediatría, el Programa de Saneamiento para niños bielorrusos consiste en apartar a los menores, de manera temporal, del ambiente contaminado por radiactividad en el que habitualmente habitan.",93010,1,0,1,0,0,0,0,0
"DEMAND-SIDE SERVIR TASK ORDER - CLEAN PRODUCTIVE ENVIRONMENT E3/GCC will provide $2,000,000 to build on achievements of the first phase of 'SERVIR Demand'. This first phase focused on increasing the technical capacity of hub institutions that partner with USAID and the National Aeronautics and Space Administration (NASA) on the SERVIR program to develop decision-support tools using satellite data that met user needs. A second phase will reach additional SERVIR users, generate effective communications, evaluate SERVIR tools and products and manage small grants across the SERVIR network of hubs. Because this mechanism is in procurement development, the following key information has not yet been determined: Mechanism No. (Award #). Prime Partner, Start and End dates, Total estimated cost. (Direct GCC-Adaptation- $1,000,000, Direct GCC-Sustainable Landscapes- $1,000,000)",41020,0,0,0,0,0,0,0,0
"BUREAU OF INTERNATIONAL NARCOTICS AND LAW ENFORCEMENT AFFAIRS - FURNITURE INL U.S. Department of State: Bureau of International Narcotics and Law Enforcement Affairs. Furniture INL[Covers household items, including ranges, refrigerators, washers, dryers, ironers, freezers, window- type air- conditioners for residential properties, transformers and voltage regulators for appliances, as well as living room, dining room, and bedroom suites, rugs, draperies, lamps, and fabric for furniture reupholstering. Special Purpose Equipment [Covers the costs of special purpose equipment.]",16063,0,0,0,0,0,0,0,0
"SUPPORTING PARTNERS CONTRIBUTION TO IPCC SPECIAL REPORT ON IMPACTS OF 1.5 DEGREE CELSIUS WARMING In its Paris Agreement, the 21st Conference of Parties (COP 21) to the United Nations Framework Convention on Climate Change (UNFCCC) invited the Intergovernmental Panel on Climate Change (IPCC) to provide a special report in 2018 on the impacts of global warming of 1.5 C above pre-industrial levels and related global greenhouse gas emission pathways. The report will help UNFCC take stock of collective efforts towards holding the increase in the global average temperature to well below 2 C above pre-industrial levels and to pursue efforts to limit the temperature increase to 1.5 C.There is a significant research gap on the nature, benefits and feasibility of a 1.5 C warmer world, and the existing literature does not take a strongly regional or hot-spot approach. However, the Collaborative Adaptation Research Initiative in Africa and Asia's work has the potential to provide strong regional inputs to the 2018 Special Report. CARIAA consortia agreed on a three-phase strategy aimed at producing high-quality, demand-driven peer-reviewed journal articles for consideration by the IPCC special report authors. The resulting project is partially funded though the Opportunities and Synergies Fund, which is a competitive process promoting cross-consortia collaboration within the CARIAA program. A collaboration between the University of Southampton, University of Cape Town, the International Centre for Integrated Mountain Development, and the Overseas Development Institute, this project will support the analyses and associated scientific activities aimed at examining consortia results across climate science, biophysical and economic impacts, vulnerability, and policy in light of 1.5 C concerns. Activities include the presentation of research findings at preparatory conferences, participation at a 1.5 C side event at COP22 organized by IDRC and a UNFCCC Party, production of a range of products, including at least 3 peer-reviewed articles on the impacts and implications of 1.5 C versus 2 C warming in each hotspot, a synthesis publication (peer-reviewed for journals or popular magazines) drawing together evidence from hotspots, and policy briefs on 1.5 C for national and regional negotiating groups.The Collaborative Adaptation Research Initiative in Africa and Asia (CARIAA) aims to help build the resilience of poor people to climate change by supporting a network of consortia to conduct high-calibre research and policy engagement in hot spots in Africa and Asia. It is jointly funded by the UK's Department for International Development and IDRC.",41010,0,0,0,0,0,0,0,0
"The Sanitation Upgrade Programme (SUP) will assess the compliance status of residential wastewater treatement systems across Rarotonga and Aitutaki, and upgrade up to 1,000 septic tanks across Rarotonga (800) and Aitutaki (200) where non-compliance is confirmed.",14050,1,0,0,1,0,0,1,0
"NATIONAL ACADEMY OF SCIENCES Programme: Special Opportunities for Children, Conservation, and Population. Description: Programme: Special Opportunities for Children, Conservation, and Population. Description: for the placement and resettlement of displaced scientists",93010,0,0,0,0,0,0,0,0
"THE PROJECT FOR THE CONSTRUCTION OF A GIRLS' DORMITORY AT KAHINJU SENIOR SECONDARY SCHOOL IN KABAROLE DISTRICT Kahinju Senior Secondary School will construct a girls' dormitory and 2 latrine and washroom blocks, and install a solar PV system, fences and double decker beds.",11320,1,0,0,0,0,0,0,0
"Civil Society Programme Funding: Marginalised women and men realise their human rig hts by having more equitable a ccess to land, housing, basic services and secure livelihood s, benefit from progressive ta xes and fiscal policies and ac tively participate as citizens  and influence decisions that affect their lives.",15150,1,0,0,0,0,0,0,0
"P185 - Subvention AEFE - Tanzanie - Ecole française Arthur-Rimbaud - secondaire - Scolarisation d'écoliers du pays récipiendaire dans des écoles françaises. Le montant déclaré en APD est calculé sur la base du total des subventions octroyées à l'établissement scolaire, au prorata du pourcentage d'écoliers du pays récipiendaire sur le nombre total d'écoliers de toutes nationalités, et en tenant compte de la différence des frais de scolarisation entre écoliers français et ceux du pays récipiendaire.",11220,0,0,0,0,0,0,0,0
C2D - REFINANCEMENT C2D ECHEANCE DU 30/04/2017 4eme C2D Mauritanie Part Banque de France,99810,0,0,0,0,0,0,0,0
"REFUGEES CAMP MANAGEMENT AND GUARDING AGREEMENT THE PROJECT OF (300) HOUSING UNITS, A SCHOOL IN THE REFUGEE CAMP IN OBOCK, DJIBOUTI Establishing mechanisms by the ONARS 'Office National d'Assistance aux Réfugiés et Sinistrés' to house Yemeni refugees in the refugee camp in Obock, Djibouti, operating a school in cooperation with Djiboutian government agencies, providing water for Yemeni refugees, and protecting and managing camp facilities and its residents.",72010,1,1,1,0,0,0,0,0
"CONNECTING CONSERVATION: WILDLIFE CORRIDORS & CORE AREAS IN THE SANGHA TRI-NATIONAL LANDSCAPE AND NORTHERN CONGO: NOUABALE NDOKI NATIONAL PARK AND PERIPHERY CONNECTING CONSERVATION: WILDLIFE CORRIDORS & CORE AREAS IN THE SANGHA TRI-NATIONAL LANDSCAPE AND NORTHERN CONGO: NOUABALE NDOKI NATIONAL PARK AND PER Funds under this award are to be used to maintain wildlife corridors and core areas in the transboundary Sangha Trinational and Northern Congo region of the Republic of Congo, Cameroon and Central Africa Republic by supporting the management of five park complexes and by working with forestry companies and local communities on the park periphery to better secure forest resources from illegal wildlife trafficking. This project will contribute to the conservation of USFWS trust resources and federally protected species, including the world's largest population of western lowland gorillas and the largest, connected population of forest elephants. Objectives include stabilization of poaching pressures, reliable information on the distribution and status of wildlife, and coordination of conservation activities across six sites in three countries, including targeted joint activities to improve workforce capacity and safeguard local and legal use of wildlife.",41030,0,0,0,0,0,0,0,1
"AERMC - MOBILISATION DES EAUX SOUTERRAINES POUR L'ADDUCTION EN EAU POTABLE DE ZAHLÉ AU LIBAN Ce projet vise à mener des études sur et mobiliser les eaux souterraines pour l'adduction en eau potable du territoire municipal de Zahlé au Liban. Il s'agit de la phase 3 du projet, lors de la phase 1 du projet il a été établi un diagnostique des nappes souterraines dont dépend l'approvisionnement en eau potable (AEP) de Zahlé et a été constitué une base de données recensant les acteurs clés de l'eau et les territoires de dépendance en terme d'AEP. En phase 2, un diagnostic des sols du territoire a été réalisé, ainsi qu'une étude de la vulnérabilité des nappes souteraines et l'identification d'actions phares à mener pour la protection de l'eau (en quantité et qualité) en vue de sécuriser l'eau potable. Depuis 2019 le Liban s'enfonce dans une crise politique et économique. Cet effondrement a été précipité par la pandémie de COVID et l'explosion survenue dans le port de Beyrouth.Les restrictions qui s'appliquent désormais à la population touchent peut à peu le domaine de l'eau avec la disparition des ressources financières des établissement des eaux.Les collectivités locales sont aujourd'hui les dernières structures publiques en capacité d'assurer une politique territoriale cohérente. Ce programme permet de soutenir l'action vers l'eau d'une des principales agglomération de la plaine de la Bekaa.Cette phase 3 se décline en 4 axes :- L'incitation à la pratique de services environnementaux dans l'agriculture en vue de protéger l'eau.- Une capitalisation et une valorisation de l'expérience de coopération entre la Municipalité de Zahlé et de l'Etablissement des Eaux de la Bekaa autour du Schéma Directeur de Zahlé Ville perméable- Une étude prospective des suites pratiques à mener à l'issue de ce projet.- Un volet formation EEDD vers les usagers.Le programme a pour principales activités :1. D'organiser la transition administrative : renouvèlement de la convention, communication sur la clôture de la phase 2 et sur les suites à données, maintien du lien avec les partenaires.2. De mener une enquête autour du nouveau schéma de développement pour l'AEP de Zahlé : CDR, MEE (Ministère de l'Énergie et de l'Eau), EEB (Établissement des Eaux Beyrouth Mont Liban), municipalité de Zahlé:a. identifier les modalités décisionnelles et les éléments techniques qui ont permis de décider la réalisation des différents forages. Mettre au jour les formes de concertation ou communication qui ont pu exister avec le territoire (municipalités, usagers, riverains expropriés, gestionnaire -EEB).b. Identifier l'état de ces décisions, leur caractère révocable ou non et les raisons pour lesquelles il serait possible de revenir dessus ou non, détailler selon les infrastructures/forages conseillés.c. Identifier l'avis des responsables et autres acteurs clés sur l'idée de réviser les besoins ou une partie d'entre eux en fonction des nouvelles donnes économiques et démographiques.i. Souligner les difficultés financières de l'EEB, des populationsii. Souligner l'importance des UFW + perte",14010,0,0,0,0,0,0,1,0
"Reconstruction and rehabilitation in rural villages, Nepal",73010,1,0,0,0,0,0,0,1
Climate-friendly Urban Mobility I,21010,0,0,0,0,0,0,0,0
"PROPIO PROGRAM INNOVACIÓN CURRICULAR INCORPORATION OF THE PERSPECTIVE OF GENDER THE EDUCATIONAL PROGRAM OF THE CAREER OF OBSTETRICS AND CHILDCARE Actualmente la Escuela de Obstetricia del la Universidad Austral de Chile se encuentra en proceso deInnovación curricular el que pretende incorporar la perspectiva de género en forma transversal en la mallacurricular y visibilizar la diversidad sexual, cognitiva y cultural, con la finalidad de consolidar las competenciasde las/los egresadas/os matronas y matrones de dicha Casa de Estudios.Para fortalecer y apoyar el trabajo ha realizar por la Escuela de Obstetricia de la Universidad Austral es quehemos presentado nuestro proyecto de práctica el que tiene como objetivo entregar una visión desde unaesfera multidisciplinar que permita entregar formación de calidad en salud sexual y salud reproductiva conenfoque de derechos y perspectiva de género en colaboración con la Escuela de obstetricia y puericultura dela Universidad Austral de Chile. Potenciando las capacidades en el equipo docente que permitan lasostenibilidad en el tiempo de las acciones de incorporar la perspectiva de género y de diversidades, y elenfoque de derechos en la salud sexual y reproductiva.",11420,0,0,0,0,0,0,0,0
Título completo del proyecto: TRANSPORTE Y MONTAJE DE ESTRUCTURAS DE ALOJAMIENTO PROGRESIVO EN ECUADOR ::,72010,1,0,0,1,0,0,0,0
"PROJET DE DRAINAGE PLUVIAL DE BRAZZAVILLE Amélioration du drainage des eaux de pluie et réduction des inondations. Le projet vise à limiter les inondations dans les zones d'habitat . réduire le nombre de zones insalubres, en particulier dans des quartiers précaires afin d'améliorer les conditions d'hygiène et de santé des populations . sensibiliser les populations aux bonnes pratiques d'hygiène en matière de gestion des déchets solides et promouvoir l'assainissement de leur cadre de vie.http://www.afd.fr/base-projets/consulterProjet.action?idProjet=CCG1104",14022,1,0,0,0,0,0,1,0
"TRAVAUX D AMÉNAGEMENT DES AXES TRANSFRONTALIERS ENTRE LE BURUNDI, LA RÉPUBLIQUE DÉMOCRATIQUE DU CONGO ET LE RWANDA. LOT II BURUNDI Il s agit de la réhabilitation de 15, 42 km de la route entre le Rond Point Chanic à Bujumbura et la frontière RDC  avec construction des caniveaux en maçonnerie de moellons et ou en dallettes préfabriquées en tranche ferme et de la construction de 2 batiments à usage d entrepôt et de bureau de douane en tranche conditionnelle.",21020,0,0,0,0,0,0,0,0
"HOUSING COORDINATION (HRRP) AND OTHER RECONSTRUCTION SUPPORT Establish partnerships with local & central government, communities and businesses to support the (i) districts effected by the Earthquake to build back better including leading to more resilient (including climate resilient) infrastructure and institutions, (ii) the most vulnerable recover their livelihoods and assets, and (iii) the Government of Nepal to plan for and manage the response to the earthquake.",73010,1,0,0,1,0,0,0,0
"RÉINSERTION SOCIALE ET PROFESSIONNELLE DES JEUNES MÈRES CÉLIBATAIRES Au Togo, le taux de pauvreté des ménages dirigés par une femme est de 57,5%. Les femmes n'ont pas accès au marché du travail, ce qui explique que de nombreuses jeunes mères célibataires cherchent à gagner leur vie dans le commerce du sexe. L'éducation en matière de rapports sexuels protégés est insuffisante et les femmes n'ont pas accès aux informations et aux conseils appropriés. Le projet vise à simplifier l'accès à l'éducation et à la formation professionnelle et à soutenir les familles dans l'amélioration durable de leurs conditions de vie. Pour ce faire, il est prévu de mettre en place un point de contact et de réaliser les travaux de rénovation nécessaires dans la garderie déjà existante. Ce projet profite à environ 54 jeunes mères issues de familles défavorisées ou qui doivent s'en sortir sans le soutien de leurs parents. 1 300 autres personnes bénéficient des mesures de sensibilisation de l'organisation.",15170,0,0,0,0,0,0,0,0
"SUPPORT HOUSING IN E.JERUSALEM Health and Housing Sectors, Al Quds University, State Institutions and Islamic Waqf",16050,1,0,0,0,0,0,1,0
"MOUNTAINOUS AREA DEVELOPMENT THORUGH NEW ECONOMIC ACTIVITIES Building recreational centre through building of accommodation facility, spa centre, children playground, conference hall and dining facility",31120,1,0,0,0,0,0,0,0
CONSTRUCTION OF A DIOCESAN SCHOOL COMPLEX FOR YOUNG PEOPLE IN TOLAGNARO The project involves the construction of a student dormitory in Tolagnaro. The facility will accommodate approximately 50 students per year.,11120,1,0,0,0,0,0,0,0
ACTIVITIES FOR IN-DONOR REFUGEES Refugees/asylum seekers  in donor countries (non-sector allocable),93010,0,0,0,0,0,0,0,0
"¿PLATAFORMA DE OSC PARA GESTÀO DELEGADA - OSC EM REDE PARA A GESTÃO INCLUSIVA E DELEGADA DE TURISMO VERDE E RESPONSÁVEL EM SÃO TOMÉ E PRÍNCIPE ¿ Ce projet contribuera à renforcer le rôle des OSC dans leur participation à la bonne la gouvernance, en assumant la gestion déléguée dans un réseau de tourisme écologique du Parc Naturel de l'Obô et de ses zones tampons. A cet effet, les OSC seront consolidées et professionnalisées en réseau sur la Plateforme Tourisme.  La formation et la structuration les OSC en réseau départemental et national, en affirmant le rôle des OSC dans la gestion déléguée du du tourisme vert dans le Parque Obô.",15150,0,0,0,0,0,0,0,0
"BDC KRAGUJEVAC- HOUSING SUPPORT TO FLOOD DAMAGED HOUSEHOLDS IN SVILAJNAC The project is aimed at improving housing condition of the most vulnerable families struck by flood in Svilajnac, through provision of 40 housing packages. Partner: Municipality of Svilajnac",73010,1,0,1,0,0,0,0,0
"INCREASING AND STRENGTHENING THE AGRICULTURAL PRODUCTION OF THE COMMUNITIES AFFILIATED WITH THE INDIGENOUS ASSOCIATION ÑOGUEROÎ PAVEI OGUASU will train 1,000 Myba Paraguayans in the organic cultivation of traditional crops, reforestation, conservation, beekeeping, aquaculture and animal husbandry and offer workshops in leadership and indigenous rights. Participants will also develop a weekly radio program.",31120,0,0,0,0,0,0,0,0
"GENDER EQUALITY, DISABILITY AND MOBILITY: IMPROVING THE LIVING CONDITIONS OF PEOPLE WITH DISABILITIES Mejorar la calidad de vida de las personas, mujeres con discapacidad y personas refugiadas, promoviendo acciones de sensibilización a nivel iberoamericano a través del INIBEDI.- Organización del III Congreso, Investigación y Discapacidad 2017: GÉNERO, DISCAPACIDAD Y MOVILIDAD DE PERSONAS Mérida- Organización de Jornadas de Sensibilización, que se desarrollarán por toda la geografía extremeña.",99820,0,0,0,0,0,0,0,0
"The Project for the Shelter Construction for Vulnerable Elderly at Megbare Senay Elderly and Disabilities Support Association in Shashamene Town, Oromia National Regional State THE PROJECT FOR THE SHELTER CONSTRUCTION FOR VULNERABLE ELDERLY AT MEGBARE SENAY ELDERLY AND DISABILITIES SUPPORT ASSOCIATION IN SHASHAMENE TOWN, OROM This project aims to support the vulnerable elderly with their basic human needs by constructing and equipping protective shelter.",16010,1,0,0,0,1,0,1,0
"INSTITUTO DE ARQUITETOS DO BRASIL Theme: Democratic Practice, Health & Rights. Programme: Latin America Program, Public Health Program. Description: to organize emergency resistance to the displacement of homeless drug users from the low income community in downtown São Paulo and to provide technical support to improve conditions in the Campos Elíseos and Luz neighborhoods",16010,0,1,0,0,0,0,1,0
